"FilingID","Miscellaneous"
2007992,"Section 7.B.(1).   All Funds listed in Section 7.B.(1) have Euro as their base currency. The funds gross asset value and minimum investment commitment as of December 31, 2024 are calculated in EUR. The USD equivalent values as of December 31, 2024 provided in response to Section 7.B.(1) were derived using the spot rate as of December 31, 2024, from the following values:  1. Irish Property QIAIF ICAV - Irish Property Sub-Fund 1: Gross Asset Value = EUR 354,194,605/ Minimum Investment Commitment = EUR 100,000  2. Irish Property QIAIF ICAV - Irish Property Sub-Fund 2: Gross Asset Value = EUR 135,549,578 / Minimum Investment Commitment = EUR 100,000 3. Irish Property QIAIF ICAV - Irish Property Sub-Fund  3: Gross Asset Value = EUR 107,887,379 / Minimum Investment Commitment = EUR 100,000  4. KW PRS Fund 1: Gross Asset Value = EUR 96,793,248/ Minimum Investment Commitment = EUR 2,000,000  5. KW PRS Fund 10: Gross Asset Value = EUR 148,373,661 / Minimum Investment Commitment = EUR 2,000,000  6. KW PRS Fund 11: Gross Asset Value = EUR 232,724,281/ Minimum Investment Commitment = EUR 2,000,000  7. KW PRS Fund 2: Gross Asset Value = EUR 75,459,720/ Minimum Investment Commitment = EUR 2,000,000  8. KW PRS Fund 3: Gross Asset Value = EUR 166,691,778/ Minimum Investment Commitment = EUR 2,000,000  9. KW PRS Fund 4: Gross Asset Value = EUR 76,120,375 / Minimum Investment Commitment = EUR 2,000,000  10. KW PRS Fund 5: Gross Asset Value = EUR 134,303,693 / Minimum Investment Commitment = EUR 2,000,000  11. KW PRS Fund 7: Gross Asset Value = EUR 86,489,088/ Minimum Investment Commitment = EUR 2,000,000  12. KW PRS Fund 8: Gross Asset Value = EUR 65,052,059/ Minimum Investment Commitment = EUR 2,000,000  13. KW PRS Fund 9: Gross Asset Value = EUR 101,146,329/ Minimum Investment Commitment = EUR 2,000,000  14. KW REAL ESTATE ICAV - Capital Dock Office Fund: Gross Asset Value = EUR 212,097,800 / Minimum Investment Commitment = EUR 2,000,000  15. KW REAL ESTATE ICAV - Capital Dock Residential Fund: Gross Asset Value = EUR 148,335,406 / Minimum Investment Commitment = EUR 2,000,000  16. KW Irish Real Estate Fund VI: Gross Asset Value = EUR 2,563,828/ Minimum Investment Commitment = EUR 2,000,000  17. KW Irish Real Estate Fund VIII: Gross Asset Value = EUR 28,509,400/ Minimum Investment Commitment = EUR 2,000,000 18. KW Irish Real Estate Fund XII: Gross Asset Value = EUR 72,889,493/ Minimum Investment Commitment = EUR 2,000,000  19. KW Irish Real Estate Fund XIII: Gross Asset Value = EUR 73,263,002/ Minimum Investment Commitment = EUR 2,000,000 20. KW REAL ESTATE ICAV - KW Irish Real Estate Fund XIV: Gross Asset Value = EUR 86,738,979 / Minimum Investment Commitment = EUR 2,000,000  21. Urbeo Residential Fund ICAV - Urbeo No. 1 Sub-Fund: Gross Asset Value = EUR 218,704,766 / Minimum Investment Commitment = EUR 100,000  22. KW PRS ICAV -KW PRS Fund 12: Gross Asset Value = EUR 5,563,615/ Minimum Investment Commitment = EUR 2,000,000  23. Emerald Sustainable Packaging Innovation Fund: Gross Asset Value = EUR 4,272,071 / Minimum Investment Commitment = EUR 5,000,0000  24. Emerald Industrial Innovation Fund: Gross Asset Value = EUR 9,181,014 / Minimum Investment Commitment = EUR 5,000,0000  25. Emerald Global Energy Transformation Fund: Gross Asset Value = EUR 6,701,894 / Minimum Investment Commitment = EUR 5,000,0000"
2010659,"The adviser is a non-US adviser to non-US clients.  In order to satisfy the technical IARD requirements to submit an ERA filing in reliance on the private fund adviser exemption, the system directed the adviser to include private funds in response to Schedule D, Item 7(B)(1).  These funds would otherwise not need to be listed because during the adviser's last fiscal year, these non-US funds were not offered in the United States and were not beneficially owned by any United States person."
2004860,"i just want to change the legal and business name to OS Partners LLC"
2007697,"Item 6: BP Asset Management Inc. is the owner and general partner of BPBI Alternative Investments, SPC.  Item 7(B)(1)A.1.(a) This is the only fund distributed by BPBI Alternative Investments, SPC. There has not been a name change.  Item 7(B)(1)23(g) Financial Statements are being prepared as of December 31, 2024. The financial statements will be prepared in accordance with International Financial Reporting Standards (IFRS) not in accordance with GAAP."
1999682,"The regulatory assets under management (""RAUM"") reported herein are as of June 6, 2025, and are a good faith estimate, unaudited, and subject to change upon audit. The individual listed on Schedule A, David Proman, does not have a middle name. The special purpose vehicles (?SPVs?) that serve as general partners and/or sponsors to the pooled investment vehicles listed in Section 7.B.1 are themselves identified in Section 7.A. as ?other investment advisers? in a manner consistent with the treatment of similarly situated SPVs of registered investment advisers as articulated in the no-action letter to the Business Law Section of the American Bar Association (Jan. 18, 2012).  Accordingly, such SPVs look to and rely on the Adviser?s filing with the SEC and do not submit separate Form ADVs. The affiliate listed in Section 7.A, GXD Labs, manages illiquid assets for a bankruptcy estate. Please note that with respect to Atlas Grove Special Opportunities II Master Fund (A) LP and Atlas Grove Special Opportunities II Master Fund (B) LP (collectively, the ?Master Funds?), the gross asset value (?GAV?) reflects the total capital raised by Atlas Grove Special Opportunities II (SIF) LP, Atlas Grove Special Opportunities II LP, and Atlas Grove Special Opportunities II Offshore (Cayman) LP (collectively, the ?Feeder Funds?) as of June 6, 2025. For tax and structuring purposes, the Adviser has discretion to allocate this capital to either of the Master Funds. As of the date of this ADV filing, the Adviser has not yet called on any capital and no investments have been made through the Master Funds. Accordingly, in line with the applicable instructions, the GAV for both Master Funds is the total capital raised by the Feeder Funds. However, the RAUM reported in Item 2.B does not ?double-count? the capital raised by the Feeder Funds."
2005001,"With Respect to item 7.B.(1), each of ReGen Ventures Fund 1 Trust and ReGen Ventures Fund 1 LP are parallel funds."
2008939,"Intrinsic Health Partners, L.P. has two limited partners who are non U.S. persons. One is a citizen and resident of the United Kingdom. The other is a U.S. citizen residing in the Republic of Costa Rica. The aggregate capital contributed by these two limited partners represents approximately 0.30% of Intrinsic Health Partners, L.P.?s assets under management."
