"FilingID","Miscellaneous"
1978771,"SECTION 2B SCHEDULE D -  THE TOTAL AMOUNT MANAGED FROM A U.S. LOCATION IS $0.00, DUE TO IARD SYSTEM CONSTRAINS $1.00 WAS INSERTED."
1966787,"WITH REFERENCE TO SECTION 1.L. OF SCHEDULE D PLEASE NOTE THAT WE HAVE ANSWERED THIS QUESTION ONLY WITH RESPECT TO U.S. CLIENTS.  31/03/2025: abrdn Investments Ireland Limited was unable to submit the annual updating amendment to SEC ERA Form ADV by the March 31, 2025 deadline due to insufficient funding in the Flex-Funding account. An affiliate transfer was made the morning of March 31st to remediate this is-sue; however, the transfer was processed overnight after the filing deadline. The filing was submitted immediately upon remitting the filing fee"
1961698,"There is a supplementary list of related persons which are not listed in Section 7.A of Schedule D.  Such related persons do not conduct any advisory business and Kerogen Capital II Limited believes that its relationship with those related persons is unlikely to create a conflict of interest with its clients."
1965395,"SECTION 2.B OF SCHEDULE D. NONE OF THE PRIVATE FUNDS ADVISED BY US ARE MANAGED FROM A PLACE OF BUSINESS IN THE UNITED STATES AND THEREFORE NOTWITHSTANDING THE RESPONSE PROVIDED, THE AMOUNT OF PRIVATE FUND ASSETS THAT WE MANAGE FOR PURPOSES OF ITEM 2.B IS $0. The currency of all the private funds is in euros.  As such, the amounts included under Schedule D, Section 7.B.(1), numbers 11 and 12 for each private fund are expressed in the USD equivalent of each respective amount in euros."
1973179,"JONATHAN BRAY REED AND PATRICK TAYLOR KEEFE ARE ""RELATED PERSONS"" TO ECP MANAGEMENT III, LLC AND BOTH RETAIN LAW LICENSES. HOWEVER, NEITHER MR. REED NOR MR. KEEFE ARE CURRENTLY PRACTICING LAW, HOLDING THEMSELVES OUT AS LAWYERS, OR RENDERING LEGAL SERVICES OF ANY KIND, INCLUDING ANY LEGAL SERVICES FOR OR ON BEHALF OF ECP MANAGEMENT III, LLC, ANY OF ITS AFFILIATES, OR ANY UNRELATED THIRD PARTIES. ACCORDINGLY, SECTION 7.A DOES NOT INDICATE THAT ECP MANAGEMENT III, LLC HAS A RELATED PERSON THAT IS A ""LAWYER OR LAW FIRM"" AND THUS, THEY ARE NOT LISTED IN SECTION 7.A OF SCHEDULE D."
1968778,"Newark Venture Partners Fund III, L.P. (the “Fund”) will be subject to an audit commencing with the fiscal year ending December 31, 2024. The Fund is in the process of engaging an auditor."
1972266,"Assets under management were calculated based on unaudited financial statements as of December 31, 2024."
1958948,"In reliance on the SEC Staff’s FAQ guidance, all responses in this Form ADV relate to and include all information concerning the Adviser and each special purpose entity (“SPE”) that serves as a general partner or managing member of the private funds advised by the Adviser.  All executive officer and ownership information as reported in Schedules A and B of this Form ADV is the same for the Adviser and each SPE."
1943431,"The private funds “Brave Capital LP"", ""Brave Capital Opportunity Holdings LLC-SeriesD Anthropic-MilVetAngels"", ""Brave Capital Rhino Fund LP"", and ""Brave Capital Opportunity Holdings LLC - Series H5S MilVet Angels"" completed their initial close in 2024."
1971916,"WITH RESPECT TO SCHEDULE B, THE NAMES OF CERTAIN INDIRECT INTERMEDIARY OWNERS HAVE BEEN OMITTED FOR SECURITY REASONS BUT ARE AVAILABLE TO THE SEC UPON REQUEST.  THE OWNERS AT THE TOP OF THE OWNERSHIP CHAIN ARE INCLUDED.  With respect to Schedule D Section 7.B(1) Questions 13 and 16, it is not possible for the adviser to assess properly either the number or the nationality of the underlying beneficial owners who invest in the fund through institutions.  The adviser does not have access to this information.  Therefore, the adviser has responded to these questions based upon the information to which it has access--the number and nationality of the institutional investors through which the beneficial owners invest."
1945118,"1. CORPORATE STRUCTURE -  SAGIL ASSET MANAGEMENT LTD (""SAML""), AN ENGLISH LIMITED LIABILITY COMPANY, IS THE CORPORATE PARTNER OF SAGIL CAPITAL LLP (""THE APPLICANT"").  THE APPLICANT IS REGISTERED WITH THE FINANCIAL CONDUCT AUTHORITY IN THE UNITED KINGDOM AND IS THE INVESTMENT MANAGER OF THE FUND. SAGIL ASSET MANAGEMENT (CAYMAN) LTD (""SAMC""), A CAYMAN ISLAND LIMITED LIABILITY COMPANY, OWNS 100% OF THE SHARE CAPITAL OF SAML."
1976085,"The GAV for all funds are as of 12/31/24"
1983758,"Mubadala Investment Company PJSC is wholly owned and operated by the Government of Abu Dhabi, which is a sovereign entity. The figures provided herein are based on estimated values."
1978697,"Blue Creek Capital Management Limited is a Hong Kong based Exempt Reporting Adviser with no place of business in the United States and manages no money from a place of business in the United States. The Company acts as an investment manager to the Cayman Islands domiciled fund, Blue Creek Master Fund, which are listed in Section 7.B.(1) (Private Fund Reporting)."
1978711,"The Registrant has omitted from Section 7.A. of Schedule D certain Related Persons from Schedule D, Section 7.A. with whom it (1) has no business dealings in connection with the advisory services it provides to its clients; (2) does not conduct shared operations; (3) does not refer clients or business; (4) does not share supervised persons or premises; and with whom it (5) maintains a relationship that Registrant has no reason to believe otherwise creates a conflict of interest with its clients. A copy of the list of those Related Persons that Registrant omitted from Section 7.A. of Schedule D is available upon request.    Supplemental response to Schedule B, Macquarie Group Limited the registrants ultimate parent company is an Australian global financial services organization, listed on the Australian Stock Exchange, and is not considered a public reporting company under Sections 12 or 15(d) of the Securities Exchange Act of 1934."
1978302,"The Adviser did not provide a response to Q25 of Section 7.B.1, however, please note that the Adviser uses several different banks, with no custodian agreement, but from time to time they would hold investor funds as investments are made."
1974969,"EACH OF ZEBRA CAPITAL TRAVEL GP, LTD., ZEBRA CAPITAL GP I, LTD., ZEBRA CAPITAL GP II, LTD., ZEBRA CAPITAL GP II-B, LTD. AND ZEBRA CAPITAL GP III, LTD. SHARE THE SAME COMMON DIRECT OWNERS AS LISTED UNDER SCHEDULE A FOR ZEBRA GLOBAL CAPITAL MANAGEMENT (SINGAPORE) PTE. LTD. ZEBRA MANAGEMENT CONSULTING (BEIJING) LIMITED SHARES THE SAME CONTROLLING SHAREHOLDER AS ZEBRA GLOBAL CAPITAL MANAGEMENT (SINGAPORE) PTE. LTD. ZEBRA GLOBAL CAPITAL MANAGEMENT (SINGAPORE) PTE. LTD. AND EACH OF ITS RELATED PERSONS THAT IS, OR IS DEEMED TO BE AN INVESTMENT ADVISER AND IS EXEMPT FROM REGISTRATION IN RELIANCE UPON THE PRIVATE FUND ADVISER EXEMPTION ARE TOGETHER FILING A SINGLE FORM ADV IN RELIANCE ON THE SEC’S GUIDANCE. ZEBRA GLOBAL CAPITAL MANAGEMENT (SINGAPORE) PTE. LTD. HAS EXCLUDED INFORMATION FROM SECTION 7.B.(1) OF THIS FORM ADV RELATING TO CERTAIN INVESTMENT VEHICLES THAT DO NOT ENTER INTO SEPARATE ADVISORY AGREEMENTS WITH, AND DO NOT PAY MANAGEMENT FEE TO, ZEBRA GLOBAL CAPITAL MANAGEMENT (SINGAPORE) PTE. LTD. OR ITS RELATED PERSONS."
1975136,"European Liquidity Solutions IV's legal structure has been established but the fund has not yet held a first close."
1945019,"Certain responses to Schedule D Section 7.B.(2) are omitted and are the subject of a request for confidential treatment pending with the Securities and Exchange Commission."
1971568,"Item 7.A.(16): Filer is reporting information regarding this SPE in accordance with the SEC’s FAQ posted March 26, 2012."
1950320,"ALL DOLLAR AMOUNTS IN THIS FILING ARE CALCULATED BASED ON AN EXCHANGE RATE OF 1.105 U.S. DOLLARS TO 1 EURO."
1974895,"The guarantors of the securities shall be the Trustee, DeVon Carlo and subsidiary organizations that are currently in trust form and may be incorporated hereafter. Our organization shall acquire prime brokerage and custodial services at the earliest possible convenience."
1965082,"In responding to Section 7.(B).(1) EUR has been converted to USD using an exchange rate of EUR1.00 to USD0.9241."
1968546,"THE ADVISER IS AN DIRECT SUBSIDIARY OF NATIXIS INVESTMENT MANAGERS, AN INTERNATIONAL ASSET MANAGEMENT GROUP BASED IN PARIS, FRANCE.  THE ADVISER HAS A SUPPLEMENTARY LIST, WHICH IS AVAILABLE ON REQUEST, OF ITS ""RELATED PERSONS"", WHICH ARE AFFILIATED INVESTMENT ADVISERS OR BROKER-DEALERS, INCLUDING THOSE LISTED AND THOSE NOT LISTED ON SECTION 7.A OF THIS SCHEDULE D.  A  RELATED ADVISER OR BROKER-DEALER IS NOT LISTED IN SECTION 7.A. OF THIS SCHEDULE D IF (I) THE ADVISER HAS NO BUSINESS DEALINGS WITH THE RELATED ADVISER OR BROKER-DEALER; (II) THE ADVISER DOES NOT CONDUCT JOINT OPERATIONS WITH THE  RELATED ADVISER OR BROKER-DEALER; (III) THE ADVISER DOES NOT PROVIDE ADVICE THAT IS FORMULATED (IN WHOLE OR IN PART) BY THE RELATED ADVISER OR BROKER-DEALER; (IV) THE ADVISER DOES NOT SHARE ANY SUPERVISED PERSONS OR PREMISES WITH THE RELATED ADVISER OR BROKER DEALER AND (V) THE RELATED ADVISER OR BROKER-DEALER DOES NOT PRESENT A POTENTIAL CONFLICT OF INTEREST WITH THE ADVISER'S CLIENTS.   THE ADVISER HAS RELATED PERSONS THAT ARE REGISTERED AS INVESTMENT ADVISERS WITH THE SECURITIES AND EXCHANGE COMMISSION AND WHICH SERVE AS GENERAL PARTNERS OF LIMITED PARTNERSHIPS AND MANAGERS OF LIMITED LIABILITY COMPANIES NOT LISTED IN SECTION 7.A. OF THIS SCHEDULE D.  COMPLETE AND ACCURATE INFORMATION ABOUT THOSE LIMITED PARTNERSHIPS AND LIMITED LIABILITY COMPANIES IS AVAILABLE IN THE FORM ADV OF THOSE INVESTMENT ADVISERS.  TO THE ADVISER'S KNOWLEDGE, NONE OF THE ADVISER'S CLIENTS ARE SOLICITED TO INVEST IN ANY OF THOSE LIMITED PARTNERSHIPS OR LIMITED LIABILITY COMPANIES.  CERTAIN NON-CONTROLLING HOLDERS OF BPCE: BPCE IS OWNED BY BANKS COMPRISING TWO AUTONOMOUS AND COMPLEMENTARY RETAIL BANKING NETWORKS CONSISTING OF THE CAISSE D'EPARGNE REGIONAL SAVINGS BANKS AND THE BANQUE POPULAIRE REGIONAL COOPERATIVE BANKS."
1976305,"Section 7.A of Schedule D:  Mr. Gil Besing controls the identified Related Persons.  Such Related Persons either receive compensation from the limited partnerships that they sponsor or the limited partnerships that such Related Persons sponsor have at least some limited partners that are not friends and family of Mr. Besing.  Cardinal CSP Investments GP, Inc. (“CSP GP”) maintains a supplementary list of additional Related Persons not listed on Section 7.A of Schedule D.  Including all the Related Persons of CSP GP would lead to an unduly burdensome and lengthy Form ADV filing.  Therefore, CSP GP has chosen to not list on Section 7.A Related Persons that are uncompensated general partners and/or managing members to entities whose investors generally are limited to Mr. Besing and/or friends and family of Mr. Besing.  CSP GP will provide the supplementary list of its additional Related Persons not listed in Section 7.A upon request. Section 7.B of Schedule D:  The information for each of the investment funds listed in this section is as of December 31, 2024, except for Cardinal Leander Holdings, L.P. (""CSP Leander"") which is as of January 23, 2025.  Section 7.B of Schedule D - for Cardinal CSP Investments, LP (“CSP Investments”) - Question 8: CSP Investments invests substantially all of its assets in a Maryland corporation that intends to elect to be taxed as a real estate investment trust for federal income tax purposes (the “REIT”).  The REIT intends to conduct its operations in a manner that it will not be deemed an investment company under the Investment Company Act of 1940.  Section 7.B of Schedule D for Cardinal CSP Investments - Question 15(a).  Although CSP GP has answered 0% to this Question, CSP GP is not sure whether one of CSP Investments' limited partners qualifies as a fund-of-funds.  If such limited partner does qualify as a fund-of-funds, such investor owns approximately 9% of CSP Investments.  Section 7.B of Schedule D - CSP Leander - Question 11 - All capital and   estimated profits have been returned to CSP Leander investors, other than a maximum of $300,000 that is being held back to cover representations and warranties due to the sale of the underlying asset and to cover the expenses and the costs of liquidating CSP Leander."
1975425,"ITEM 7B AND SECTION 7B1 OF SCHEDULE D: THE MINIMUM REQUIRED INVESTMENT AMOUNT IS NOT APPLICABLE TO ENFOCA ANDEAN INVESTMENTS L.P., WHICH WAS FORMED AS A PRIVATE FUND SOLELY TO RECEIVE INVESTED CAPITAL FROM INVESTORS ADVISED BY ONE OR MORE RELATED ADVISERS THAT ARE NOT AFFILIATED WITH ENFOCA ASSET MANAGEMENT, LTD."
1981467,"Caxton (Monaco) S.A.M. is an affiliate and a sub-adviser of Caxton Associates LLP and was registered with the Monaco Finanical Activities Supervisory Commission (Commission de Controle des Activites Financieres) in December 2020.  Individual EFSTATHIOS METSOVITIS named in Schedule A/C Direct Owners/Executive Officers does not have a middle name."
1945775,"Regarding Schedule D, Section 7.A. for Fusion Fund I GP, LLC, Fusion Fund II GP, LLC, Fusion Fund III GP, LLC, Fusion Fund IV GP, LLC, and Fusion Supernova Fund I GP LLC (each, a “GP Entity”), the Registrant notes that each GP Entity is the general partner to the Registrant’s private fund clients. Each GP Entity is not filing its own Form ADV but is instead relying on the interpretive guidance outlined in the “Frequently Asked Questions on Form ADV and IARD” on the SEC’s website under the heading “Reporting to the SEC as an Exempt Reporting Adviser.” That guidance essentially permits a GP entity to a private fund to rely on the Form ADV of the fund’s investment adviser. In addition, as an ERA, the Registrant is not subject to Rule 205-3 under the Advisers Act, and it is not currently subject to a state law equivalent, which would require fund investors to be qualified clients. As a result, Registrant has marked “no” in response to question 15(b) of Schedule D, Section 7.B.(1) for its private fund clients."
1975461,"This Form ADV is being filed with the California Department of Financial Protection and Innovation ((Formerly the California Department of Business Oversight) pursuant to subsection (b)(2)(B) of Section 260.204.9 of the California Code of Regulations.  The funds identified in Section 7.B(1) of this Schedule D qualify for the exclusion from the definition of investment company under Section 3(c)(5) of the Investment Company Act of 1940.  Item A.4(2) of Section 7.B(1) has been selected only because a selection of either the 3(c)(1) or 3(c)(7) is required to complete the form."
1979629,"Cold Bore Capital Management, LLC is reporting on behalf of its affiliated investment advisors, Cold Bore Capital Management II, LLC and Cold Bore Capital Management III, LLC, in accordance with the ABA No-Action Letter."
1979750,"THE FILING ADVISER AND THE RELYING ADVISERS ARE FILING A SINGLE FORM ADV IN GOOD FAITH RELIANCE ON, AND ANALOGY TO, THE AMERICAN BAR ASSOCIATION, BUSINESS LAW SECTION, SEC NO-ACTION LETTER (JANUARY 19, 2012)."
1975752,"Moved the office to the new address."
1974968,"RS Fund Manager Limited does not have a CRD so the option of employee ID was selected and the Jersey company registration number used."
1965203,"Unicorn Partners Fund Zero, L.P., Unicorn Partners Fund I, L.P., Unicorn Partners Fund II, L.P. and Unicorn Partners Fund III, L.P. have the discretion to accept investments lower than the stated minimum in their respective items 12 of Section 7.B.(1).  The figures provided under Item 11 of Section 7.B.(1) for both Unicorn Partners Fund Zero, L.P., Unicorn Partners Fund I, L.P., Unicorn Partners Fund II, L.P. and Unicorn Partners Fund III, L.P. are unaudited financials as of 31 December 2023, as neither entity has received the underlying financial statements of all of its underlying investments as necessary to perform a more precise valuation of the funds' gross asset values.   As such, these estimates are provided as reasonably accurate figures in light of meeting the filing deadline of 31 March 2024."
1977319,"ITEM 1.J(2) - THE BASE SALARIES OF STAFF OF THE INVESTMENT ADVISER, INCLUDING THE CHIEF COMPLIANCE OFFICER, MAY BE CHARGED TO THE PRIVATE FUND AS MANAGEMENT GROUP EXPENSES. FULL DETAILS OF THESE PASS-THROUGH EXPENSES ARE INCLUDED IN OFFERING MATERIALS. NB. DESPITE THE FUND BEING AN ADVISORY AFFILIATE BY VIRTUE OF THE INVESTMENT DECISION MAKING CONTROL HELD BY THE INVESTMENT ADVISER, THIS INFORMATION HAS BEEN INCLUDED FOR COMPLETENESS."
1977456,"Patria Investimentos Ltda (""Patria Ltda"") and each of its related persons that is an investment adviser or is deemed to be an investment adviser listed in Section 7.A., aside from Patria Finance Limited and Patria Investments Uruguay S.A., are together filing a single Form ADV in reliance on SEC guidance posted March 2012 after the issuance of the 2012 No-Action Letter to the American Bar Association. The responses to Section 7.A of Schedule D do not include certain related persons for which Patria Ltda (1) has no business dealings in connection with advisory services provided to clients; (2) does not conduct shared operations; (3) does not refer or receive referrals of clients or business; (4) does not share supervised persons or premises; and (5) has no reason to believe the relationship creates a conflict of interest with Patria Ltda clients. Patria Ltda will provide a list of such related persons upon request.  Certain funds may make investments through alternative investment vehicles (“AIVs”) or special purpose vehicles (“SPVs”) that are formed to facilitate investments for tax, regulatory, or other structuring reasons. The AIVs and SPVs have not been separately listed in Section 7.B.(1) of Schedule D, but rather aggregated with the fund to which they relate.  The responses to Section 7.B.(1) of Schedule D do not include any Brazilian investment vehicles into which the private funds reported in that section may ultimately invest unless such Brazilian investment vehicles have direct US investors. For Section 7.B.(1) of Schedule D, Q13-Q16, Patria Ltda. has answered by aggregating all investors to include US Person investment in investor funds managed by affiliate Patria Finance Limited."
1979927,"The entity ceased carrying on business on 1 December 2023"
1982197,"Each Series of StartEngine Private LLC, a Delaware limited liability company (“StartEngine Private”), was created to hold shares of a privately held company. These are disclosed on Section 7.B.(1) of this ADV. The underlying privately held company has not endorsed, supported, or otherwise participated with StartEngine Private, the respective Series, or any of its affiliates. A prospective investor will not directly own or hold shares of the private company but instead will own member interests in the Series, which either directly or indirectly, will hold shares in the company. StartEngine Advisers is filing as an exempt reporting adviser that manages StartEngine Private and the corresponding Series."
1975248,"Lerer Hippeau IX, LP (the ""Fund"") is subject to an audit commencing in fiscal year 2025.  The Fund is in the process of engaging an auditor."
1980354,"Please note that the regulatory assets under management reported herein are un-audited good faith estimates reported as of December 31, 2024.   The special purpose vehicles (“SPVs”) that serve as general partners and/or sponsors to the pooled investment vehicles listed in Section 7.B.(1) are themselves identified in Section 7.A. as “other investment advisers” in a manner consistent with the treatment of similarly situated SPVs of registered investment advisers as articulated in the no-action letter to the Business Law Section of the American Bar Association (Jan. 18, 2012). Accordingly, such SPVs look to and rely on the Adviser’s filing with the SEC and do not submit separate Form ADVs."
1976614,"Item 7: In Item 7, we indicated that we have a related person that is an insurance company or agency. Aon plc has various wholly-owned indirect subsidiaries which are insurance brokerage agencies and are locally registered across the globe. It is possible from time to time that conflicts of interest will arise between those affiliated insurance brokerage agencies and Marilla Investment Management Ltd. and its clients. A full list of these affiliated insurance brokerage entities are available upon request by the SEC."
1980218,"Applied Ventures, LLC is an investment adviser to the private funds listed in Section 7.B(1) of Schedule D, namely (i) Applied Ventures Innovation Fund I, L.P, (ii) Applied Ventures Innovation Fund II, L.P. and (iii) Applied Ventures ITIC Innovation Fund, L.P. Applied Ventures Investment Management GP I, LLC is the general partner of Applied Ventures Innovation Fund I, L.P; Applied Ventures Investment Management GP II, LLC is the general partner of Applied Ventures Innovation Fund II, L.P; and Applied Ventures ITIC Innovation Fund GP, LLC is the general partner of Applied Ventures ITIC Innovation Fund, L.P. Based on FAQs released by SEC, each of Applied Ventures Investment Management GP I, LLC, Applied Ventures Investment Management GP II, LLC and Applied Ventures ITIC Innovation Fund GP, LLC is satisfying its reporting obligation by including all its relevant information in this Form ADV. Each of the general partners of the private funds listed in this Form ADV and Applied Ventures, LLC are operationally integrated and conducts a single investment advisory business of advising venture funds."
1983279,"Section 7.B.(1), Question 25.(a): In March 2023, following the closure of Silicon Valley Bank by regulators, all deposits were transferred to the newly created, FDIC-operated Silicon Valley Bridge Bank, N.A. On March 26, 2023, First-Citizens Bank & Trust Company entered into a purchase and assumption agreement for all deposits and loans of Silicon Valley Bridge Bank, N.A. Depositors of Silicon Valley Bridge Bank, N.A. will automatically become depositors of First-Citizens Bank & Trust Company."
1976508,"Regulatory assets under management are reflective of the Adviser’s clients and proprietary account, and amounts reported herein are good faith estimates, unaudited and subject to change upon audit."
1973359,"ITEM 5.D, ITEM 5.F(2), ITEM 9: THE ADVISER’S ASSETS UNDER MANAGEMENT ARE REPORTED AS OF FEBRUARY 28, 2025."
1982325,"DARWIN GLOBAL MANAGEMENT, LTD. (""DARWIN"") PROVIDES SUB-ADVISORY SERVICES TO A PRIVATE POOLED INVESTMENT VEHICLE. DARWIN DID NOT COMPLETE SECTION 7.B.(2) OF SCHEDULE D WITH RESPECT TO THIS PRIVATE FUND BECAUSE THE VEHICLE IS SPONSORED BY AN ADVISOR THAT DOES NOT FILE A FORM ADV IN WHICH TO LIST THE VEHICLE."
1977529,"The Firm maintains a list of additional Related Persons who are not disclosed in Section 7.A and will make such list available upon request.  Such Related Persons have no business dealings in connection with the advisory services the Firm provides, do not refer business or clients to the Firm and the Firm does not refer business or clients to the Related Persons, and the Firm has no reason to believe that its relationship with such Related Persons creates a conflict of interest with its clients."
1977714,"My name is Christopher Torres and I am the sole owner and person for Proud American Capital LLC. I am registering with the state of California and am exempt to register with SEC."
1977041,"Patria Finance Ltd (Patria Ltd) and each of its related persons that is an investment adviser or is deemed to be an investment adviser listed in Section 7.A., aside from Patria Investimentos Ltda and Patria Investments Uruguay Agente de Valores S.A., are together filing a single Form ADV in reliance on SEC guidance posted March 2012 after the issuance of the 2012 No-Action Letter to the American Bar Association. The responses to Section 7.A of Schedule D do not include certain related persons for which Patria Ltd  (1) has no business dealings in connection with advisory services provided to clients; (2) does not conduct shared operations; (3) does not refer or receive referrals of clients or business; (4) does not share supervised persons or premises; and (5) has no reason to believe the relationship creates a conflict of interest with Patria Ltd clients. Patria Ltd will provide a list of such related persons upon request.  Certain funds may make investments through alternative investment vehicles (“AIVs”) or special purpose vehicles (“SPVs”) that are formed to facilitate investments for tax, regulatory, or other structuring reasons. The AIVs and SPVs have not been separately listed in Section 7.B.(1) of Schedule D, but rather aggregated with the fund to which they relate. The responses to Section 7.B.(1) of Schedule D do not include any Brazilian investment vehicles into which the private funds reported in that section may ultimately invest unless such Brazilian investment vehicles have direct US investors."
1979007,"SCHEDULE D,Section 7A Question 9(b) TEGEAN CAPITAL MANGEMENT, LLC AND TEGEAN PARTNERS, LLC ARE FILING A SINGLE FORM ADV IN RELIANCE ON THE POSITION EXPRESSED IN A NO-ACTION LETTER FROM THE SECURITIES AND EXCHANGE COMMISSION'S OFFICE OF INVESTMENT ADVISER REGULATION, DIVISION OF INVESTMENT MANAGEMENT, TO THE AMERICAN BAR ASSOCIATION, BUSINESS LAW SECTION, DATED JANUARY 18, 2012."
1978044,"Marigold Capital Advisers Private Limited is a sub-advisor, providing non-binding investment advice to the Gordian Capital Singapore Private Limited, a Singapore-based manager to Bodhi Tree Systems VCC and BTS Investments 1 Pte. Ltd."
