"FilingID","Initial/Amended","11.C(1)","11.C(2)","11.C(3)","11.C(4)","11.C(5)","11.D(1)","11.D(2)","11.D(3)","11.D(4)","11.D(5)","11.E(1)","11.E(2)","11.E(3)","11.E(4)","11.F.","11.G.","Filed Against","ReferenceID","Remove-Affiliate","Remove-Expired","Remove-Filed in Error","Error Explantion","Affiliate Submitted","Initiator Type","Initiated By","Principal Sanction","Other Sanctions","Date Initiated","Date Initiated Exact","Date Initiated Explanation","Case Number","Employing Firm","Principal Product","Other Product","Allegations","Status","Appeal Details","Resolution","Resolution Date","Resolution Date Exact","Resolution Date Explanation","Monetary Sanction","Monetary Amount","Revocation/Expulsion/Denial","Censure","Bar","Disgorgement/Restitution","Cease and Desist/Injunction","Suspension","Other Sanctions Ordered","Sanction Detail","Summary"
1987353,"AMENDED","","Y","","Y","Y","","","","","","","","","","","","Affiliates","1717711","","","","","Y","","","","","","","","","","","","","","","","","","","N","","N","N","N","N","N","N","","",""
1988527,"AMENDED","","","","","","","","","","","","","","","","Y","Advisory Firm","1718556","","","","","","Foreign","SECURITIES AND EXCHANGE BOARD OF INDIA (SEBI).","Other","MONETARY FINE","11/06/2023","Y","","","","Other","INDIAN REGISTERED OPEN-END FUND","SEBI ISSUED A SCN DATED NOV 06, 2023 UNDER SECTION 15-I(3) OF SEBI ACT, 1992 CALLING UPON AMIN TO SHOW CAUSE AS TO WHY THE AO ORDER DATED AUG 23, 2023 SHOULD NOT BE REVISED UNDER SECTION 15-I(3) OF SEBI ACT, 1992.","Final","","Order","07/25/2024","Y","","Y","5962.61","N","N","N","N","N","N","","MONETARY FINE.","AMIN ACQUIRED THE ENTIRE SHARE CAPITAL OF L&T INVESTMENT MANAGEMENT LIMITED (""L&T AMC""), THE ASSET MANAGEMENT COMPANY OF ERSTWHILE L&T MUTUAL FUND, ON 25 NOVEMBER 2022 AND L&T AMC WAS SUBSEQUENTLY MERGED WITH AMIN. PURSUANT TO THE SEBI INSPECTION OF L&T AMC FOR THE PERIOD 01 APRIL 2019 TO 31 MARCH 2021, SEBI HAD ISSUED SHOW CAUSE NOTICE (SCN) DATED 20 MARCH 2023 & SUPPLEMENTARY SCN DATED JUNE 16, 2023 ALLEGING L&T AMC OF NOT COMPLYING WITH SEBI CIRCULAR NO. MFD/CIR/6/73/2000 DATED 27 JULY 2000, REGULATION 25(2) AND CLAUSE 9 OF FIFTH SCHEDULE-PART A OF SEBI (MUTUAL FUNDS) REGULATIONS, 1996. ADJUDICATING OFFICER (AO) OF SEBI VIDE ITS ORDER DATED 23 AUGUST 2023, HAD DISPOSED OF THE SAID SCNS WITHOUT IMPOSING ANY PENALTY. SUBSEQUENTLY, SEBI ISSUED A SCN DATED 06 NOV 2023 UNDER SECTION 15-I(3) OF SEBI ACT, 1992 CALLING UPON AMIN TO SHOW CAUSE AS TO WHY THE AO ORDER DATED 23 AUG 2023 SHOULD NOT BE REVISED UNDER SECTION 15-I(3) OF SEBI ACT, 1992. AMIN HAS RESPONDED TO THE SCN ON 22 DECEMBER 2023. A PERSONAL HEARING ON THE MATTER WAS HELD ON 28 FEBRUARY 2024. SEBI VIDE ITS ORDER DATED 25 JULY 2024 IMPOSED A PENALTY OF INR 5 LAKHS ON AMIN. AMIN PAID THE PENALTY TO SEBI ON 1 AUGUST 2024."
1988527,"AMENDED","","","","","","","","","","","","","","","","Y","Advisory Firm","1718567","","","","","","Foreign","SECURITIES AND EXCHANGE BOARD OF INDIA","Civil and Administrative Penalt(ies) /Fine(s)","","08/04/2023","Y","","","","Other","INDIAN REGISTERED OPEN-END FUND.","THE LOCAL REGULATOR, SECURITIES AND EXCHANGE BOARD OF INDIA (SEBI) ISSUED A SHOW CAUSE NOTICE DATED 04 AUGUST 2023, TO THE ADVISORY FIRM AND THE MEMBERS OF THE FUND TRUSTEES AS ON THAT DATE, (HEREINAFTER REFERRED TO AS ""SAID TRUSTEES"") ALLEGING VIOLATION OF REGULATION 18(9) OF THE SEBI (MUTUAL FUNDS) REGULATIONS, 1996 (""THE REGULATIONS"") BY THE SAID TRUSTEES, AND VIOLATION OF CLAUSE 5 OF THE FIFTH SCHEDULE OF THE REGULATIONS AND CLAUSE 1.3.1 (C) OF SEBI CIRCULAR NO. SEBI/HO/IMD/DF2/CIR/2021/683 DATED 10 DECEMBER 2021, BY THE ADVISORY FIRM.","Final","","Vacated","05/27/2024","Y","","Y","28652.65","N","N","N","N","N","N","","SEBI DISPOSED OF THE ADJUDICATION PROCEEDINGS INITIATED VIDE SHOW CAUSE NOTICE DATED 04 AUGUST 2023.","THE ADVISORY FIRM ALONG-WITH THE SAID TRUSTEES HAVE FILED A SETTLEMENT APPLICATION DATED 05 OCTOBER 2023 UNDER THE SEBI (SETTLEMENT PROCEEDINGS) REGULATIONS, 2018 AND SEBI VIDE ITS SETTLEMENT ORDER DATED 27 MAY 2024 HAS DISPOSED OF THE ADJUDICATION PROCEEDINGS INITIATED VIDE SHOW CAUSE NOTICE DATED 04 AUGUST 2023."
1988527,"AMENDED","","","","","","","","","","","","","","","","Y","Affiliates","1718557","","","","","N","Foreign","SECURITIES AND EXCHANGE BOARD OF INDIA (SEBI)","Civil and Administrative Penalt(ies) /Fine(s)","","01/04/2024","Y","","","","Other","INDIAN DOMICILED AND MANAGED FUND","SEBI HAS ISSUED A SHOW CAUSE NOTICE DATED JANUARY 4, 2024, UNDER RULE 4 OF SEBI (PROCEDURE FOR HOLDING INQUIRY AND IMPOSING PENALTIES) RULES, 1995 TO ONE OF THE KEY EMPLOYEES OF THE AMC IN A MATTER PERTAINING TO HIS PAST EMPLOYER AND ALONG WITH OTHERS, ALLEGING VIOLATION OF SEBI REGULATIONS.","Final","","Consent","10/22/2024","Y","","Y","23193.36","N","N","N","N","N","N","","THE KEY EMPLOYEE PAID THE FULL MONETARY AMOUNT OF INR 19,50,000 (USD 23,193.36) ON OCTOBER 17, 2024.","SEBI HAS ISSUED A SHOW CAUSE NOTICE DATED JANUARY 4, 2024, UNDER RULE 4 OF SEBI (PROCEDURE FOR HOLDING INQUIRY AND IMPOSING PENALTIES) RULES, 1995 TO ONE OF THE KEY EMPLOYEES OF THE AMC IN A MATTER PERTAINING TO HIS PAST EMPLOYER AND ALONG WITH OTHERS, ALLEGING VIOLATION OF SEBI REGULATIONS. THE SAID KEY EMPLOYEE HAS FILED A SETTLEMENT APPLICATION WITH SEBI UNDER THE SEBI (SETTLEMENT PROCEEDINGS) REGULATIONS, 2018.  SEBI VIDE ITS SETTLEMENT ORDER DATED OCTOBER 22, 2024 DISPOSED OF THE MATTER UPON PAYMENT OF SETTLEMENT CHARGES OF USD 23,193.36 BY THE KEY EMPLOYEE."
1988527,"AMENDED","","","","","","","","","","","","","","","","Y","Affiliates","1718566","","","","","N","Foreign","SECURITIES & EXCHANGE BOARD OF INDIA","Civil and Administrative Penalt(ies) /Fine(s)","","04/12/2017","Y","","N.A.","HSBC SECURITIES & CAPITAL MARKETS (INDIA) PRIVATE LIMITED","Other","OPEN OFFER TRANSACTION AS A MERCHANT BANKER","THE SECURITIES AND EXCHANGE BOARD OF INDIA, THE REGULATORY AUTHORITY FOR SECURITIES AND COMMODITIES MARKET IN INDIA, BY LETTER DATED APRIL 11, 2017 INFORMED HSBC SECURITIES & CAPITAL MARKETS (INDIA) PRIVATE LIMITED (HSCI) REGARDING THE INITIATION OF ADJUDICATION PROCEEDINGS UNDER SEBI ACT, 1992.  THE MATTER WAS IN CONNECTION WITH ONE OF THE OPEN OFFER TRANSACTION MANAGED BY HSCI.","Pending","","","","","","N","","N","N","N","N","N","N","","","THE SECURITIES AND EXCHANGE BOARD OF INDIA, THE REGULATORY AUTHORITY FOR SECURITIES AND COMMODITIES MARKET IN INDIA, BY LETTER DATED APRIL 11, 2017 INFORMED HSBC SECURITIES & CAPITAL MARKETS (INDIA) PRIVATE LIMITED (HSCI) REGARDING THE INITIATION OF ADJUDICATION PROCEEDINGS UNDER SEBI ACT, 1992. THE MATTER WAS IN CONNECTION WITH ONE OF THE OPEN OFFER TRANSACTION MANAGED BY HSCI. HSCI IS AWAITING FURTHER DETAILS FROM SECURITIES AND EXCHANGE BOARD OF INDIA"
1988527,"AMENDED","","","","","","","","","Y","","","","","","","","Affiliates","1718555","","","","","Y","Other Federal","GOVERNORS OF THE FEDERAL RESERVE SYSTEM (THE ""FEDERAL RESERVE"")","Cease and Desist","MONETARY FINE","09/29/2017","Y","","17-010-B-FB;17-010-B-HC;17-010-CMP-FB;17-010-CMP-HC","","Other","FOREIGN EXCHANGE","IN SEPTEMBER 2017, FOLLOWING THE CONCLUSION OF THE US FEDERAL RESERVE BOARD'S REVIEW OF THE EFFECTIVENESS OF HSBC'S FX PRACTICES DURING THE PERIOD OF OCTOBER 2008 THROUGH OCTOBER 2013, HSBC HOLDINGS PLC AND HSBC NORTH AMERICA HOLDINGS INC. ENTERED INTO A CONSENT ORDER REGARDING CERTAIN DEFICIENCIES IN HSBC'S CONTROL AND OVERSIGHT OVER ITS FX BUSINESS. HSBC THROUGH VARIOUS SUBSIDIARIES OF HOLDINGS, INCLUDING HBEU AND HBUS, LACKED ADEQUATE GOVERNANCE, RISK MANAGEMENT, COMPLIANCE AND AUDIT POLICIES AND PROCEDURES TO ENSURE THAT HSBC'S COVERED FX ACTIVITIES COMPLIED WITH SAFE AND SOUND BANKING PRACTICES AND APPLICABLE INTERNAL POLICIES. ON AUGUST 18, 2023, THE FEDERAL RESERVE BOARD CONCLUDED THAT HSBC WAS IN FULL COMPLIANCE AND TERMINATED THE CONSENT ORDER.","Final","","Consent","08/18/2023","Y","","Y","175296000","N","N","N","N","Y","N","","PURSUANT TO THE FEDERAL DEPOSIT INSURANCE ACT, THE FEDERAL RESERVE ISSUED A CONSENT ORDER TO CEASE AND DESIST AND ASSESSMENT OF A CIVIL MONEY PENALTY (THE ""ORDER""). ACCORDINGLY, HSBC SHALL CEASE AND DESIST WITH RESPECT TO THE DEFICIENCIES DOCUMENTED IN THE ORDER AND TAKE AFFIRMATIVE ACTION RELATING TO INTERNAL CONTROLS AND COMPLIANCE OVERSIGHT OVER CERTAIN MARKETS ACTIVITY. ON SEPTEMBER 29, 2017, HSBC PAID A CIVIL MONEY PENALTY IN THE AMOUNT OF $175,296,000.","IN SEPTEMBER 2017, FOLLOWING THE CONCLUSION OF THE US FEDERAL RESERVE BOARD'S REVIEW OF THE EFFECTIVENESS OF HSBC'S FX PRACTICES DURING THE PERIOD OF OCTOBER 2008 THROUGH OCTOBER 2013, HSBC HOLDINGS PLC AND HSBC NORTH AMERICA HOLDINGS INC. ENTERED INTO A CONSENT ORDER REGARDING CERTAIN DEFICIENCIES IN HSBC'S CONTROL AND OVERSIGHT OVER ITS FX BUSINESS. HSBC THROUGH VARIOUS SUBSIDIARIES OF HOLDINGS, INCLUDING HBEU AND HBUS, LACKED ADEQUATE GOVERNANCE, RISK MANAGEMENT, COMPLIANCE AND AUDIT POLICIES AND PROCEDURES TO ENSURE THAT HSBC'S COVERED FX ACTIVITIES COMPLIED WITH SAFE AND SOUND BANKING PRACTICES AND APPLICABLE INTERNAL POLICIES. ON AUGUST 18, 2023, THE FEDERAL RESERVE BOARD CONCLUDED THAT HSBC WAS IN FULL COMPLIANCE AND TERMINATED THE CONSENT ORDER."
1988527,"AMENDED","","","","","","","","","Y","","","","","","","","Affiliates","1718562","","Y","","","N","Other Federal","OCC; FRB; OFAC; US DEPT OF JUSTICE; UK FCA; US ATTY'S OFF FOR THE EASTERN DIST OF NY & NORTHERN DIST OF WV; NY COUNTY DIST ATTY.","Cease and Desist","MONETARY/FINE","12/11/2012","Y","","12-062-B-FB-; 12-062-B-FB; 12-062-CMP-HC; AA-EC-12-112; AA-EC-2012-140","HSBC HOLDINGS PLC","No Product","","US REGULATORY AUTHORITIES' INVESTIGATIONS REGARDING INADEQUATE COMPLIANCE WITH ANTI-MONEY LAUNDERING AND SANCTIONS LAWS","Final","","Other","12/11/2012","Y","","Y","1921000000","N","N","N","N","Y","N","ON DEC 11, 2012, HSBC HOLDINGS PLC ANNOUNCED THAT HSBC BANK USA, NA (""HBUS""), HAD IN RELATION TO INVESTIGATIONS REGARDING INADEQUATE COMPLIANCE WITH ANTI-MONEY LAUNDERING AND SANCTIONS LAWS ENTERED INTO (I) AN AGREEMENT & CONSENT ORDERS WITH THE OCC; (II) A CONSENT & ASSESSMENT WITH THE US DEPARTMENT OF THE TREASURY'S FINANCIAL CRIMES ENFORCEMENT NETWORK; (III) A DEFERRED PROSECUTION AGREEMENT (""DPA"") AMONG HBUS, HSBC HOLDINGS PLC, THE US DEPT OF JUSTICE, THE US ATTY'S OFFICE FOR THE EASTERN DIST OF NY AND THE US ATTY'S OFFICE FOR THE NORTHERN DIST OF WEST VIRGINIA; AND (IV) HSBC HOLDINGS PLC ENTERED INTO A DPA WITH THE DIST ATTY OF THE COUNTY OF NY. HSBC HOLDINGS PLC ALSO CONSENTED TO A CEASE & DESIST ORDER AND ALONG WITH HSBC NORTH AMERICA HOLDINGS CONSENTED TO A MONETARY PENALTY ORDER WITH THE FRB. IN ADDITION, HSBC HOLDINGS PLC ENTERED INTO AN AGREEMENT WITH OFAC REGARDING HISTORICAL TRANSACTIONS INVOLVING PARTIES SUBJECT TO OFAC SANCTIONS AND AN UNDERTAKING WITH THE UK FINANCIAL CONDUCT AUTHORITY (""FCA""), TO COMPLY WITH CERTAIN FORWARD-LOOKING AML- AND SANCTIONS-RELATED OBLIGATIONS. HSBC BANK USA, NA MAY NOT DIRECTLY OR INDIRECTLY ACQUIRE CONTROL OF, OR HOLD AN INTEREST IN, ANY NEW FINANCIAL SUBSIDIARY, NOR COMMENCE A NEW ACTIVITY IN ITS EXISTING FINANCIAL SUBSIDIARY, UNLESS IT RECEIVES PRIOR APPROVAL FROM THE OCC. ON 1 JULY 2013, THE US DISTRICT COURT FOR THE EASTERN DISTRICT OF NY APPROVED THE US DPA AND RETAINED AUTHORITY TO OVERSEE IMPLEMENTATION OF THAT AGREEMENT. UNDER THE AGREEMENTS WITH THE DOJ, FCA AND FRB, AN INDEPENDENT MONITOR (WHO IS, FOR FCA PURPOSES, A 'SKILLED PERSON' UNDER SECTION 166 OF THE FINANCIAL SERVICES AND MARKETS ACT) WILL EVALUATE AND REGULARLY ASSESS THE EFFECTIVENESS OF HSBC'S AML AND SANCTIONS COMPLIANCE FUNCTION AND HSBC'S PROGRESS IN IMPLEMENTING ITS REMEDIAL OBLIGATIONS UNDER THE AGREEMENTS. IN DECEMBER 2017, THE DPA EXPIRED AND THE CHARGES DEFERRED BY THE DPA WERE DISMISSED.","ON DEC 11, 2012, HSBC HOLDINGS PLC ANNOUNCED THAT HSBC BANK USA, NA (""HBUS""), HAD IN RELATION TO INVESTIGATIONS REGARDING INADEQUATE COMPLIANCE WITH ANTI-MONEY LAUNDERING AND SANCTIONS LAWS ENTERED INTO (I) AN AGREEMENT & CONSENT ORDERS WITH THE OCC; (II) A CONSENT & ASSESSMENT WITH THE US DEPARTMENT OF THE TREASURY'S FINANCIAL CRIMES ENFORCEMENT NETWORK; (III) A DEFERRED PROSECUTION AGREEMENT (""DPA"") AMONG HBUS, HSBC HOLDINGS PLC, THE US DEPT OF JUSTICE, THE US ATTY'S OFFICE FOR THE EASTERN DIST OF NY AND THE US ATTY'S OFFICE FOR THE NORTHERN DIST OF WEST VIRGINIA; AND (IV) HSBC HOLDINGS PLC ENTERED INTO A DPA WITH THE DIST ATTY OF THE COUNTY OF NY. HSBC HOLDINGS PLC ALSO CONSENTED TO A CEASE & DESIST ORDER AND ALONG WITH HSBC NORTH AMERICA HOLDINGS CONSENTED TO A MONETARY PENALTY ORDER WITH THE FRB. IN ADDITION, HSBC HOLDINGS PLC ENTERED INTO AN AGREEMENT WITH OFAC REGARDING HISTORICAL TRANSACTIONS INVOLVING PARTIES SUBJECT TO OFAC SANCTIONS AND AN UNDERTAKING WITH THE UK FINANCIAL CONDUCT AUTHORITY (""FCA""), TO COMPLY WITH CERTAIN FORWARD-LOOKING AML- AND SANCTIONS-RELATED OBLIGATIONS. HSBC BANK USA, NA MAY NOT DIRECTLY OR INDIRECTLY ACQUIRE CONTROL OF, OR HOLD AN INTEREST IN, ANY NEW FINANCIAL SUBSIDIARY, NOR COMMENCE A NEW ACTIVITY IN ITS EXISTING FINANCIAL SUBSIDIARY, UNLESS IT RECEIVES PRIOR APPROVAL FROM THE OCC. ON 1 JULY 2013, THE US DISTRICT COURT FOR THE EASTERN DISTRICT OF NY APPROVED THE US DPA AND RETAINED AUTHORITY TO OVERSEE IMPLEMENTATION OF THAT AGREEMENT. UNDER THE AGREEMENTS WITH THE DOJ, FCA AND FRB, AN INDEPENDENT MONITOR (WHO IS, FOR FCA PURPOSES, A 'SKILLED PERSON' UNDER SECTION 166 OF THE FINANCIAL SERVICES AND MARKETS ACT) WILL EVALUATE AND REGULARLY ASSESS THE EFFECTIVENESS OF HSBC'S AML AND SANCTIONS COMPLIANCE FUNCTION AND HSBC'S PROGRESS IN IMPLEMENTING ITS REMEDIAL OBLIGATIONS UNDER THE AGREEMENTS. IN DECEMBER 2017, THE DPA EXPIRED AND THE CHARGES DEFERRED BY THE DPA WERE DISMISSED.","ON DECEMBER 11, 2012, HSBC HOLDINGS PLC ANNOUNCED THAT HSBC BANK USA, NA, HAD IN RELATION TO INVESTIGATIONS REGARDING INADEQUATE COMPLIANCE WITH ANTI-MONEY LAUNDERING AND SANCTIONS LAWS ENTERED INTO (I) AN AGREEMENT AND CONSENT ORDERS WITH THE OCC; (II) A CONSENT AND ASSESSMENT WITH THE UNITED STATES DEPARTMENT OF THE TREASURY'S FINANCIAL CRIMES ENFORCEMENT NETWORK; (III) A DEFERRED PROSECUTION AGREEMENT (""DPA"") AMONG HSBC BANK USA, NA, HSBC HOLDINGS PLC, THE UNITED STATES DEPARTMENT OF JUSTICE (THE ""DOJ""), THE UNITED STATES ATTORNEY'S OFFICE FOR THE EASTERN DISTRICT OF NEW YORK AND THE UNITED STATES ATTORNEY'S OFFICE FOR THE NORTHERN DISTRICT OF WEST VIRGINIA; AND (IV) HSBC HOLDINGS PLC ENTERED IN TO A DPA WITH THE DISTRICT ATTORNEY OF THE COUNTY OF NEW YORK. HSBC HOLDINGS PLC ALSO CONSENTED TO A CEASE AND DESIST ORDER AND ALONG WITH HSBC NORTH AMERICA HOLDINGS CONSENTED TO A MONETARY PENALTY ORDER WITH THE BOARD OF GOVERNORS OF THE FEDERAL RESERVE SYSTEM (""FRB""). IN ADDITION, HSBC HOLDINGS PLC ENTERED INTO AN AGREEMENT WITH THE OFFICE OF FOREIGN ASSETS CONTROL (""OFAC"") REGARDING HISTORICAL TRANSACTIONS INVOLVING PARTIES SUBJECT TO OFAC SANCTIONS AND AN UNDERTAKING WITH THE UK FINANCIAL CONDUCT AUTHORITY (""FCA""), TO COMPLY WITH CERTAIN FORWARD-LOOKING AML- AND SANCTIONS-RELATED OBLIGATIONS. UNDER THESE AGREEMENTS, HSBC HOLDINGS PLC AND ITS SUBSIDIARIES HAVE MADE PAYMENTS TOTALING $1.921 BILLION. ON JULY 1, 2013, THE US DISTRICT COURT FOR THE EASTERN DISTRICT OF NEW YORK APPROVED THE US DPA AND RETAINED AUTHORITY TO OVERSEE IMPLEMENTATION OF THAT AGREEMENT. UNDER THE AGREEMENTS WITH THE DOJ, FCA AND FRB, AN INDEPENDENT MONITOR WILL EVALUATE AND REGULARLY ASSESS THE EFFECTIVENESS OF HSBC'S AML AND SANCTIONS COMPLIANCE FUNCTION AND HSBC'S PROGRESS IN IMPLEMENTING ITS REMEDIAL OBLIGATIONS UNDER THE AGREEMENTS. IN DECEMBER 2017, THE DPA EXPIRED AND THE CHARGES DEFERRED BY THE DPA WERE DISMISSED."
1988527,"AMENDED","","","","","","","","","Y","","","","","","","","Affiliates","1718564","","","","","N","Foreign","SECURITIES AND EXCHANGE BOARD OF INDIA","Civil and Administrative Penalt(ies) /Fine(s)","","06/14/2022","Y","","N.A.","L&T INVESTMENT MANAGEMENT LIMITED","Mutual Fund(s)","","THE INDIAN REGULATOR, SECURITIES & EXCHANGE BOARD OF INDIA HAD ISSUED A SHOW CAUSE NOTICE DATED 14 JUNE 2022 TO LTIML, AN ADVISORY AFFILIATE AND CERTAIN EMPLOYEES OF LTIML ALLEGING CERTAIN DEFICIENCIES AND NON-COMPLIANCES WITH RESPECT TO CERTAIN PROVISIONS OF SEBI (MUTUAL FUNDS) REGULATIONS, 1996 IN RELATION TO THE THEMATIC INSPECTION OF INTER-SCHEME TRANSFERS OF THE LTIML IN THE PERIOD FROM 01 APRIL 2017 TO 30 JUNE 2018.","Final","","Settled","02/17/2023","Y","","Y","141000","N","N","N","N","N","N","","SEBI HAS ACCEPTED THE SETTLEMENT TERMS AND PAYMENT OF THE SETTLEMENT AMOUNT WAS MADE, WHICH WAS ABOUT USD 141,000. SUBSEQUENTLY, SEBI ISSUED THE SETTLEMENT ORDER ON 17 FEBRUARY 2023 AND DISPOSED THE SHOW CAUSE NOTICE.","HSBC ASSET MANAGEMENT (INDIA) PRIVATE LIMITED ACQUIRED THE ENTIRE SHARE CAPITAL OF L&T INVESTMENT MANAGEMENT LIMITED (""LTIML""), THE ASSET MANAGEMENT COMPANY OF ERSTWHILE L&T MUTUAL FUND, ON 25 NOVEMBER 2022 (""LTMF ACQUISITION""). SEBI HAD ISSUED A SHOW CAUSE NOTICE DATED 14 JUNE 2022 TO LTIML AND CERTAIN EMPLOYEES OF LTIML ALLEGING CERTAIN DEFICIENCIES AND NON-COMPLIANCES WITH RESPECT TO CERTAIN PROVISIONS OF SEBI (MUTUAL FUNDS) REGULATIONS, 1996 IN RELATION TO THE THEMATIC INSPECTION OF INTER-SCHEME TRANSFERS OF THE LTIML IN THE PERIOD FROM 01 APRIL 2017 TO 30 JUNE 2018.  LTIML ALONG WITH THE SAID EMPLOYEES HAD FILED THEIR RESPONSE TO THE SHOW CAUSE NOTICE ON 21 SEPTEMBER 2022. LTIML AND THE SAID EMPLOYEES HAD ALSO FILED A SETTLEMENT APPLICATION DATED 29 JULY 2022 ON 02 AUGUST 2022 UNDER THE SEBI (SETTLEMENT PROCEEDINGS) REGULATIONS, 2018. WHICH WAS SUBSEQUENTLY REVISED ON 08 DECEMBER 2022. SEBI HAS ACCEPTED THE SETTLEMENT TERMS AND PAYMENT OF THE SETTLEMENT AMOUNT WAS MADE, WHICH WAS ABOUT USD 141,000. SUBSEQUENTLY, SEBI ISSUED THE SETTLEMENT ORDER ON 17 FEBRUARY 2023 AND DISPOSED OFF THE SHOW CAUSE NOTICE."
1988527,"AMENDED","","","","","","","Y","","","","","","","","","","Affiliates","1718560","","","","","N","Foreign","THE EUROPEAN COMMISSION (""THE COMMISSION"")","Civil and Administrative Penalt(ies) /Fine(s)","","12/02/2021","Y","","","HSBC BANK PLC","Other","FOREIGN EXCHANGE (FOREX) SPOT TRADING","THE EUROPEAN COMMISSION IN DECEMBER 2021 COMPLETED A CARTEL INVESTIGATION INTO THE FOREIGN EXCHANGE ('FOREX') SPOT TRADING MARKET BY IMPOSING FINES ON FIVE FINANCIAL INSTITUTIONS, INCLUDING HSBC HOLDINGS PLC. THE COMMISSION'S INVESTIGATION FOCUSED ON THE TRADING OF THE G10 CURRENCIES. THE COMMISSION'S INVESTIGATION REVEALED THAT SOME TRADERS IN CHARGE OF THE FOREX SPOT TRADING OF G10 CURRENCIES, ACTING ON BEHALF OF THE FINED BANKS, EXCHANGED SENSITIVE INFORMATION AND TRADING PLANS, AND OCCASIONALLY COORDINATED THEIR TRADING STRATEGIES THROUGH AN ONLINE PROFESSIONAL CHATROOM. THE COMMISSION FOUND THAT THESE INFORMATION EXCHANGES ENABLED THE TRADERS TO MAKE INFORMED MARKET DECISIONS ON WHETHER AND WHEN TO SELL OR BUY THE CURRENCIES THEY HAD  IN THEIR PORTFOLIOS, AS OPPOSED TO A SITUATION WHERE TRADERS ACTING INDEPENDENTLY FROM EACH OTHER TAKE AN INHERENT RISK IN TAKING THESE DECISIONS. OCCASIONALLY, THESE INFORMATION EXCHANGES ALSO ALLOWED THE TRADERS TO IDENTIFY OPPORTUNITIES FOR COORDINATION, FOR EXAMPLE THROUGH A PRACTICE CALLED ""STANDING DOWN"", WHEREBY SOME OF THEM WOULD TEMPORARILY REFRAIN FROM TRADING TO AVOID INTERFERING WITH ANOTHER TRADER. HSBC COOPERATED WITH THE INVESTIGATION AND HAS PAID THE FINE NOTED BELOW.","Final","","Settled","12/02/2021","N","FINE ANNOUNCED BY COMMISSION ON 12/2/21.  HSBC HOLDINGS CAUSED THE FINE TO BE PAID WITHIN IN THE TIMEFRAME DIRECTED BY THE COMMISSION.","Y","196954958","N","N","N","N","N","N","","FINE ANNOUNCED BY THE COMMISSION ON 12/2/21.","HSBC HOLDINGS CAUSED THE FINE TO BE PAID WITHIN IN THE TIMEFRAME DIRECTED BY THE COMMISSION."
1988527,"AMENDED","","","","","","","Y","","","","","","","","","","Affiliates","1718561","","Y","","","N","Foreign","MONETARY AUTHORITY OF SINGAPORE (""MAS""); ACCOUNTING AND CORPORATE REGULATORY AUTHORITY (""ACRA"")","Other","WARNING AND FINES","07/30/2012","N","EXACT DATE IS NOT AVAILABLE TO THE ADVISORY FIRM","","","No Product","","FAILURE TO NOTIFY SINGAPORE EXCHANGE AND EU YAN SANG INTERNATIONAL LIMITED (""EYS"") ON SUBSTANTIAL SHAREHOLDING IN EYS SHARES","Final","","Other","07/30/2012","Y","","Y","615","N","N","N","N","N","N","","WARNING AND MONETARY/FINE AMOUNT OF $410 AND $205 TO MAS AND ACRA RESPECTIVELY","IT WAS FINALISED AND RESOLVED ON 7/30/2012 WITH DETAILS DESCRIBED ABOVE"
1988527,"AMENDED","","","","","","","Y","","","","","","","","","","Affiliates","1718565","","Y","","","N","Other Federal","US FEDERAL DEPOSIT INSURANCE CORPORATION","","","04/21/2011","Y","","11MD2262(NRB)","","No Product","","ON 21 APRIL 2011, HSBC HOLDINGS PLC WAS SERVED WITH A REQUEST FOR INFORMATION BY THE EC SEEKING GENERAL INFORMATION ABOUT THE HSBC GROUP AS WELL AS INFORMATION AND DOCUMENTS RELATING TO COMMUNICATIONS BETWEEN HSBC HOLDINGS PLC AND OTHER PANEL BANKS / CASH BROKERS BETWEEN 2007 AND 2010 REGARDING THE SETTING OF YEN LIBOR AND TRADING POSITIONS WHICH MAY BE AFFECTED BY IT. VARIOUS REGULATORS AND COMPETITION AND ENFORCEMENT AUTHORITIES AROUND THE WORLD INCLUDING IN THE UK, THE US, CANADA, THE EU, SWITZERLAND AND ASIA, ARE CONDUCTING INVESTIGATIONS AND REVIEWS RELATED TO CERTAIN PAST SUBMISSIONS MADE BY PANEL BANKS AND THE PROCESSES FOR MAKING SUBMISSIONS IN CONNECTION WITH THE SETTING OF LONDON INTERBANK OFFERED RATES (""LIBOR""), EUROPEAN INTERBANK OFFERED RATES (""EURIBOR"") AND OTHER BENCHMARK INTEREST AND FOREIGN EXCHANGE RATES. SEVERAL OF THESE PANEL BANKS HAVE REACHED SETTLEMENTS WITH VARIOUS REGULATORY AUTHORITIES. AS CERTAIN HSBC ENTITIES ARE MEMBERS OF SUCH PANELS, HSBC AND/OR ITS SUBSIDIARIES HAVE BEEN THE SUBJECT OF REGULATORY DEMANDS FOR INFORMATION AND ARE COOPERATING WITH THOSE INVESTIGATIONS AND REVIEWS. BASED ON THE FACTS CURRENTLY KNOWN, THERE IS A HIGH DEGREE OF UNCERTAINTY AS TO THE RESOLUTION OF THESE REGULATORY INVESTIGATIONS AND REVIEWS, INCLUDING THE TIMING. THE POTENTIAL IMPACT AND SIZE OF ANY FINES OR PENALTIES THAT COULD BE IMPOSED ON HSBC CANNOT BE MEASURED RELIABLY. IN ADDITION, HSBC AND OTHER PANEL BANKS HAVE BEEN NAMED AS DEFENDANTS IN PRIVATE LAWSUITS FILED IN THE US WITH RESPECT TO THE SETTING OF LIBOR, INCLUDING PUTATIVE CLASS ACTION LAWSUITS WHICH HAVE BEEN CONSOLIDATED BEFORE THE US DISTRICT COURT FOR THE SOUTHERN DISTRICT OF NEW YORK. THE COMPLAINTS IN THOSE ACTIONS ASSERT CLAIMS AGAINST HSBC AND OTHER PANEL BANKS UNDER VARIOUS US LAWS INCLUDING US ANTITRUST LAWS, THE US COMMODITIES EXCHANGE ACT, AND STATE LAW. BASED ON THE FACTS CURRENTLY KNOWN, IT IS NOT PRACTICABLE AT THIS TIME FOR HSBC TO PREDICT THE RESOLUTION OF THESE PRIVATE LAWSUITS, INCLUDING THE TIMING AND POTENTIAL IMPACT ON HSBC.","Pending","","","","","","N","","N","N","N","N","N","N","","","VARIOUS REGULATORS AND COMPETITION AND ENFORCEMENT AUTHORITIES AROUND THE WORLD INCLUDING IN THE UK, THE US, CANADA, THE EU, SWITZERLAND AND ASIA, ARE CONDUCTING INVESTIGATIONS AND REVIEWS RELATED TO CERTAIN PAST SUBMISSIONS MADE BY PANEL BANKS AND THE PROCESSES FOR MAKING SUBMISSIONS IN CONNECTION WITH THE SETTING OF LONDON INTERBANK OFFERED RATES (""LIBOR""), EUROPEAN INTERBANK OFFERED RATES (""EURIBOR"") AND OTHER BENCHMARK INTEREST AND FOREIGN EXCHANGE RATES. SEVERAL OF THESE PANEL BANKS HAVE REACHED SETTLEMENTS WITH VARIOUS REGULATORY AUTHORITIES. AS CERTAIN HSBC ENTITIES ARE MEMBERS OF SUCH PANELS, HSBC AND/OR ITS SUBSIDIARIES HAVE BEEN THE SUBJECT OF REGULATORY DEMANDS FOR INFORMATION AND ARE COOPERATING WITH THOSE INVESTIGATIONS AND REVIEWS. BASED ON THE FACTS CURRENTLY KNOWN, THERE IS A HIGH DEGREE OF UNCERTAINTY AS TO THE RESOLUTION OF THESE REGULATORY INVESTIGATIONS AND REVIEWS, INCLUDING THE TIMING. THE POTENTIAL IMPACT AND SIZE OF ANY FINES OR PENALTIES THAT COULD BE IMPOSED ON HSBC CANNOT BE MEASURED RELIABLY. IN ADDITION, HSBC AND OTHER PANEL BANKS HAVE BEEN NAMED AS DEFENDANT IN PRIVATE LAWSUITS FILED IN THE US WITH RESPECT TO THE SETTING OF LIBOR. INCLUDING PUTATIVE CLASS ACTION LAWSUITS. WHICH HAVE BEEN CONSOLIDATED BEFORE THE US DISTRICT COURT FOR THE SOUTHERN DISTRICT OF NEW YORK. THE COMPLAINTS IN THOSE ACTIONS ASSERT CLAIMS AGAINST HSBC AND OTHER PAEL BANKS UNDER VARIOUS US LAWS INCLUDING US ANTITRUST LAWS, THE US COMMODITIES EXCHANGE ACT, AND STATE LAW. BASED ON THE FACTS CURRENTLY KNOWN, IT IS NOT PRACTICABLE AT THE TIME FOR HSBC TO PREDICT THE RESOLUTION OF THESE PRIVATE LAWSUITS, INCLUDING THE TIMING AND POTENTIAL IMPACT ON HSBC."
