"FilingID","Initial/Amended","11.H(1)(a)","11.H(1)(b)","11.H(1)(c)","11.H(2)","Filed Against","ReferenceID","Remove-Affiliate","Remove-Expired","Remove-Filed in Error","Error Explantion","Affiliate Submitted","Initiated By","Relief Sought","Other Relief Sought","Filing Date","Filing Date Exact","Filing Date Explanation","Principal Product","Other Product","Court","Employing Firm","Allegations","Status","Appeal Details","Date Served","Date Served Exact","Date Served Explanation","Resolution Type","Resolution Date","Resolution Date Exact","Resolution Date Explanation","Monetary Sanction","Monetary Amount","Revocation/Expulsion/Denial","Censure","Bar","Disgorgement/Restitution","Cease and Desist/Injunction","Suspension","Other Sanctions","Sanction Detail","Summary"
1949920,"AMENDED","Y","","","","Affiliates","1699473","","","","","N","XPO LOGISTICS, INC. AND XPO LOGISTICS FRANCE","Injunction","MONEY DAMAGES","07/08/2015","Y","","Equity Listed (Common & Preferred Stock)","","PARIS COMMERCIAL COURT; PARIS, FRANCE; 2015000402","","THIS DRP DESCRIBES CIVIL LITIGATION RELATED TO ELLIOTT'S (AS HEREINAFTER DEFINED) DECISION NOT TO TENDER ITS SHARES OF NORBERT DENTRESSANGLE SA (""ND"") IN A TENDER OFFER CONDUCTED BY XPO LOGISTICS, INC. AND XPO LOGISTICS FRANCE (COLLECTIVELY, ""XPO""). XPO HAS ALLEGED THAT ELLIOTT CAPITAL ADVISORS, L.P. AND CERTAIN FUNDS MANAGED BY ELLIOTT MANAGEMENT CORPORATION (TOGETHER WITH THEIR AFFILIATES, ""ELLIOTT"") ARE IN VIOLATION OF FRENCH LAW SURROUNDING TENDER OFFERS AND THAT XPO WOULD SUFFER SIGNIFICANT DAMAGE AS A RESULT. ELLIOTT HELD APPROXIMATELY 7.6% OF THE OUTSTANDING SHARES OF ND. ELLIOTT HAS ALLEGED THAT XPO LIKELY HAD TAKEN OR HAD IMMINENT PLANS TO TAKE ACTION THAT WAS MANIFESTLY CONTRARY TO THE CORPORATE INTERESTS OF ND AND THE MINORITY SHAREHOLDERS OF ND IN ORDER TO PURSUE THE PROPOSED MERGER AND THEREBY IGNORE THAT XPO DOES NOT OWN 100% OF ND'S SHARES.","Final","","","","","Settled","11/28/2019","Y","","","","","","","","","","SETTLED.","SETTLED.","ON JULY 8, 2015, THE PARIS COMMERCIAL COURT ISSUED AN EX PARTE ORDER IN RESPONSE TO A CIVIL COMPLAINT FILED BY XPO THAT, AMONG OTHER THINGS, TEMPORARILY BARRED ELLIOTT FROM TRANSFERRING ITS EQUITY INTEREST IN ND TO ANY THIRD PARTY OTHER THAN XPO, UNTIL THE COURT ISSUED A FURTHER ORDER AT OR FOLLOWING A HEARING ON JULY 23, 2015. ON JULY 16, 2015, THE PARIS COMMERCIAL COURT ISSUED AN EX PARTE ORDER AT THE REQUEST OF ELLIOTT THAT, AMONG OTHER THINGS, TEMPORARILY BARRED XPO FROM CARRYING OUT ANY OF ITS CONTEMPLATED TRANSACTIONS WITH ND, INCLUDING PURSUING THE PROPOSED MERGER WITH ND, UNTIL THE COURT ISSUED A FURTHER ORDER AT OR FOLLOWING THE JULY 23 HEARING. ON JULY 29, 2015, THE PARIS COMMERCIAL COURT LIFTED THE RESTRICTIONS CONTAINED IN BOTH EX PARTE ORDERS, AND ADDED ND TO AND REMOVED THE LIVERPOOL LIMITED PARTNERSHIP FROM THE PROCEEDINGS, AND DENIED CERTAIN OTHER RELIEF REQUESTED BY THE PARTIES. ON MAY 2, 2016, ELLIOTT FILED AN ACTION ""UT SINGULI,"" IN THE NATURE OF A DERIVATIVE ACTION, ON BEHALF OF ND (RENAMED ""XPO LOGISTICS EUROPE"") AGAINST CERTAIN PRESENT AND FORMER EXECUTIVES AND/OR DIRECTORS OF ND. ON NOVEMBER 28, 2019, ELLIOTT SETTLED THESE PROCEEDINGS AND OBTAINED A FULL AND COMPLETE RELEASE. THE MATTER IS NOW CONCLUDED."
1949961,"AMENDED","","","","Y","Firm and Affiliates","1699510","","","","","Y","THE FEDERAL DEPOSIT INSURANCE CORPORATION IN ITS CAPACITY AS THE RECEIVER FOR 19 FAILED BANKING INSTITUTIONS.","Money Damages (Private/Civil Complaint)","","03/10/2017","Y","","","LIBOR REFERENCE RATE (I.E THE DEFENDANT BANK'S PARTICIPATION IN THE LIBOR SETTING PROCESS WHICH ALLEGEDLY IMPACTED ON THE CLAIMANT BANKS' BANKING PRODUCTS).","FL-2017-000002","","CIVIL CLAIM AGAINST THE GROUP (TOGETHER WITH A NUMBER OF OTHER BANKS AND THE BRITISH BANKERS ASSOCIATION) BEING PURSUED BY THE FEDERAL DEPOSIT INSURANCE CORPORATION IN ITS CAPACITY AS THE RECEIVER FOR 19 FAILED BANKING INSTITUTIONS. THE CLAIM CONTAINS ALLEGATIONS OF FRAUDULENT MISREPRESENTATION AND BREACH OF COMPETITION LAW BY THE GROUP IN RELATION TO USD LIBOR. FDIC HAS PROVISIONALLY VALUED ITS CLAIM AT $214.1M. THIS CLAIM IS BEING PURSUED AGAINST THE GROUP IN PARALLEL IN BOTH THE ENGLISH AND THE US COURTS (EXACT DEFENDANTS DIFFER BETWEEN THE US AND UK PROCEEDINGS).","Pending","","07/07/2017","Y","","","","","","","","","","","","","","","","CIVIL CLAIM AGAINST THE GROUP (TOGETHER WITH A NUMBER OF OTHER BANKS AND THE BRITISH BANKERS ASSOCIATION) BEING PURSUED BY THE FEDERAL DEPOSIT INSURANCE CORPORATION IN ITS CAPACITY AS THE RECEIVER FOR 19 FAILED BANKING INSTITUTIONS. THE CLAIM CONTAINS ALLEGATIONS OF FRAUDULENT MISREPRESENTATION AND BREACH OF COMPETITION LAW BY THE GROUP IN RELATION TO ITS HISTORIC PARTICIPATION IN THE SETTING OF THE USD LIBOR REFERENCE RATE, WHICH ALLEGEDLY IMPACTED THE 19 FAILED BANKING INSTUTIONS. FDIC HAS PROVISIONALLY VALUED THE CLAIMS OF THE FAILED BANKING INSTUTIONS AT $214.1M. THIS CLAIM IS BEING PURSUED AGAINST THE GROUP IN PARALLEL IN BOTH THE ENGLISH AND THE US COURTS (EXACT DEFENDANTS DIFFER BETWEEN THE US AND UK PROCEEDINGS)."
1949961,"AMENDED","","","","Y","Firm and Affiliates","1699511","","","","","Y","","","","","","","","","","","","","","","","","","","","","","","","","","","","","","","LLOYDS BANK PLC AND OTHER MEMBERS OF LLOYDS BANKING GROUP PLC (COLLECTIVELY, THE ""GROUP"") ARE NAMED AS DEFENDANTS IN PRIVATE LAWSUITS PENDING IN THE US WITH REGARD TO THE SETTING OF THE BBA LONDON INTERBANK OFFERED  RATE (LIBOR). A NUMBER OF GOVERNMENT AGENCIES IN THE UK, US AND ELSEWHERE, INCLUDING THE UK FINANCIAL CONDUCT AUTHORITY, THE SERIOUS FRAUD OFFICE, THE US COMMODITY FUTURES TRADING COMMISSION, THE US SECURITIES AND EXCHANGE COMMISSION, THE US DEPARTMENT OF JUSTICE AND A NUMBER OF STATE ATTORNEYS GENERAL, AS WELL AS THE EUROPEAN AND SWISS COMPETITION COMMISSIONS, ARE CONDUCTING INVESTIGATIONS INTO SUBMISSIONS MADE BY PANEL MEMBERS TO THE BODIES THAT SET VARIOUS INTERBANK OFFERED RATES INCLUDING THE BBA LONDON INTERBANK OFFERED RATES (LIBOR) AND THE EUROPEAN BANKING FEDERATION'S EURIBOR, ALONG WITH OTHER REFERENCE RATES. CERTAIN GROUP COMPANIES WERE (AT THE RELEVANT TIMES) AND REMAIN MEMBERS OF VARIOUS PANELS WHOSE MEMBERS MAKE SUBMISSIONS TO THESE BODIES INCLUDING THE BBA LIBOR PANELS. NO GROUP COMPANY IS OR WAS A MEMBER OF THE EURIBOR PANEL. CERTAIN GROUP COMPANIES HAVE RECEIVED SUBPOENAS AND REQUESTS FOR INFORMATION FROM CERTAIN GOVERNMENT AGENCIES AND THE GROUP IS CO-OPERATING WITH THEIR INVESTIGATIONS. CERTAIN GROUP COMPANIES, TOGETHER WITH OTHER PANEL BANKS, HAVE ALSO BEEN NAMED AS DEFENDANTS IN PRIVATE LAWSUITS, INCLUDING PURPORTED CLASS ACTION SUITS, IN THE US IN CONNECTION WITH THEIR ROLES AS PANEL BANKS CONTRIBUTING TO THE SETTING OF US DOLLAR LIBOR. THE CLAIMS HAVE BEEN ASSERTED BY PLAINTIFFS CLAIMING TO HAVE HAD AN INTEREST IN VARIOUS TYPES OF FINANCIAL INSTRUMENTS LINKED TO US DOLLAR LIBOR. THE ALLEGATIONS IN THESE CASES, THE MAJORITY OF WHICH HAVE BEEN COORDINATED FOR PRE-TRIAL PURPOSES IN MULTI-DISTRICT LITIGATION PROCEEDINGS (MDL) IN THE US DISTRICT COURT FOR THE SOUTHERN DISTRICT OF NEW YORK (THE 'DISTRICT COURT'), ARE SUBSTANTIALLY SIMILAR TO EACH OTHER. THE LAWSUITS ALLEGE VIOLATIONS OF THE SHERMAN ANTITRUST ACT, THE RACKETEER INFLUENCED AND CORRUPT ORGANIZATIONS ACT (RICO) AND THE COMMODITY EXCHANGE ACT (CEA), AS WELL AS VARIOUS STATE STATUTES AND COMMON LAW DOCTRINES. CERTAIN OF THE PLAINTIFFS' CLAIMS HAVE BEEN DISMISSED BY THE DISTRICT COURT, VARIOUS MOTIONS DIRECTED TO THE SUFFICIENCY OF THEIR PLEADING OF CERTAIN CLAIMS ARE STILL PENDING, AND MANY OF THESE CASES HAVE BEEN STAYED BY ORDER OF THE DISTRICT COURT. THE GROUP IS ALSO REVIEWING ITS ACTIVITIES IN RELATION TO THE SETTING OF CERTAIN FOREIGN EXCHANGE DAILY BENCHMARK RATES, FOLLOWING THE FCA'S PUBLICIZED INITIATION OF AN INVESTIGATION INTO OTHER FINANCIAL INSTITUTIONS IN RELATION TO THIS ACTIVITY. IN ADDITION, THE GROUP, TOGETHER WITH A NUMBER OF OTHER BANKS, HAS BEEN NAMED AS A DEFENDANT IN SEVERAL PURPORTED CLASS ACTIONS IN THE DISTRICT COURT, IN WHICH THE PLAINTIFFS ALLEGE THAT THE DEFENDANTS MANIPULATED WM/REUTERS FOREIGN EXCHANGE RATES IN VIOLATION OF US ANTITRUST LAWS.  THE DISTRICT COURT HAS ORDERED THE CONSOLIDATION OF NEARLY ALL OF THESE ACTIONS AND HAS RECENTLY SET DEADLINES FOR THE PLAINTIFFS TO FILE THEIR CONSOLIDATED AMENDED COMPLAINT AND FOR THE DEFENDANTS, INCLUDING THE GROUP, TO MOVE TO DISMISS THESE CLAIMS.    IT IS CURRENTLY NOT POSSIBLE TO PREDICT THE SCOPE AND ULTIMATE OUTCOME ON THE GROUP OF THE VARIOUS REGULATORY INVESTIGATIONS, PRIVATE LAWSUITS OR ANY RELATED CHALLENGES TO THE INTERPRETATION OR VALIDITY OF ANY OF THE GROUP'S CONTRACTUAL ARRANGEMENTS, INCLUDING THEIR TIMING AND SCALE."
1950518,"AMENDED","","","","Y","Firm and Affiliates","1699745","","Y","","","N","ALBERT RICHARDS (PRIVATE PLAINTIFF)","Other","DECLARATION THAT DEFENDANTS VIOLATED THE LAW; DECLARATION THAT MERGER AGREEMENT IS NULL AND VOID.","02/21/2024","Y","","No Product","","FEDERAL (UNITED STATES DISTRICT COURT FOR THE NORTHERN DISTRICT OF CALIFORNIA, OAKLAND, CALIFORNIA, CASE NO. 3:24-CV-01065).","N/A","PLAINTIFF ALLEGES THAT CENTRIPETAL NETWORKS, INC. (""CNI"") AND ITS PRINCIPALS DEPRIVED PLAINTIFF OF FAIR VALUE FOR HIS CNI INVESTMENT IN CONNECTION WITH A MERGER TRANSACTION PLAINTIFF ALLEGES WAS PRICED AT SUBSTANTIALLY BELOW FAIR VALUE.  PLAINTIFF ALSO ALLEGES THAT ALSOP LOUIE MANAGEMENT LLC AND THREE OF ITS PARTNERS, AS A MAJORITY PREFERRED SHAREHOLDER AND ONE-TIME CONVERTIBLE NOTE HOLDER, IMPROPERLY AGREED TO THE UNFAIR MERGER DUE TO CNI'S COERCION.  THE ALSOP LOUIE DEFENDANTS DENY ALL MATERIAL ALLEGATIONS IN PLAINTIFF'S COMPLAINT AND INTEND TO DEFEND AGAINST PLAINTIFFS' ACTION.","Final","N/A","","Y","","Dismissed","01/03/2025","N","VOLUNTARILY DISMISSED BY PLAINTIFF","","","","","","","","","N/A","N/A","PLAINTIFF ALLEGES THAT CNI AND ITS PRINCIPALS DEPRIVED PLAINTIFF OF FAIR VALUE FOR HIS CNI INVESTMENT IN CONNECTION WITH A MERGER TRANSACTION PLAINTIFF ALLEGES WAS PRICED AT SUBSTANTIALLY BELOW FAIR VALUE.  PLAINTIFF ALSO ALLEGES THAT ALSOP LOUIE MANAGEMENT LLC AND THREE OF ITS PARTNERS, AS A MAJORITY PREFERRED SHAREHOLDER AND ONE-TIME CONVERTIBLE NOTE HOLDER, IMPROPERLY AGREED TO THE UNFAIR MERGER DUE TO CNI'S COERCION.  THE ALSOP LOUIE DEFENDANTS DENY ALL MATERIAL ALLEGATIONS IN PLAINTIFF'S COMPLAINT AND INTEND TO DEFEND AGAINST PLAINTIFFS' ACTION."
1950518,"INITIAL","","","","Y","Firm and Affiliates","1708204","","","","","N","ALBERT RICHARDS (PRIVATE PLAINTIFF)","Other","DECLARATION THAT DEFENDANTS VIOLATED THE LAW; DECLARATION THAT MERGER AGREEMENT IS NULL AND VOID; MONETARY AND EQUITABLE RELIEF","01/31/2025","Y","","No Product","","SUPERIOR COURT OF THE STATE OF CALIFORNIA FOR THE COUNTY OF SAN FRANCISCO, CASE NO. CPF-25-518892.","N/A","PLAINTIFF ALLEGES THAT CENTRIPETAL NETWORKS INC. (""CNI"") AND ITS PRINCIPALS DEPRIVED PLAINTIFF OF FAIR VALUE FOR HIS CNI INVESTMENT IN CONNECTION WITH A MERGER TRANSACTION THAT PLAINTIFF ALLEGES WAS PRICED SUBSTANTIALLY BELOW FAIR VALUE. PLAINTIFF FURTHER ALLEGES THAT ALSOP LOUIE MANAGEMENT LLC AND THREE OF ITS AFFILIATES (""ALSOP LOUIE DEFENDANTS""), AS MAJORITY PREFERRED SHAREHOLDER AND ONE­ TIME CONVERTIBLE NOTE HOLDER, IMPROPERLY AGREED TO THE UNFAIR MERGER DUE TO CNL'S COERCION AND IN VIOLATION OF THE ALSOP LOUIE DEFENDANTS' FIDUCIARY DUTY. THE PLAINTIFF FURTHER ALLEGES THAT THE ALSOP LOUIE DEFENDANTS AIDED AND ABETTED BREACH OF FIDUCIARY DUTY BY CONSENTING TO THE TERMS OF THE MERGER. THE ALSOP LOUIE DEFENDANTS DENY ALL MATERIAL ALLEGATIONS IN THE PLAINTIFF'S COMPLAINT AND INTEND TO FULLY DEFEND AGAINST PLAINTIFF'S ACTION.","Pending","N/A","01/31/2025","N","THE COMPLAINT WAS SERVED ON THE ALSOP LOUIE DEFENDANTS ON 2/27/2025.  BY AGREEMENT BETWEEN PLAINTIFF AND THE ALSOP LOUIE DEFENDANTS, THE ALSOP LOUIE DEFENDANTS HAVE UNTIL 4/14/2025 TO RESPOND TO THE COMPLAINT.","","","","","","","","","","","","","N/A","N/A","PLAINTIFF ALLEGES THAT CENTRIPETAL NETWORKS INC. (""CNI"") AND ITS PRINCIPALS DEPRIVED PLAINTIFF OF FAIR VALUE FOR HIS CNI INVESTMENT IN CONNECTION WITH A MERGER TRANSACTION THAT PLAINTIFF ALLEGES WAS PRICED SUBSTANTIALLY BELOW FAIR VALUE. PLAINTIFF FURTHER ALLEGES THAT ALSOP LOUIE MANAGEMENT LLC AND THREE OF ITS AFFILIATES (""ALSOP LOUIE DEFENDANTS""), AS MAJORITY PREFERRED SHAREHOLDER AND ONE-TIME CONVERTIBLE NOTE HOLDER, IMPROPERLY AGREED TO THE UNFAIR MERGER DUE TO CNL'S COERCION AND IN VIOLATION OF THE ALSOP LOUIE DEFENDANTS' FIDUCIARY DUTY. THE PLAINTIFF FURTHER ALLEGES THAT THE ALSOP LOUIE DEFENDANTS AIDED AND ABETTED BREACH OF FIDUCIARY DUTY BY CONSENTING TO THE TERMS OF THE MERGER. THE ALSOP LOUIE DEFENDANTS DENY ALL MATERIAL ALLEGATIONS IN THE PLAINTIFF'S COMPLAINT AND INTEND TO FULLY DEFEND AGAINST PLAINTIFF'S ACTION."
1950996,"AMENDED","Y","Y","","","Affiliates","1699897","","","","","N","APPAC (MINORITY SHAREHOLDER GROUP OF VIVENDI UNIVERSAL, S.A.) AND OTHER CIVIL CLAIMANTS","Money Damages (Private/Civil Complaint)","","06/01/2010","N","IN CONNECTION WITH THE VIVENDI UNIVERSAL INQUIRY NOTED IN THE CRIMINAL DRP FILED HEREWITH, OVER 200 CIVIL CLAIMANTS, INCLUDING APPAC, ASSERTED CLAIMS FOR DAMAGES AT VARIOUS POINTS IN CONNECTION WITH CERTAIN OF THE CONDUCT ENCOMPASSED BY THE INQUIRY, INCLUDING A CLAIM AGAINST MR. BRONFMAN RELATED TO HIS STOCK TRANSACTIONS IN JANUARY 2002.","Options","","TRIBUNAL DE GRANDE INSTANCE DE PARIS - 11 EME CHAMBRE - SECTION 2 (TRIAL COURT OF PARIS, 11TH CHAMBER, SECTION 2) FRANCE NO. 0220696051","VIVENDI UNIVERSAL, S.A.","SEE RESPONSE TO QUESTION 3 ABOVE.","Final","","","","","Judgment Rendered","05/19/2014","Y","","","","","","","","","","MR. BRONFMAN WAS FOUND NOT LIABLE TO THE CIVIL CLAIMANTS SEE THE CRIMINAL DRP FILED HEREWITH REGARDING THE SUSPENDED SENTENCE, WHICH WAS REMOVED ON APPEAL AND FINE, WHICH WAS REDUCED ON APPEAL.","MR. BRONFMAN WAS FOUND NOT LIABLE TO THE CIVIL CLAIMANTS SEE THE CRIMINAL DRP FILED HEREWITH REGARDING THE SUSPENDED SENTENCE, WHICH WAS REMOVED ON APPEAL AND FINE, WHICH WAS REDUCED ON APPEAL.","AS NOTED ABOVE, NUMEROUS CIVIL CLAIMANTS ASSERTED CLAIMS FOR DAMAGES IN CONNECTION WITH AN INQUIRY INTO VARIOUS ISSUES RELATING TO VIVENDI UNIVERSAL. IN JUNE 2010, A TRIAL WAS HELD IN THE TRIAL COURT IN PARIS ON BOTH THE CRIMINAL CHARGES (REFERENCED IN THE CRIMINAL DISCLOSURE REPORTING PAGE FILED HEREWITH) AND THE CIVIL CLAIMS (REFERENCED ABOVE). AT THE TRIAL, THE PUBLIC PROSECUTOR AND THE LEAD CIVIL CLAIMANT BOTH TOOK THE POSITION THAT MR. BRONFMAN SHOULD BE ACQUITTED. WITH RESPECT TO THE CIVIL CLAIMS, ON JANUARY 21, 2011, MR. BRONFMAN WAS FOUND NOT LIABLE TO THE CIVIL CLAIMANTS. ON JANUARY 28, 2011, SEVERAL CIVIL CLAIMANTS FILED A GENERAL APPEAL OF THE JUDGMENT AS TO ALL DEFENDANTS. UNDER FRENCH LAW, THE GENERAL APPEAL ENCOMPASSED THE CIVIL JUDGMENT IN MR. BRONFMAN'S FAVOR. IN NOVEMBER 2013, MR. BRONFMAN PARTICIPATED IN A RE-TRIAL BEFORE A NEW JUDICIAL PANEL AS PART OF HIS APPEAL OF THE PARIS TRIAL COURT'S JANUARY 2011 DECISION. IN MAY 2014, THE NEW JUDICIAL PANEL RENDERED ITS DECISION AND AFFIRMED THE PARIS TRIAL COURT'S FINDING THAT MR. BRONFMAN WAS NOT LIABLE TO THE CIVIL CLAIMANTS."
1952498,"AMENDED","","","","Y","Affiliates","1700500","","","","","Y","","","","","","","","","","","","","","","","","","","","","","","","","","","","","","",""
1952498,"AMENDED","","Y","","","Affiliates","1700501","","","","","Y","AUSTRALIAN SECURITIES AND INVESTMENTS COMMISSION","Civil Penalty(ies)/Fine(s)","ADVERSE PUBLICITY NOTICE","07/24/2023","Y","","Mutual Fund(s)","","SERVED BY FEDERAL COURT OF AUSTRALIA, VICTORIA CASE# - VID563/2023","NA","ON 25 JULY 2023, ASIC LODGED CIVIL PENALTY PROCEEDINGS IN THE FEDERAL COURT OF AUSTRALIA AGAINST VANGUARD INVESTMENTS AUSTRALIA LTD (VIA), ALLEGING MISREPRESENTATIONS IN RELATION TO CLAIMS ABOUT CERTAIN ENVIRONMENTAL, SOCIAL AND GOVERNANCE (ESG) EXCLUSIONARY SCREENS APPLIED TO INVESTMENTS IN THE VANGUARD ETHICALLY CONSCIOUS GLOBAL AGGREGATE BOND INDEX AND ETF. ASIC ALLEGED THAT THE DESCRIPTION OF THE EXCLUSIONARY SCREENS IN THE PRODUCT DISCLOSURE STATEMENTS (PDS) DID NOT PROVIDE A SUFFICIENTLY DETAILED EXPLANATION THAT CERTAIN COMPANY DEBT ISSUERS LACKING ESG RESEARCH COVERAGE WERE INCLUDED IN THE BENCHMARK SUCH THAT THE FUND AND ETF HAD EXPOSURE TO CERTAIN SECURITIES THAT MAY NOT HAVE REASONABLY EXPECTED BY INVESTORS. IN ADDITION, ANCILLIARY STATEMENTS MADE BY VIA, IN THE FORM OF A MEDIA RELEASE AND TWO INDUSTRY PRESENTATIONS, WERE ALLEGED TO NOT ADEQUATELY DISCLOSE THE LIMITATIONS OF THE EXCLUSIONARY SCREENS APPLIED TO THE PRODUCTS.","Final","NA","","Y","","Judgment Rendered","09/25/2024","Y","","Y","8772000","","","","","","","VIA TO PUBLISH A WRITTEN ADVERSE PUBLICITY NOTICE SPECIFIED IN THE ANNEXURE TO THE ORDERS; AND MAINTAIN THE PRESCRIBED NOTICE UNTIL 25 SEPTEMBER 2025 (12 MONTHS FROM THE DATE OF THE ORDERS)","N/A","ON 25 JULY 2023, ASIC LODGED CIVIL PENALTY PROCEEDINGS IN THE FEDERAL COURT OF AUSTRALIA AGAINST VANGUARD INVESTMENTS AUSTRALIA LTD (VIA), ALLEGING MISREPRESENTATIONS IN RELATION TO CLAIMS ABOUT CERTAIN ENVIRONMENTAL, SOCIAL AND GOVERNANCE (ESG) EXCLUSIONARY SCREENS APPLIED TO INVESTMENTS IN THE VANGUARD ETHICALLY CONSCIOUS GLOBAL AGGREGATE BOND INDEX AND ETF. ASIC ALLEGED THAT THE DESCRIPTION OF THE EXCLUSIONARY SCREENS IN THE PRODUCT DISCLOSURE STATEMENTS (PDS) DID NOT PROVIDE A SUFFICIENTLY DETAILED EXPLANATION THAT CERTAIN COMPANY DEBT ISSUERS LACKING ESG RESEARCH COVERAGE WERE INCLUDED IN THE BENCHMARK SUCH THAT THE FUND AND ETF HAD EXPOSURE TO CERTAIN SECURITIES THAT MAY NOT HAVE REASONABLY EXPECTED BY INVESTORS. IN ADDITION, ANCILLIARY STATEMENTS MADE BY VIA, IN THE FORM OF A MEDIA RELEASE AND TWO INDUSTRY PRESENTATIONS, WERE ALLEGED TO NOT ADEQUATELY DISCLOSE THE LIMITATIONS OF THE EXCLUSIONARY SCREENS APPLIED TO THE PRODUCTS.   IN CONSIDERING THE FACTS, JUSTICE O'BRYAN OF THE FEDERAL COURT ISSUED A REASONS FOR JUDGEMENT AND ORDERS ON 25 SEPTEMBER 2024, THAT OBLIGATES:1) VIA TO PAY PECUNIARY PENALTY TO THE COMMONWEALTH OF AUSTRALIA OF AUD$12.9 MILLION WHICH WAS PAID IN FULL ON 14 OCTOBER 2024;2) VIA TO PUBLISH ADVERSE PUBLICITY NOTICES AS PRESCRIBED BY THE ANNEXURE ACCOMPANYING THE ORDERS BY 25 OCTOBER 2024 ON SPECIFIED INTERNET WEB ADDRESSES UNTIL AT LEAST 25 SEPTEMBER 2025; AND3) ASIC TO PAY VIA'S COSTS OF AND INCIDENTAL TO THE HEARING ON 8 MARCH 2024 AND VIA TO OTHERWISE PAY THE COSTS OF THE PROCEEDINGS."
1953159,"AMENDED","","","","Y","Affiliates","1700848","","","","","Y","","","","","","","","","","","","","","","","","","","","","","","","","","","","","","",""
1953159,"AMENDED","","Y","","","Affiliates","1700849","","","","","Y","AUSTRALIAN SECURITIES AND INVESTMENTS COMMISSION","Civil Penalty(ies)/Fine(s)","ADVERSE PUBLICITY NOTICE","07/24/2023","Y","","Mutual Fund(s)","","SERVED BY FEDERAL COURT OF AUSTRALIA, VICTORIA CASE# - VID563/2023","NA","ON 25 JULY 2023, ASIC LODGED CIVIL PENALTY PROCEEDINGS IN THE FEDERAL COURT OF AUSTRALIA AGAINST VANGUARD INVESTMENTS AUSTRALIA LTD (VIA), ALLEGING MISREPRESENTATIONS IN RELATION TO CLAIMS ABOUT CERTAIN ENVIRONMENTAL, SOCIAL AND GOVERNANCE (ESG) EXCLUSIONARY SCREENS APPLIED TO INVESTMENTS IN THE VANGUARD ETHICALLY CONSCIOUS GLOBAL AGGREGATE BOND INDEX AND ETF. ASIC ALLEGED THAT THE DESCRIPTION OF THE EXCLUSIONARY SCREENS IN THE PRODUCT DISCLOSURE STATEMENTS (PDS) DID NOT PROVIDE A SUFFICIENTLY DETAILED EXPLANATION THAT CERTAIN COMPANY DEBT ISSUERS LACKING ESG RESEARCH COVERAGE WERE INCLUDED IN THE BENCHMARK SUCH THAT THE FUND AND ETF HAD EXPOSURE TO CERTAIN SECURITIES THAT MAY NOT HAVE REASONABLY EXPECTED BY INVESTORS. IN ADDITION, ANCILLIARY STATEMENTS MADE BY VIA, IN THE FORM OF A MEDIA RELEASE AND TWO INDUSTRY PRESENTATIONS, WERE ALLEGED TO NOT ADEQUATELY DISCLOSE THE LIMITATIONS OF THE EXCLUSIONARY SCREENS APPLIED TO THE PRODUCTS.","Final","NA","","Y","","Judgment Rendered","09/25/2024","Y","","Y","8772000","","","","","","","VIA TO PUBLISH A WRITTEN ADVERSE PUBLICITY NOTICE SPECIFIED IN THE ANNEXURE TO THE ORDERS; AND MAINTAIN THE PRESCRIBED NOTICE UNTIL 25 SEPTEMBER 2025 (12 MONTHS FROM THE DATE OF THE ORDERS)","N/A","ON 25 JULY 2023, ASIC LODGED CIVIL PENALTY PROCEEDINGS IN THE FEDERAL COURT OF AUSTRALIA AGAINST VANGUARD INVESTMENTS AUSTRALIA LTD (VIA), ALLEGING MISREPRESENTATIONS IN RELATION TO CLAIMS ABOUT CERTAIN ENVIRONMENTAL, SOCIAL AND GOVERNANCE (ESG) EXCLUSIONARY SCREENS APPLIED TO INVESTMENTS IN THE VANGUARD ETHICALLY CONSCIOUS GLOBAL AGGREGATE BOND INDEX AND ETF. ASIC ALLEGED THAT THE DESCRIPTION OF THE EXCLUSIONARY SCREENS IN THE PRODUCT DISCLOSURE STATEMENTS (PDS) DID NOT PROVIDE A SUFFICIENTLY DETAILED EXPLANATION THAT CERTAIN COMPANY DEBT ISSUERS LACKING ESG RESEARCH COVERAGE WERE INCLUDED IN THE BENCHMARK SUCH THAT THE FUND AND ETF HAD EXPOSURE TO CERTAIN SECURITIES THAT MAY NOT HAVE REASONABLY EXPECTED BY INVESTORS. IN ADDITION, ANCILLIARY STATEMENTS MADE BY VIA, IN THE FORM OF A MEDIA RELEASE AND TWO INDUSTRY PRESENTATIONS, WERE ALLEGED TO NOT ADEQUATELY DISCLOSE THE LIMITATIONS OF THE EXCLUSIONARY SCREENS APPLIED TO THE PRODUCTS.   IN CONSIDERING THE FACTS, JUSTICE O'BRYAN OF THE FEDERAL COURT ISSUED A REASONS FOR JUDGEMENT AND ORDERS ON 25 SEPTEMBER 2024, THAT OBLIGATES:1) VIA TO PAY PECUNIARY PENALTY TO THE COMMONWEALTH OF AUSTRALIA OF AUD$12.9 MILLION WHICH WAS PAID IN FULL ON 14 OCTOBER 2024;2) VIA TO PUBLISH ADVERSE PUBLICITY NOTICES AS PRESCRIBED BY THE ANNEXURE ACCOMPANYING THE ORDERS BY 25 OCTOBER 2024 ON SPECIFIED INTERNET WEB ADDRESSES UNTIL AT LEAST 25 SEPTEMBER 2025; AND3) ASIC TO PAY VIA'S COSTS OF AND INCIDENTAL TO THE HEARING ON 8 MARCH 2024 AND VIA TO OTHERWISE PAY THE COSTS OF THE PROCEEDINGS."
1953686,"AMENDED","","","","Y","Affiliates","1701252","","","","","N","TEXAS ATTORNEY GENERAL AND ATTORNEYS GENERAL FROM 10 OTHER STATES (AL, AR, IN, IOWA, KS, MO, MT, NE, WV, AND WY)","Other","CIVIL FINE/PENALTY, MONEY DAMAGES, INJUNCTION AND RETURN OF FEES AND COSTS.","11/27/2024","Y","","Other","ETFS","CASE 6:24-CV-00437, UNITED STATES DISTRICT COURT FOR THE EASTERN DISTRICT OF TEXAS TYLER DIVISION","","ON NOVEMBER 27, 2024, TEXAS ATTORNEY GENERAL KEN PAXTON AND ATTORNEYS GENERAL FROM 10 OTHER STATES (ALABAMA, ARKANSAS, INDIANA, IOWA, KANSAS, MISSOURI, MONTANA, NEBRASKA, WEST VIRGINIA, AND WYOMING) FILED A COMPLAINT AGAINST BLACKROCK, VANGUARD, AND STATE STREET (THE ""MANAGERS"") ALLEGING THAT THE MANAGERS USED THEIR OWNERSHIP STAKES IN COAL COMPANIES TO ARTIFICIALLY REDUCE COAL OUTPUT IN VIOLATION OF VARIOUS STATE AND FEDERAL ANTITRUST LAWS. TEXAS ALSO CLAIMS BLACKROCK MADE FALSE AND DECEPTIVE STATEMENTS IN CONNECTION WITH THE MARKETING OF ITS NON-ESG ETFS.","Pending","","12/03/2024","Y","","","","","","","","","","","","","","","","ON NOVEMBER 27, 2024, TEXAS ATTORNEY GENERAL KEN PAXTON AND ATTORNEYS GENERAL FROM 10 OTHER STATES (ALABAMA, ARKANSAS, INDIANA, IOWA, KANSAS, MISSOURI, MONTANA, NEBRASKA, WEST VIRGINIA, AND WYOMING) FILED A COMPLAINT AGAINST BLACKROCK, VANGUARD, AND STATE STREET (THE ""MANAGERS"") ALLEGING THAT THE MANAGERS USED THEIR OWNERSHIP STAKES IN COAL COMPANIES TO ARTIFICIALLY REDUCE COAL OUTPUT IN VIOLATION OF VARIOUS STATE AND FEDERAL ANTITRUST LAWS. TEXAS ALSO CLAIMS BLACKROCK MADE FALSE AND DECEPTIVE STATEMENTS IN CONNECTION WITH THE MARKETING OF ITS NON-ESG ETFS."
1953686,"AMENDED","","","Y","Y","Affiliates","1701251","","","","","N","TENNESSEE ATTORNEY GENERAL","Other","INJUNCTION, DISGORGEMENT, CIVIL PENALTY, RETURN OF FEES AND COSTS.","12/18/2023","Y","","Other","ETFS","CASE _23CV-618, CIRCUIT COURT OF WILLIAMSON COUNTY, TENNESSEE F'OR THE TWENTY.FIRST JUDICIAL DISTRICT","","ON DECEMBER 18, 2023, THE TENNESSEE ATTORNEY GENERAL (""AG"") SUED BLACKROCK, INC. IN TENNESSEE STATE COURT FOR ALLEGED VIOLATIONS OF TENNESSEE'S CONSUMER PROTECTION STATUTE IN CONNECTION WITH OUR ESG PRACTICES.  THE COMPLAINT GENERALLY ALLEGES THAT BLACKROCK HAS MADE MISLEADING STATEMENTS IN FUND PROSPECTUSES, FACT SHEETS, VARIOUS PUBLIC STATEMENTS, AND ON ITS WEBSITE REGARDING ITS ESG PRACTICES AND ITS APPROACH TO PROXY VOTING.","Final","","","Y","","Settled","01/17/2025","Y","","","","","","","","","","PLEASE SEE SECTION 14 FOR DETAILS RELATING TO THE SETTLEMENT AGREEMENT.","NOT APPLICABLE.","ON DECEMBER 18, 2023, THE TENNESSEE ATTORNEY GENERAL (""AG"") SUED BLACKROCK, INC. IN TENNESSEE STATE COURT FOR ALLEGED VIOLATIONS OF TENNESSEE'S CONSUMER PROTECTION STATUTE IN CONNECTION WITH OUR ESG PRACTICES.  THE COMPLAINT GENERALLY ALLEGES THAT BLACKROCK HAS MADE MISLEADING STATEMENTS IN FUND PROSPECTUSES, FACT SHEETS, VARIOUS PUBLIC STATEMENTS, AND ON ITS WEBSITE REGARDING ITS ESG PRACTICES AND ITS APPROACH TO PROXY VOTING.  ON JANUARY 17, 2025, THE PARTIES SETTLED THE LITIGATION. THE SETTLEMENT DOES NOT INVOLVE THE PAYMENT OF ANY MONEY, NOR DOES IT INCLUDE ANY FINDINGS THAT BLACKROCK VIOLATED ANY LAWS.  AMONG OTHER THINGS, BLACKROCK AGREED TO UPDATE CERTAIN DISCLOSURES ON ITS WEBPAGES AND TO PROVIDE ADDITIONAL TRANSPARENCY AND RECORDKEEPING AROUND ITS STEWARDSHIP PRACTICES."
