"FilingID","Miscellaneous"
1980356,"The regulatory assets under management and beneficial owners reported throughout are good faith estimates, as of April 30, 2024, and subject to change upon audit."
1938433,"ALL FIGURES IN USD $ AS AT OCT 31, 2024  ITEM 7.B.1 - SCHEDULE D (QUESTION 16) APPROXIMATE PERCENTAGE OF THE PRIVATE FUND BENEFICIALLY OWNED BY NON-UNITED STATES PERSONS:   805-9434821244 99.9902%, 805-1334107555 99.9898%, 805-6178139822 99.9907%, 805-9796916115 99.9991%, 805-8343948789 99.9991%, 805-4492816760 99.9998%, 805-9653455949 99.9918%, 805-1444521647 99.9998%, 805-8205491562 99.9978%, 805-1589754518 99.9983%, 805-6065176761 99.9877%, 805-8021738576 99.8452%  SCHEDULE D - SECTION 2 (B) PRIVATE FUND ASSETS: THE ASSETS UNDER MANAGEMENT REPORTED ($477,642.40 USD AS AT OCT 31, 2024) IS NOT MANAGED AT A PLACE OF BUSINESS IN THE UNITED STATES. THIS AMOUNT IS HELD BY INVESTORS RESIDING IN THE US WHO HAVE INVESTED IN RBC INDIGO MUTUAL FUNDS MANAGED BY RBC INDIGO ASSET MANAGEMENT INC."
1976606,"Information reported in this Part 1A of Form ADV is generally as of December 31, 2024. As of December 31, 2021, ILA Capital restructured its direct and indirect owners (Schedules A and B) and stopped providing services to separately managed account clients (Item 5)."
1968133,"SCHEDULE A - DIRECT OWNERS - VUMINDABA DUBE IS A DIRECTOR OF BSP ADVISORS LTD. AND DOES NOT HAVE A MIDDLE NAME. SCHEDULE A - DIRECT OWNERS - YEN YEO WONG IS A DIRECTOR OF BSP ADVISORS LTD. AND DOES NOT HAVE A MIDDLE NAME."
1979092,"ASIA RESEARCH & CAPITAL MANAGEMENT LIMITED IS THE EXEMPT REPORTING ADVISOR AND THE HONG KONG DOMICILED INVESTMENT MANAGER (""ERA"") TO VARIOUS CAYMAN ISLAND FUNDS: (1) ARCM MASTER FUND IV LTD AND ITS TWO FEEDER FUNDS; AND (2) INVESTMENT OPPORTUNITIES SPC. ALL HAVE BEEN FULLY DISCLOSED ON SCHEDULE D.  THE ERA MANAGES NO MONEY FROM A PLACE OF BUSINESS IN THE US. THE ERA HAS FILED FOR AN EXEMPTION AS A COMMODITY POOL OPERATOR UNDER THE CFTC FOR ITS APPLICABLE FUNDS. THE FUNDS HAVE EACH OBTAINED AN LEI IDENTIFIER (AS REQUIRED AND DISCLOSED IN ITEM I.P)."
1983385,"The regulatory assets under management reported herein are good faith estimates calculated as of April 23, 2025, and are subject to change upon audit. Yuchen Fu does not have a middle name, so ""NMN"" has been added as a placeholder. The special purpose vehicle (“SPV”) that serves as the general partner of the pooled investment vehicle listed in Section 7.B.1 is itself identified in Section 7.A. as an “other investment adviser” in a manner consistent with the treatment of similarly situated SPVs of registered investment advisers as articulated in the no-action letter to the Business Law Section of the American Bar Association (Jan. 18, 2012). Accordingly, such SPV looks to and relies on the Adviser’s filing with the SEC and does not submit a separate Form ADV."
1984231,"CERTAIN OF THE PRIVATE FUNDS LISTED IN SECTION 7.B(1) OF SCHEDULE D HOLD CERTAIN INVESTMENTS THROUGH SPECIAL PURPOSE HOLDING COMPANIES OR ALTERNATIVE INVESTMENT VEHICLES (COLLECTIVELY, ""SPVS"").  TO AVOID ANY PERCEIVED DUPLICATION OF ASSETS, THE ASSETS OF ANY SPVS HELD BY A PRIVATE FUND ARE INCLUDED IN THE VALUE OF THE TOTAL ASSETS OF THE APPLICABLE PRIVATE FUND TO WHICH SUCH SPV RELATES AND THEREFORE THE SPVS ARE NOT LISTED SEPARATELY IN SCHEDULE D."
1979710,"THE PRIVATE FUNDS REPORTED IN SECTION 7.B.(2) OF SCHEDULE D OF PEAK XV PARTNERS I LLC (THE “ADVISER”), ARE ALSO LISTED IN SECTION 7.B.(1) OF SCHEDULE D OF PEAK XV PARTNERS OPERATIONS LLC’S FORM ADV BECAUSE THE ADVISER AND PEAK XV PARTNERS OPERATIONS LLC ARE BOTH CURRENTLY THE INVESTMENT ADVISER TO THOSE PRIVATE FUNDS. PEAK XV PARTNERS OPERATIONS LLC’S INITIAL FORM ADV FOR REGISTRATION WITH THE SEC AS A REGISTERED INVESTMENT ADVISER (“RIA”) WAS SUBMITTED ON FEBRUARY 24, 2025 AND IS PENDING REVIEW BY THE SEC. PEAK XV PARTNERS OPPERATIONS LLC’S FORM ADV THAT WHICH IS PUBLICLY AVAILABLE AS OF THE DATE OF THIS FILING IS AN OTHER THAN ANNUAL AMENDMENT TO ITS MOST RECENT ANNUAL AMENDMENT REFLECTIVE OF 12/31/2024. ADVISER IS PART OF A COLLECTION OF RELATED ENTITIES WHICH INCLUDE MANAGEMENT COMPANIES, VARIOUS PRIVATE FUNDS, AND VARIOUS ENTITIES THAT SERVE AS THE CONSTITUENT GENERAL PARTNERS OR MANAGING MEMBERS OF THE FOREGOING FUNDS, SOME OF WHICH MAY BE DEEMED ADVISORY AFFILIATES OF THE ADVISER. INFORMATION RELATING TO CERTAIN FINANCIAL INDUSTRY AFFILIATES OF ANY OF THE ADVISER’S ADVISORY AFFILIATES MAY APPEAR ONLY IN THE FORM ADV OF THE RELEVANT ADVISORY AFFILIATE."
1980151,"JEREMY ABELSON ADVISORY LLC serves as a non-discretionary investment advisor to private funds.  The firm became eligible to file as an exempt reporting adviser with the SEC in 2021.   Certain funds have been reported in SECTION 7.B.(1) of Schedule D because they were not reported by Hudson Park Advisors LLC."
1980401,"WITH REFERENCE TO SECTION 1.L. OF SCHEDULE D PLEASE NOTE THAT WE HAVE ANSWERED THIS QUESTION ONLY WITH RESPECT TO U.S. CLIENTS.  31/03/2025: abrdn Investments Ireland Limited was unable to submit the annual updating amendment to SEC ERA Form ADV by the March 31, 2025 deadline due to insufficient funding in the Flex-Funding account. An affiliate transfer was made the morning of March 31st to remediate this is-sue; however, the transfer was processed overnight after the filing deadline. The filing was submitted immediately upon remitting the filing fee"
1975901,"All RAUM, gross asset values, and client funds & securities (AUM) data in this Form ADV are as of 2024-12-31, except the corresponding numbers for ECLIPSE SPV XX LP and ECLIPSE SPV XXIII LP, which were closed after 2024-12-31 and whose numbers are therefore as of the date of this filing."
1977516,"THE PRIMARY PLACE OF BUSINESS FOR THE INVESTMENT MANAGER (Y3 PARTNERS LP) AND THE FUND (Y3 PARTNERS FUND LP) IS IN NEW YORK. THE INVESTMENT ADVISER (YLR MANAGEMENT LLC) HAS A SECONDARY ADDRESS: 7 BODENHEIMER STREET, TEL AVIV, ISRAEL, 6200811."
1973265,"All reasonable effort taken to file this Form ADV by the required deadline. The filing draft was completed for submission and checked for correctness. E-File flex funding account requires one business day for funds to become available overnight. Contacted FINRA support to expedite the account funding, which was unsuccessful. Case #: 2789427. Submission filed as soon as funds became available to do so. A note has been made on internal firm documents regarding flex-funding fund availability to ensure future compliance."
1969905,"- PLEASE NOTE THAT OUR ANSWER ""1"" TO THE QUESTION UNDER SECTION 2.B. OF SCHEDULE D IS ACTUALLY ""0"". DUE TO TECHNICAL ISSUES WITH THE IARD SYSTEM, WE WERE NOT ABLE TO ENTER ""0"" IN THAT FIELD."
1981287,"My name is Christopher Torres and I am the sole owner and person for Proud American Capital LLC. I am registering with the state of California and am exempt to register with SEC."
1977344,"RAUM is as of December 31, 2024."
1978769,"SECTION 2B SCHEDULE D -  THE TOTAL AMOUNT MANAGED FROM A U.S. LOCATION IS $0.00, DUE TO IARD SYSTEM CONSTRAINS $1.00 WAS INSERTED."
1975065,"Invision Capital II, L.P. and Invision Capital III-A, L.P. are each a rural business investment company (""RBIC"").  Per Investment Advisers Act section 203(m), RBIC fund assets are excluded from calculations of ""assets under management,"" as defined in Investment Advisers Act rule 203(m)-1. Accordingly, the assets of Invision Capital II, L.P. and Invision Capital III-A, L.P. are not included in assets under management for purposes of Section 2.B herein."
1975720,"For Schedule B - All other interests in Brummer & Partners AB are less than 25%."
1976171,"Item 7A: CoVenture-SecFi Management Limited is an investment adviser that is 50% owned by SecFi Limited and 50% owned by CoVenture Management, LLC. CoVenture-SecFi Management Limited's principal place of business is located in New York."
1957075,"In responding to Section 7.B.(1) EUR has been converted in USD using an exchange rate of EUR1.00 to USD 0.9241."
1975607,"ADDITIONAL INFORMATION FOR SECTION 1.L LOCATION OF BOOKS AND RECORDS: THE ADMINISTRATOR'S DELEGATE OF THE FUNDS AND THE MASTER FUND IS MAPLES FUND SERVICES (ASIA) LIMITED, HONG KONG. ADDITIONAL INFORMATION FOR SECTION 7.B.1 (DREAM PEAK CAPITAL MASTER FUND, DREAM PEAK CAPITAL ONSHORE FUND AND DREAM PEAK CAPITAL OFFSHORE FUND) QUESTION 23(A)(2) ADDITIONAL AUDITOR INFORMATION: THE FUND’S FINANCIAL STATEMENTS ARE PREPARED IN ACCORDANCE WITH IFRS. QUESTION 26(A) ADDITIONAL ADMINISTRATOR INFORMATION: THE ADMINISTRATOR'S DELEGATE OF THE FUNDS AND THE MASTER FUND IS MAPLES FUND SERVICES (ASIA) LIMITED, HONG KONG."
1972869,"ACCENT EQUITY VII MANAGER AB (THE ""ADVISOR"") IS THE REGISTERED INVESTMENT ADVISOR / FUND MANAGER TO ACCENT EQUITY VII A AB, ACCENT EQUITY VII B AB AND ACCENT EQUITY VII C AB, COMPRISING A SWEDISH ALTERNATIVE INVESTMENT FUND (TOGETHER THE “FUND”). CURRENTLY, ONLY ACCENT EQUITY VII B AB HAS RECEIVED A COMMITMENT FROM A U.S. INVESTOR. THE ADVISOR OWNS 100% OF THE SHARES IN ACCENT EQUITY VII B AB, AND CONTROLS 100% OF THE VOTES. THE ADVISOR HAS COMMITTED APPROX. 8% OF THE FUND’S TOTAL COMMITTED CAPITAL. THE OTHER APPROX. 92% OF THE COMMITTED CAPITAL HAS BEEN COMMITTED BY EXTERNAL INSTITUTIONAL INVESTORS.  ALL USD AMOUNTS RELATED TO THE FUND ARE BASED ON A USD/SEK RATE OF 10.9982, AND ARE BASED ON ASSETS HELD AS OF 12/31/2024."
1978454,"The adviser has entered into investment advisory agreements with private fund general partners (the “General Partners”) and managers (the “Managers”)that are advised by affiliates of EQT AB, the adviser’s parent company. These investment advisory agreements appoint the adviser to act as an adviser to the General Partners and Managers in respect of certain funds they manage (the “Funds”). Each Fund’s General Partner or Manager (as applicable) makes all investment decisions for such Fund, and the management and the conduct of the activities of such Fund remains the responsibility of the General Partner or the Manager. Certain of the General Partners do not control, are not controlled by, and are not under common control with the adviser; however, certain of the General Partners are under common control with the adviser. With respect to certain Funds, the adviser provides investment advice to the Fund’s General Partner or Manager that is tailored to the Fund’s particular investment objectives. Such Funds are reported in Section 7.B.(2) of Schedule D (these funds are generally reported in Section 7.B.(1) of Schedule D in the Form ADV filings of their respective General Partners or Managers, as applicable).   Information provided in Section 7.A of Schedule D excludes (i) certain the general partners (or similar) of alternative investment vehicles (and other vehicles that serve similar functions) and of co-investment vehicles that invest alongside main funds sponsored or managed by EQT (including, without limitation, side-by-side vehicles through which employees, personnel, advisors and other individuals with whom EQT has a relationship co-invest alongside one or more EQT main funds), and (ii) in cases where a private fund has multiple general partners, the additional general partners of that fund that were formed for tax, regulatory, legal or similar reasons, (iii) certain general partners (or similar) of investment vehicles sponsored, managed or advised by Exeter Property Group, LLC and/or Exeter US Advisor, LLC; BPEA EQT Pte. Ltd; or LSP Advisory BV which are related persons of the adviser, and (iv)  certain investment advisors or general partners that are already  disclosed under the filing for EQT Fund Management S.A.R.L. under SEC File number 802 - 110840  Upon request, complete information about all related persons will be made available to the staff of the SEC. In addition, please see the Section 7.A of the Form ADV filed by Exeter Property Group, LLC; BPEA EQT Pte;  LSP Advisory BV for additional informationregarding the general partners (or similar) described in clause (iii) above."
1961052,"HITECVISION ADVISORY AS PROVIDES INVESTMENT ADVICE WITH RESPECT TO EACH OF THE FUNDS SET FORTH IN SECTION 7.B.(1) OF THIS SCHEDULE D PURSUANT TO ADVISORY AGREEMENTS ENTERED INTO WITH EACH SUCH FUND'S GENERAL PARTNER OR OTHER INTERMEDIATE ADVISORY COMPANY, AS APPLICABLE.  We note that we shall amend Form ADV each year by filing an annual updating amendment within 90 days after the end of our fiscal year, this date being 31 March 2025. The annual updating amendment was filed one day after such date due to the failure of having sufficient funds in the FINRA account, which is a condition for filing the amendment. We transferred funds to the FINRA account on 28 March 2025; however, the funds were not available in our FINRA account on 31 March 2025. We initiated a case with FINRA, case number 2789569, to trace the transfer of the funds on 31 March 2025; however, the funds were not traced or found before the end of that day. The funds became available in our FINRA account on the same day this annual updating amendment is filed.  We will ensure sufficient funds are always available in the account in the future and will file the annual updating amendment within the 90-day period from the end of the fiscal year."
1980413,"Kettera Strategies LLC is the Platform Operator for the Hydra Platform (Cayman), SPC and Hydra Platform LLC (U.S.) which provides a platform for both U.S. and non-U.S. segregated investment vehicles.  Hydra ICON MoSAIQ Cell SP is a segregated portfolio wtihin Hydra Platform (Cayman) SPC and Hydra ICON MoSAIQ Cell is a Delaware Series within Hydra Platform, LLC.  Schedule D, Section 2.B. and Section 7.B.(1) is reported as of December 31, 2024."
1975156,"The guarantors of the securities shall be the Trustee, DeVon Carlo and subsidiary organizations that are currently in trust form and may be incorporated hereafter. Our organization shall acquire prime brokerage and custodial services at the earliest possible convenience."
1979982,"N/A"
1977802,"With respect to the response to question 28 (a) in Section 7.B.1. of Schedule D, please note that certain private funds may use non-US LGT entities to market outside of the United States."
1975104,"We ran into technical issues while filing our Form ADV renewal, and were unable to access the IARD system before it closed at 8:00 PM PT on March 31, 2025.  We filed as soon as possible thereafter and have implemented measures, including earlier internal deadlines and system checks, to ensure timely submissions going forward.  Please let us know if any further information is needed."
1977059,"The responses to Section 7.A of Schedule D do not include certain related persons for which Patria Investments Uruguay Agente de Valores S.A.(1) has no business dealings in connection with advisory services provided to clients; (2) does not conduct shared operations; (3) does not refer or receive referrals of clients or business; (4) does not share supervised persons or premises; and (5) has no reason to believe the relationship creates a conflict of interest with Patria Investments Uruguay Agente de Valores S.A. clients. Patria Investments Uruguay Agente de Valores S.A. will provide a list of such related persons upon request. Patria Investments Uruguay Agente de Valores S.A. and each of its related persons that is an investment adviser or is deemed to be an investment adviser listed in Section 7.A., aside from Patria Finance Limited, are together filing a single Form ADV in reliance on SEC guidance posted March 2012 after the issuance of the 2012 No-Action Letter to the American Bar Association.  To provide further detail on the response to Item 6, Patria Investments Uruguay Agente de Valores S.A. engages in broker-dealer activities exclusively outside the United States. These activities are conducted in compliance with the regulatory requirements of the Banco Central del Uruguay and no broker-dealer services are offered or provided to U.S. persons, and no transactions are executed within the United States."
1977891,"All RAUM, gross asset values, and client funds & securities (AUM) data in this Form ADV are as of 2024-12-31, except the corresponding numbers for ECLIPSE SPV XX LP and ECLIPSE SPV XXIII LP, which were closed after 2024-12-31 and whose numbers are therefore as of the date of this filing."
1948278,"Alphi Capital LP maintains its books and records in Canadian dollars. As a result, gross asset values, minimum investment commitments and other figures have been presented in Canadian dollars for all private funds reported."
1941888,"Section 7.A.4 could not look up Scott Alan Spangler or Andrew Browning Maus. They both have CRDs. Andrew Browning Maus 7.A.4(a) 3067043 Scott Alan Spangler 7.A.4(a) 3071280"
1937828,"ON 24 FEBRUARY 2025, BROOKS MACDONALD GROUP PLC ANNOUNCED THAT IT HAD COMPLETED THE SALE OF BROOKS MACDONALD ASSET MANAGEMENT (INTERNATIONAL) LIMITED AND ITS BRANCHES AND SUBSIDIARIES TO CANACCORD GENUITY WEALTH INTERNATIONAL HOLDINGS LIMITED (""CGWIHL""). 100% OF VOTING SHARES OF CGWIHL ARE OWNED BY CANACCORD GENUITY WEALTH GROUP HOLDINGS (JERSEY) LIMITED WHICH, IN TURN, ITS VOTING SHARES ARE 100% WHOLLY OWNED BY CANACCORD GENUITY GROUP INC WHICH IS A PUBLICLY TRADED COMPANY LISTED ON THE TOTONTO STOCK EXCHANGE. BROOKS MACDONALD ASSET MANAGEMENT (INTERNATIONAL) LIMITED WAS SUBSEQUENTLY RENAMED CANACCORD ASSET MANAGEMENT (INTERNATIONAL) LIMITED, ITS TRADING NAME IS CANACCORD WEALTH. WE HAVE A RELATED PERSON FOR WHOM IT IS NOT POSSIBLE TO TICK ONE OF THE BOXES IN SCHEDULE D SECTION 7.5. THIS COMPANY IS SECURE NOMINEES LIMITED. SECURE NOMINEES IS A SUBSIDIARY OF CANACCORD ASSET MANAGEMENT (INTERNATIONAL) LIMITED. INFORMATION ABOUT IT WILL BE PROVIDED UPON REQUEST. WE HAVE A RELATED PERSON FOR WHOM IT IS NOT POSSIBLE TO TICK ONE OF THE BOXES IN SCHEDULE D SECTION 7.5. THIS COMPANY IS CANACCORD INTERNATIONAL FUND MANAGERS LIMITED. CANACCORD INTERNATIONAL FUND MANAGERS LIMITED IS A SUBSIDIARY OF CANACCORD ASSET MANAGEMENT (INTERNATIONAL) LIMITED WHICH MANAGES TWO JERSEY RECOGNIZED FUNDS TO WHICH CANACCORD ASSET MANAGEMENT (INTERNATIONAL) LIMITED ACTS AS THE APPOINTED INVESTMENT MANAGER. INFORMATION ABOUT IT WILL BE PROVIDED UPON REQUEST. IN ADDITION, TO ALIGN WITH NEW OWNERSHIP, CANACCORD ASSET MANAGEMENT (INTERNATIONAL) LIMITED FINANCIAL YEAR END HAS CHANGED TO 31 MARCH.    Furthermore, we have ticked Item 6.A.(1) and Item 7.A.(1) for ourselves because we effect transactions in securities for our non-U.S. clients and are authorized to engage in this activity by our primary regulator. However, because we exercise discretion for the fund that we advise (Schedule D, Section 7.B.1), do not solicit this client or send it research contemplating a transaction in securities, in reliance upon no-action letters issued by the SEC Staff we are not deemed to be a “broker” as this term is defined in the U.S. Securities Exchange Act of 1934 and do not require an exemption from registration as such. Certain of our Related Persons are authorized by their primary regulator to effect transactions in securities for their non-U.S. resident clients and do not use the means of U.S. interstate commerce; as such, they would be deemed to be the equivalent of a broker in their country of operation but are not required for these reasons to be SEC registered or exempt from such registration.    Section 1.M and Section 7.A  - Please note the Isle of Man Financial Supervision Commission is now named Isle of Man Financial Services Authority and the South African Financial Services Board is now named the Financial Sector Conduct Authority  It should be further noted that for Paul Mudge and Andy Finch (resident in Guernsey) their social security numbers begin with GY but we were unable to enter the letters into your system."
1975613,"2.B.(2) = Private Funds Zero"
1975757,"IN SCHEDULE A, THERE ARE 3 TRUSTS LISTED AS ASSIGNEES.  PLEASE MAKE SURE THAT THE SOCIAL SECURITY NUMBERS ARE REDACTED."
1979438,"JEREMY ABELSON ADVISORY LLC serves as a non-discretionary investment advisor to private funds.  The firm became eligible to file as an exempt reporting adviser with the SEC in 2021.   Certain funds have been reported in SECTION 7.B.(1) of Schedule D because they were not reported by Hudson Park Advisors LLC."
1970936,"The Registrant qualifies as an exempt reporting adviser (an “ERA”) and, as such, is not subject to the recordkeeping requirements of Rule 204-2 under the Investment Advisers Act of 1940 (the “Advisers Act”). As a result, the Registrant marked “no” in response to the question in Item 1.L. Regarding Schedule D, Section 7.A. for DigitalDx Partners GP I, L.L.C. and DigitalDx Partners GP II, L.L.C.(each, a “GP Entity”), the Registrant notes that each GP Entity is the general partner to the Registrant’s private fund clients. Each GP Entity is not filing its own Form ADV but is instead relying on the interpretive guidance outlined in the “Frequently Asked Questions on Form ADV and IARD” on the SEC’s website under the heading “Reporting to the SEC as an Exempt Reporting Adviser.” That guidance essentially permits a GP entity to a private fund to rely on the Form ADV of the fund’s investment adviser. In addition, as an ERA, the Registrant is not subject to Rule 205-3 under the Advisers Act, and it is not currently subject to a state law equivalent, which would require fund investors to be qualified clients. As a result, Registrant has marked “no” in response to question 15(b) of Schedule D, Section 7.B.(1). Finally, regarding Schedule D, Section 7.B.(1), Question 25(a), the Registrant notes that its private fund clients maintain their cash reserves with Silicon Valley Bank, First Republic (part of JPMorgan Chase) and Citizens Bank."
1978159,"Regulatory Assets Under Management (""RAUM"") reported throughout are good faith estimates as of December 31, 2024.  The special purpose vehicles (“SPVs”) that serve as general partners and/or sponsors to the pooled investment vehicles listed in Section 7.B.1 are themselves identified in Section 7.A. as “other investment advisers” in a manner consistent with the treatment of similarly situated SPVs of registered investment advisers as articulated in the no-action letter to the Business Law Section of the American Bar Association (Jan. 18, 2012).  Accordingly, such SPVs look to and rely on the Adviser’s filing with the SEC and do not submit separate Form ADVs."
1976082,"The GAV for all funds are as of 12/31/24"
1976627,"Under Item 1 and Schedule A Ricky Vassell has no middle name. Under Item 1, Victoria Paris has no middle name."
1940162,"WE HAVE NO PLACE OF BUSINESS IN THE US (AND AS A CONSEQUENCE WE MANAGE NO AUM AT A PLACE OF BUSINESS IN THE US). WE HAVE LISTED IN SECTION 2B OF SCHEDULE D THE AUM ATTRIBUTABLE TO US INVESTORS IN THE FUND AS THE IARD SYSTEM HAS A TECHNICAL DEFECT THAT PREVENTS US FROM ENTERING ""0"" IN THIS SECTION."
1982115,"Under Item 1 and Schedule A Ricky Vassell has no middle name. Under Item 1, Victoria Paris has no middle name."
1976499,"MissionOG has established SPVs with a combined AUM of $34,561,419 to co-invest in particular investments alongside the Private Funds identified in Section 7.B."
1976177,"THIS ANNUAL AMENDMENT FOR THE FISCAL YEAR ENDED DECEMBER 2024 IS BEING SUBMITTED PURSUANT TO THE EXTENDED DEADLINE PROVIDED THROUGH MANGROVE CAPITAL PARTNERS S.A.’S TEMPORARY HARDSHIP EXEMPTION REQUEST WHICH WAS FILED ON MARCH 31, 2025."
1978709,"The Registrant has omitted from Section 7.A. of Schedule D certain Related Persons from Schedule D, Section 7.A. with whom it (1) has no business dealings in connection with the advisory services it provides to its clients; (2) does not conduct shared operations; (3) does not refer clients or business; (4) does not share supervised persons or premises; and with whom it (5) maintains a relationship that Registrant has no reason to believe otherwise creates a conflict of interest with its clients. A copy of the list of those Related Persons that Registrant omitted from Section 7.A. of Schedule D is available upon request.  Supplemental response to Schedule B, Macquarie Group Limited the registrants ultimate parent company is an Australian global financial services organization, listed on the Australian Stock Exchange, and is not considered a public reporting company under Sections 12 or 15(d) of the Securities Exchange Act of 1934."
1978612,"Please note that for Private Fund Assets I only included the assets of the US Feeder Fund (SocialAlpha Investment Fund - US LP).  This is per the following note and differs from the amount of assets reported in the Master Fund in section 7.B.  NOTE: ""Private fund assets"" has the same meaning here as it has under rule 203(m)-1. If you are an investment adviser with its principal office and place of business outside the United States only include private fund assets that you manage at a place of business in the United States."
