"FilingID","Initial/Amended","11.C(1)","11.C(2)","11.C(3)","11.C(4)","11.C(5)","11.D(1)","11.D(2)","11.D(3)","11.D(4)","11.D(5)","11.E(1)","11.E(2)","11.E(3)","11.E(4)","11.F.","11.G.","Filed Against","ReferenceID","Remove-Affiliate","Remove-Expired","Remove-Filed in Error","Error Explantion","Affiliate Submitted","Initiator Type","Initiated By","Principal Sanction","Other Sanctions","Date Initiated","Date Initiated Exact","Date Initiated Explanation","Case Number","Employing Firm","Principal Product","Other Product","Allegations","Status","Appeal Details","Resolution","Resolution Date","Resolution Date Exact","Resolution Date Explanation","Monetary Sanction","Monetary Amount","Revocation/Expulsion/Denial","Censure","Bar","Disgorgement/Restitution","Cease and Desist/Injunction","Suspension","Other Sanctions Ordered","Sanction Detail","Summary"
1998811,"AMENDED","","","","","","","Y","","","","","","","","","","Affiliates","1727282","","","","","N","Foreign","FINANSINSPEKTIONEN (SWEDISH FINANCIAL SUPERVISORY AUTHORITY (THE ""SFSA"")","Civil and Administrative Penalt(ies) /Fine(s)","","07/15/2014","Y","","","","Other","INVESTMENT IN CANADIAN EQUITY SECURITIES","THE FINANCIAL SUPERVISORY AUTHORITY OF SWEDEN (THE ""SFSA"") ALLEGED THAT BLACKROCK, INC. VIOLATED LOCAL SWEDISH LAW BY NOT FILING IN SWEDEN, WITHIN A PRESCRIBED TIME, REPORTS THAT ITS COLLECTIVE SHAREHOLDINGS IN LUNDIN MINING CORPORATION (A CANADIAN COMPANY WITH A PRIMARY LISTING ON TORONTO STOCK EXCHANGE AND A LISTING OF SWEDISH DEPOSITARY RECEIPTS ON NASDAQ OMX STOCKHOLM) CROSSED CERTAIN OWNERSHIP THRESHOLDS.","Final","","Decision","10/15/2014","Y","","Y","138200","N","N","N","N","N","N","","FINANCIAL SUPERVISORY AUTHORITY OF SWEDEN IMPOSED A SPECIAL FEE OF 1,000,000 SEK (APPROXIMATELY $138,200 USD). BLACKROCK, INC. PAID THE SPECIAL FEE ON OCTOBER 15, 2014.","BLACKROCK, INC. PAID THE SPECIAL FEE ON OCTOBER 15, 2014"
1998811,"AMENDED","","","","","","","Y","","","","","","","","","","Affiliates","1727284","","","","","N","Foreign","FINANSSIVALVONTA - THE FINANCIAL SUPERVISORY AUTHORITY OF FINLAND","Reprimand","","05/26/2015","Y","","","","Other","INVESTMENT IN EQUITY SECURITIES OF A FINNISH ISSUER.","ON SEPTEMBER 12, 2013, BLACKROCK, INC. BROUGHT TO THE ATTENTION OF THE FINANCIAL SUPERVISORY AUTHORITY OF FINLAND (""FINNISH FSA"") THAT BLACKROCK, INC. HAD NOT FILED, WITHIN THE SPECIFIED TIME PERIOD, A NOTIFICATION THAT THE INDIRECT AGGREGATE SHAREHOLDING IN A FINNISH ISSUER, OUTOTEC OYJ, CROSSED A CERTAIN THRESHOLD (""LATE NOTIFICATION"").","Final","","Decision","06/05/2015","Y","","N","","N","N","N","N","N","N","THE FINNISH FSA ISSUED A PUBLIC REPRIMAND TO BLACKROCK, INC.","ON JUNE 5, 2015, THE FINNISH FSA ISSUED A PUBLIC REPRIMAND TO BLACKROCK, INC. BECAUSE OF THE LATE NOTIFICATION.","BLACKROCK, INC. IS NOT APPEALING THE DECISION AND CONSIDERS THE MATTER CLOSED."
1998811,"AMENDED","","","","","","","Y","","","","","","","","","","Affiliates","1727285","","","","","N","Foreign","FINANSINSPEKTIONEN - THE FINANCIAL SUPERVISORY AUTHORITY OF SWEDEN","Civil and Administrative Penalt(ies) /Fine(s)","","04/29/2015","Y","","FI REG NO. 14-16729","","Other","INVESTMENT IN EQUITY SECURITIES OF A SWEDISH ISSUER.","ON OCTOBER 31, 2014, BLACKROCK, INC. BROUGHT TO THE ATTENTION OF THE FINANCIAL SUPERVISORY AUTHORITY OF SWEDEN (""SWEDISH FSA"") THAT BLACKROCK, INC. HAD NOT FILED, WITHIN THE SPECIFIED TIME PERIOD, A NOTIFICATION THAT ITS INDIRECT AGGREGATE SHAREHOLDING IN A SWEDISH ISSUER, ASSA ABLOY AB, CROSSED A CERTAIN THRESHOLD (""LATE NOTIFICATION"").","Final","","Decision","06/10/2015","Y","","Y","120700","N","N","N","N","N","N","","AS A RESULT OF THE LATE NOTIFICATION, THE SWEDISH FSA NOTIFIED BLACKROCK, INC., IN A LETTER DATED APRIL 29, 2015, OF ITS DECISION TO IMPOSE A PENALTY FEE OF SEK 1,000,000 (APPROXIMATELY $120,700 USD). BLACKROCK, INC. PAID THE PENALTY FEE ON JUNE 10, 2015.","THE PENALTY FEE, INVOICE DATE MAY 29, 2015, WAS PAID ON JUNE 10, 2015"
1998811,"AMENDED","","","","","","","Y","","","","","","","","","","Affiliates","1727289","","","","","N","Foreign","THE SWISS FEDERAL DEPARTMENT OF FINANCE (""SWISS FDF"")","Other","SETTLEMENT SUM","07/19/2021","Y","","","","Equity Listed (Common & Preferred Stock)","SWISS LISTED EQUITIES","ON DATES IN 2017 AND IN 2018, BLACKROCK, INC. WAS LATE IN MAKING CERTAIN THRESHOLD FILINGS WITH THE SWISS REGULATOR. THESE LATE FILINGS WERE CAUSED BY TWO SEPARATE ISSUES: (1) INCORRECT SHARE ISSUE INFORMATION PROVIDED TO BLACKROCK BY ITS THIRD PARTY VENDOR; AND, (2) BLACKROCK'S OUTGOING EMAIL QUARANTINE SYSTEM INCORRECTLY QUARANTINING THRESHOLD INFORMATION EMAILS FROM BLACKROCK TO THE SWISS REGULATOR.","Final","","Settled","04/22/2022","Y","","Y","50000","N","N","N","N","N","N","","THE SWISS FEDERAL DEPARTMENT OF FINANCE IMPOSED A SETTLEMENT SUM OF CHF 50,000. BLACKROCK, INC. PAID THE FEE ON APRIL 22, 2022.","BLACKROCK, INC. PAID SETTLEMENT SUM OF CHF 50,000 ON APRIL 22, 2022."
1998811,"AMENDED","","","","","","","Y","","","","","","","","","","Affiliates","1727292","","","","","N","Foreign","COMISIÓN NACIONAL BANCARIA Y DE VALORES (""CNBV"")","Civil and Administrative Penalt(ies) /Fine(s)","","01/09/2025","N","THE 01/09/2025 DATE REFERS TO THE DATE BLACKROCK MEXICO RECEIVED THE OFFICIAL NOTIFICATION LETTER FROM THE CNBV RELATED TO THE CNBV EXAMINATION ON MUTUAL FUNDS AND AML INITIATED IN JULY 2022.","CNBV.2S.2.211(4433)""2023""/1025/5 PTS","","Mutual Fund(s)","","ON JANUARY 9, 2025, THE COMISIÓN NACIONAL BANCARIA Y DE VALORES (""CNBV"") IMPOSED A FINE OF APPROXIMATELY $123,000 USD (MNX $2,501,720) REGARDING THE ANTI-MONEY LAUNDERING AND COUNTER-TERRORIST FINANCING PROGRAM AT BLACKROCK'S MEXICO CITY OFFICE.  SPECIFICALLY, THE CNBV FOUND THAT BLACKROCK MEXICO DID NOT HAVE SUFFICIENT PROCEDURES TO ASSESS WHETHER POTENTIAL TRANSACTIONS INVOLVING POLITICALLY EXPOSED PERSONS WERE APPROPRIATE AND TO COLLECT CERTAIN INFORMATION ABOUT HIGHER RISK CLIENTS. FURTHER, THE CNBV IDENTIFIED INSTANCES WHERE BLACKROCK MEXICO DID NOT MAINTAIN COMPLETE CLIENT FILES.","Final","","Settled","01/09/2025","Y","","Y","123000","N","N","N","N","N","N","IN ACCORDANCE WITH THE NOTIFICATION LETTER, THE CNBV ORDERED BLACKROCK MEXICO TO PAY A FINE IN THE AMOUNT OF APPROXIMATELY $123,000 (USD), BLACKROCK MEXICO DID NOT CONTEST AND PAID A FINE IN THE AMOUNT OF $98,000 (USD) ON 01/17/2025, A PORTION OF WHICH WAS DISCOUNTED UNDER THE TERMS OF THE APPLICABLE REGULATION.","NOT APPLICABLE","SEE SUMMARY PROVIDED IN SECTION 7. THE FINDINGS OBSERVED BY THE CNBV HAVE ALREADY BEEN CORRECTED, AND THESE ACTIONS HAVE BEEN COMMUNICATED TO THE CNBV. THE FINE IMPOSED BY THE CNBV IS THE MINIMUM FINE PERMISSIBLE UNDER THE APPLICABLE LAW FOR EACH FINDING."
1998811,"AMENDED","","","","","","","Y","","","","","","","","","","Affiliates","1727296","","","","","N","Foreign","COMISIÓN NACIONAL BANCARIA Y DE VALORES (""CNBV"")","Civil and Administrative Penalt(ies) /Fine(s)","","06/06/2023","Y","","211-2B/28101798-AGCC/2023","","No Product","","FAILURE TO COMPLY WITH CERTAIN REGULATIONS APPLICABLE TO THE MANAGEMENT OF MUTUAL FUNDS AND THE PROVISION OF INVESTMENT ADVISORY SERVICES IN BLACKROCK'S MEXICO CITY OFFICE.","Final","","Decision","07/12/2024","Y","","Y","164000","N","N","N","N","N","N","","PAYMENT OF FINE APPROXIMATELY $164,000 (MNX $2,957,150)","ON JULY 12, 2024, THE COMISIÓN NACIONAL BANCARIA Y DE VALORES (""CNBV"") IMPOSED A FINE OF APPROXIMATELY $164,000 (MNX $2,957,150) REGARDING THE FIRM'S COMPLIANCE WITH CERTAIN REGULATIONS APPLICABLE TO THE MANAGEMENT OF MUTUAL FUNDS AND THE PROVISION OF INVESTMENT ADVISORY SERVICES IN BLACKROCK'S MEXICO CITY OFFICE.  SPECIFICALLY, THE CNBV FOUND THAT THE REGISTRATIONS OF 4 BLACKROCK SALES REPRESENTATIVES WERE ASSOCIATED WITH INCORRECT BLACKROCK ENTITIES AND THAT BLACKROCK MEXICO'S PUBLIC WEBSITE DID NOT GIVE NOTICE TO USERS WHEN USERS WERE REDIRECTED TO THIRD PARTY WEBSITES. PAYMENT OF FINE WAS SUBMITTED TO THE CNBV ON AUGUST 2, 2024."
1998811,"AMENDED","","","","Y","","","","","","","","","","","","","Affiliates","1727294","","","","","N","SEC","U.S. SECURITIES AND EXCHANGE COMMISSION","Other","BLACKROCK ADVISORS, LLC (""BAL"") IS TO: A) PAY A $2.5 MILLION CIVIL MONEY PENALTY; B) CEASE AND DESIST FROM COMMITTING OR CAUSING ANY VIOLATIONS AND ANY FUTURE VIOLATIONS OF SECTION 206(4) OF THE ADVISERS ACT AND RULE 206(4)-8 PROMULGATED THEREUNDER, AND SECTION 34(B) OF THE INVESTMENT COMPANY ACT; C) BE CENSURED.","03/02/2020","Y","","3-21786","BLACKROCK ADVISORS LLC","Mutual Fund(s)","","ON OCTOBER 24, 2023, THE SEC ANNOUNCED AN AGREEMENT WITH BLACKROCK ADVISORS, LLC (""BAL"") TO SETTLE FINDINGS RELATING TO MISSTATEMENTS IN ANNUAL AND SEMI-ANNUAL REPORTS OF A MUTUAL FUND FOR WHICH BAL SERVES AS THE REGISTERED INVESTMENT ADVISER. THE SEC FOUND THAT THE REPORTS INACCURATELY DESCRIBED THE INTEREST RATE AND INDUSTRY CLASSIFICATION OF A LENDING FACILITY WITH A PRIVATELY HELD ENTITY IN WHICH THE MUTUAL FUND INVESTED. WITHOUT ADMITTING OR DENYING THE SEC'S FINDINGS, BAL AGREED TO THE ENTRY OF AN ADMINISTRATIVE ORDER CONTAINING FINDINGS THAT BAL VIOLATED SECTION 206(4) OF THE INVESTMENT ADVISERS ACT OF 1940 AND RULE 206(4)-8 THEREUNDER AND SECTION 34(B) OF THE INVESTMENT COMPANY ACT OF 1940.","Final","","Settled","10/24/2023","Y","","Y","2500000","N","N","N","N","Y","N","","ON OCTOBER 24, 2023, THE SEC ANNOUNCED AN AGREEMENT WITH BLACKROCK ADVISORS, LLC (""BAL"") TO SETTLE FINDINGS RELATING TO MISSTATEMENTS IN ANNUAL AND SEMI-ANNUAL REPORTS OF A MUTUAL FUND FOR WHICH BAL SERVES AS THE REGISTERED INVESTMENT ADVISER. THE SEC FOUND THAT THE REPORTS INACCURATELY DESCRIBED THE INTEREST RATE AND INDUSTRY CLASSIFICATION OF A LENDING FACILITY WITH A PRIVATELY HELD ENTITY IN WHICH THE MUTUAL FUND INVESTED. WITHOUT ADMITTING OR DENYING THE SEC'S FINDINGS, BAL AGREED TO THE ENTRY OF AN ADMINISTRATIVE ORDER CONTAINING FINDINGS THAT BAL VIOLATED SECTION 206(4) OF THE INVESTMENT ADVISERS ACT OF 1940 AND RULE 206(4)-8 THEREUNDER AND SECTION 34(B) OF THE INVESTMENT COMPANY ACT OF 1940. BAL PAID THE $2.5 MILLION CIVIL MONEY PENALTY ON OCTOBER 30, 2023. BAL DOES NOT EXPECT THE RESOLUTION OF THIS MATTER TO HAVE A MATERIAL ADVERSE EFFECT ON ITS FINANCIAL RESULTS OR OPERATIONS.","ON OCTOBER 24, 2023, THE SEC ANNOUNCED AN AGREEMENT WITH BLACKROCK ADVISORS, LLC (""BAL"") TO SETTLE FINDINGS RELATING TO MISSTATEMENTS IN ANNUAL AND SEMI-ANNUAL REPORTS OF A MUTUAL FUND FOR WHICH BAL SERVES AS THE REGISTERED INVESTMENT ADVISER. THE SEC FOUND THAT THE REPORTS INACCURATELY DESCRIBED THE INTEREST RATE AND INDUSTRY CLASSIFICATION OF A LENDING FACILITY WITH A PRIVATELY HELD ENTITY IN WHICH THE MUTUAL FUND INVESTED. WITHOUT ADMITTING OR DENYING THE SEC'S FINDINGS, BAL AGREED TO THE ENTRY OF AN ADMINISTRATIVE ORDER CONTAINING FINDINGS THAT BAL VIOLATED SECTION 206(4) OF THE INVESTMENT ADVISERS ACT OF 1940 AND RULE 206(4)-8 THEREUNDER AND SECTION 34(8) OF THE INVESTMENT COMPANY ACT OF 1940. BAL PAID THE $2.5 MILLION CIVIL MONEY PENALTY ON OCTOBER 30, 2023. BAL DOES NOT EXPECT THE RESOLUTION OF THIS MATTER TO HAVE A MATERIAL ADVERSE EFFECT ON ITS FINANCIAL RESULTS OR OPERATIONS."
1998811,"AMENDED","","Y","","Y","Y","","","","","","","","","","","","Advisory Firm","1727295","","","","","","SEC","U.S. SECURITIES AND EXCHANGE COMMISSION","Cease and Desist","CENSURE AND CIVIL PENALTY","12/20/2021","Y","","3-20683","","Options","PRIVATE EQUITY FUNDS","ACCORDING TO THE SEC ORDER, GIM (I) DID NOT OFFSET FROM APPLICABLE MANAGEMENT FEES ELIGIBLE FEES PAID TO IT BY A FUND PORTFOLIO COMPANY, (II) DID NOT OFFSET FROM APPLICABLE MANAGEMENT FEES THE FULL AMOUNT IT OWED A FUND'S LIMITED PARTNERS IN CONNECTION WITH ELIGIBLE FEES IT COLLECTED FROM A FUND PORTFOLIO COMPANY AND (III) INCLUDED INCONSISTENT PROVISIONS CONCERNING THE MANAGEMENT FEE CALCULATION METHODOLOGY IN THE OFFERING AND GOVERNING DOCUMENTS FOR TWO FUNDS. IN ADDITION, THE SEC ORDER FOUND THAT GIM DID NOT ADOPT AND IMPLEMENT WRITTEN POLICIES AND PROCEDURES REASONABLY DESIGNED TO PREVENT THE ABOVE VIOLATIONS OF THE ADVISERS ACT.","Final","","Settled","12/20/2021","Y","","Y","4500000","N","N","N","N","N","N","","THE PENALTY AMOUNT OF $4,500,000 WAS PAID ON DECEMBER 20, 2021.","THE SEC ADMINISTRATIVE ORDER IS FINAL. THE CIVIL PENALTY WAS PAID WITHIN 10 DAYS OF THE ENTRY OF THE ORDER."
1998811,"AMENDED","","Y","","Y","Y","","","","","","","","","","","","Affiliates","1727287","","","","","N","SEC","U.S. SECURITIES AND EXCHANGE COMMISSION","Civil and Administrative Penalt(ies) /Fine(s)","CEASE AND DESIST   UNDERTAKING","01/17/2017","Y","","3-17786","","No Product","","THE U.S. SECURITIES AND EXCHANGE COMMISSION (""SEC"") FOUND THAT A HISTORIC VERSION OF BLACKROCK INC.'S (""BLACKROCK"") FORM EMPLOYEE SEPARATION AND RELEASE AGREEMENT (""AGREEMENT"") VIOLATED DODD FRANK'S WHISTLEBLOWER PROVISIONS, (RULE 21F-17 UNDER THE SECURITIES AND EXCHANGE ACT OF 1934).  THE AGREEMENT, WHICH WAS IN USE BETWEEN OCTOBER 2011 AND MARCH 2016, DID NOT PROHIBIT FORMER EMPLOYEES FROM REPORTING ALLEGED WRONGDOING TO THE SEC.  HOWEVER, EMPLOYEES WHO ACCEPTED A VOLUNTARY SEPARATION PAYMENT FROM BLACKROCK WAIVED THEIR RIGHT TO RECOVER A MONETARY REWARD FROM THE SEC IN CONNECTION WITH ITS WHISTLEBLOWING PROGRAM.  BLACKROCK STOPPED USING THE AGREEMENT AT ISSUE BEFORE BEING CONTACTED BY THE SEC AND THE SEC WAS UNAWARE OF ANY INSTANCES IN WHICH FORMER BLACKROCK EMPLOYEES WERE PREVENTED FROM COMMUNICATING WITH THE SEC.","Final","","Order","01/25/2017","Y","","Y","340000","N","N","N","N","Y","N","BLACKROCK AGREED TO NOTIFY FORMER EMPLOYEES WHO SIGNED AN AGREEMENT TO ADVISE THEM THAT BLACKROCK DOES NOT PREVENT FORMER EMPLOYEES FROM COLLECTING A MONETARY AWARD FOR REPORTING INFORMATION TO THE SEC UNDER ITS WHISTLEBLOWER PROGRAM.","BLACKROCK PAID THE $340,000 CIVIL MONETARY PENALTY ON JANUARY 25, 2017.","ON JANUARY 17, 2017, BLACKROCK INC. REACHED AN AGREEMENT WITH THE SEC TO RESOLVE ALLEGATIONS THAT A HISTORIC VERSION OF BLACKROCK'S FORM EMPLOYEE SEPARATION AND RELEASE AGREEMENT (""AGREEMENT"") VIOLATED DODD FRANK'S WHISTLEBLOWER PROVISIONS, (RULE 21F-17 UNDER THE SECURITIES AND EXCHANGE ACT OF 1934).    THE SETTLEMENT WITH THE SEC INCLUDED A $340,000 PAYMENT, WHICH WAS PAID ON JANUARY 25, 2017. BLACKROCK ALSO AGREED TO NOTIFY FORMER EMPLOYEES WHO SIGNED AN AGREEMENT TO ADVISE THEM THAT BLACKROCK DOES NOT PREVENT FORMER EMPLOYEES FROM COLLECTING A MONETARY AWARD FOR REPORTING INFORMATION TO THE SEC UNDER ITS WHISTLEBLOWER PROGRAM."
1998811,"AMENDED","","Y","","Y","Y","","","","","","","","","","","","Affiliates","1727290","","","","","N","SEC","SECURITIES AND EXCHANGE COMMISSION (""SEC"")","Civil and Administrative Penalt(ies) /Fine(s)","PURSUANT TO THE SECURITIES AND EXCHANGE COMMISSION'S ORDER DATED APRIL 25, 2017 (THE ""ORDER""), BLACKROCK FUND ADVISORS (""BFA"") IS TO CEASE AND DESIST FROM COMMITTING OR CAUSING ANY VIOLATIONS AND ANY FUTURE VIOLATIONS OF SECTIONS 22(D), AND (E) OF THE INVESTMENT COMPANY ACT AND RULE 22C- 1 THEREUNDER.","04/25/2017","Y","","3-17942","","Other","EXCHANGE TRADED FUND (ETF)","""THE ORDER SPECIFICALLY CONCERNS THE ISHARES MSCI RUSSIA CAPPED ETF (""""RUSSIA FUND ETF""""), MANAGED BY BLACKROCK FUND ADVISORS (""""BFA"""") AND WHETHER IT WAS COVERED BY EXISTING EXEMPTIVE RELIEF GRANTED BY SECURITIES AND EXCHANGE COMMISSION (""""SEC""""). IN 2010, THE RUSSIA FUND ETF BEGAN SELLING ITS SHARES AS THE ONLY SERIES OF SHARES OF ISHARES MSCI RUSSIA CAPPED ETF, INC. (""""RUSSIA FUND COMPANY""""). THE RUSSIA FUND COMPANY DID NOT HAVE THE REQUIRED EXEMPTIVE RELIEF UNTIL JANUARY 2015. ACCORDINGLY, BY OPERATING THE RUSSIA FUND ETF FROM DECEMBER 2010 TO JANUARY 2015, BFA CAUSED THE RUSSIA FUND COMPANY TO VIOLATE THE INVESTMENT COMPANY ACT.""","Final","","Order","04/28/2017","Y","","Y","1500000","N","N","N","N","Y","N","","A CIVIL MONETARY PENALTY IN THE AMOUNT OF $1,500,000 WAS PAID ON APRIL 28, 2017","""ON APRIL 25, 2017, BFA REACHED AN AGREEMENT WITH THE SEC RESOLVING THE MATTER REGARDING THE RUSSIA FUND ETF. BFA, WHICH DID NOT ADMIT OR DENY ANY OF THE SEC'S FINDINGS, AGREED TO RESOLVE THE MATTER FOR A CIVIL MONETARY PENALTY OF $1,500,000."""
1998811,"AMENDED","","Y","","Y","Y","","","","","","","","","","","","Affiliates","1727291","","","","","N","SEC","SECURITIES AND EXCHANGE COMMISSION (""SEC"")","Cease and Desist","","04/20/2015","Y","","3-16501","BLACKROCK FINANCIAL MANAGEMENT, INC.","No Product","","""ON APRIL 20, 2015, THE U.S. SECURITIES AND EXCHANGE COMMISSION (""""SEC"""") ANNOUNCED AN AGREEMENT WITH MR. BATTISTA, TO SETTLE FINDINGS THAT MR. BATTISTA CAUSED A VIOLATION OF SECTION 206(4) OF THE INVESTMENT ADVISERS ACT OF 1940 AND RULE 206(4)-7 THEREUNDER, THAT CAUSED A VIOLATION OF RULE 38A-1 OF THE INVESTMENT COMPANY ACT OF 1940.""","Final","","Order","04/20/2015","Y","","Y","60000","N","N","N","N","Y","N","","PER THE SETTLEMENT, MR. BATTISTA IS TO PAY A $60,000 CIVIL MONEY PENALTY.","""ON APRIL 20, 2015, WITHOUT ADMITTING OR DENYING ANY WRONGDOING, MR. BATTISTA AGREED TO THE ENTRY OF AN ADMINISTRATIVE ORDER TO SETTLE CHARGES THAT THAT MR. BATTISTA CAUSED A VIOLATION OF SECTION 206(4) OF THE INVESTMENT ADVISERS ACT OF 1940 AND RULE 206(4)-7 THEREUNDER, THAT CAUSED A VIOLATION OF RULE 38A-1 OF THE INVESTMENT COMPANY ACT OF 1940. MR. BATTISTA IS TO PAY A $60,000 CIVIL MONEY PENALTY."""
1998813,"AMENDED","","","","","","","","","","","","Y","","","","","Affiliates","1727342","","","","","N","SRO","CHICAGO BOARD OF TRADE","Civil and Administrative Penalt(ies) /Fine(s)","DISGORGEMENT","01/22/2021","Y","","CBOT 19-1230-BC","","Futures - Commodity","","THE CME CONCLUDED THAT BLACKROCK VIOLATED CHICAGO BOARD OF TRADE (CBOT) RULE 562, WHICH PROHIBITS FIRMS FROM HOLDING POSITIONS ON THE CME LARGER THAN THE LIMITS PROSCRIBED BY CME RULES.","Final","","Settled","07/28/2021","Y","","Y","119605.6","N","N","N","Y","N","N","","IN ACCORDANCE WITH THE SETTLEMENT OFFER, THE PANEL ORDERED BLACKROCK TO PAY A FINE IN THE AMOUNT OF $20,000 AND ORDERED DISGORGEMENT IN THE AMOUNT OF $99,605.60 WHICH BLACKROCK PAID ON JULY 29TH, 2021.","PURSUANT TO AN OFFER OF SETTLEMENT IN WHICH BLACKROCK INC. NEITHER ADMITTED NOR DENIED THE RULE VIOLATION UPON WHICH THE PENALTY IS BASED, ON JULY 26, 2021, A PANEL OF THE CHICAGO BOARD OF TRADE (""CBOT"") BUSINESS CONDUCT COMMITTEE (""PANEL"") FOUND THAT ON NOVEMBER 12, 2019, AND NOVEMBER 13, 2019, BLACKROCK-MANAGED ACCOUNTS HELD AN ALL MONTHS COMBINED CBOT SOYBEAN MEAL POSITION THAT EXCEEDED THE ALL MONTHS POSITION LIMIT ON AN END OF DAY AND INTRADAY BASIS. SPECIFICALLY, BLACKROCK-MANAGED ACCOUNTS HELD AN AGGREGATE POSITION OF 6,919 CONTRACTS LONG ON NOVEMBER 12, AND 6,920 CONTRACTS LONG ON NOVEMBER 13, 2019. THIS EXCEEDED THE ALL MONTHS COMBINED POSITION LIMIT FOR SOYBEAN MEAL BY 419 CONTRACTS, OR 6.45%, ON NOVEMBER 12, AND BY 420 CONTRACTS, OR 6.46%, ON NOVEMBER 13. BLACKROCK RECOGNIZED THE OVERAGE ON NOVEMBER 13, AND ATTEMPTED TO REDUCE ITS POSITION VIA AN EXCHANGE FOR RISK (""EFR"") TRANSACTION, BUT WAS UNABLE TO EXECUTE THE TRADE ON THAT DAY. HOWEVER, ON THE MORNING OF NOVEMBER 14, 2019, BLACKROCK EXECUTED THE EFR AND BROUGHT THE ACCOUNTS' POSITIONS INTO COMPLIANCE, WHICH RESULTED IN A TOTAL MONETARY BENEFIT OF $99,605.60 TO THE ACCOUNTS. THE PANEL CONCLUDED THAT BLACKROCK THEREBY VIOLATED CBOT RULE 562.  IN ACCORDANCE WITH THE SETTLEMENT OFFER, THE PANEL ORDERED BLACKROCK TO PAY A FINE IN THE AMOUNT OF $20,000 AND ORDERED DISGORGEMENT IN THE AMOUNT OF $99,605.60 WHICH BLACKROCK PAID ON JULY 29TH, 2021."
1998813,"AMENDED","","","","","","","","","Y","","","","","","","","Firm and Affiliates","1727351","","","","","N","State","SECRETARY OF STATE OF THE STATE OF MISSISSIPPI","Cease and Desist","","03/27/2024","Y","","LS-24-6726","","Other","ETFS","ON MARCH 27, 2024, BLACKROCK, INC., BLACKROCK INVESTMENTS, LLC, BLACKROCK ADVISORS, LLC, BLACKROCK FUND ADVISORS, AND ISHARES TRUST (COLLECTIVELY, ""BLACKROCK"") WERE SERVED WITH A SUMMARY CEASE AND DESIST ORDER AND NOTICE OF INTENT TO IMPOSE ADMINISTRATIVE PENALTY FROM THE MISSISSIPPI SECRETARY OF STATE. THE SUMMARY ORDER ALLEGES THAT BLACKROCK HAS MADE MISLEADING STATEMENTS IN FUND PROSPECTUSES, MARKETING MATERIAL, PUBLIC STATEMENTS, AND ON ITS WEBSITE REGARDING BLACKROCK'S ESG PRACTICES AND APPROACH TO PROXY VOTING. THE SUMMARY ORDER, WHICH WAS ISSUED TO BLACKROCK WITHOUT ANY PRIOR NOTICE OR OPPORTUNITY TO BE HEARD, FINDS THAT BLACKROCK VIOLATED THE MISSISSIPPI SECURITIES LAWS, AND ORDERS BLACKROCK TO REFRAIN FROM FUTURE VIOLATIONS OF THOSE LAWS. ON APRIL 25, 2024, BLACKROCK EXERCISED ITS RIGHT UNDER MISSISSIPPI TO REQUEST AN ADMINISTRATIVE HEARING TO CONTEST THE ALLEGATIONS.","Pending","","","","","","N","","N","N","N","N","N","N","","","ON MARCH 27, 2024, BLACKROCK, INC., BLACKROCK INVESTMENTS, LLC, BLACKROCK ADVISORS, LLC, BLACKROCK FUND ADVISORS, AND ISHARES TRUST (COLLECTIVELY, ""BLACKROCK"") WERE SERVED WITH A SUMMARY CEASE AND DESIST ORDER AND NOTICE OF INTENT TO IMPOSE ADMINISTRATIVE PENALTY FROM THE MISSISSIPPI SECRETARY OF STATE. THE SUMMARY ORDER ALLEGES THAT BLACKROCK HAS MADE MISLEADING STATEMENTS IN FUND PROSPECTUSES, MARKETING MATERIAL, PUBLIC STATEMENTS, AND ON ITS WEBSITE REGARDING BLACKROCK'S ESG PRACTICES AND APPROACH TO PROXY VOTING. THE SUMMARY ORDER, WHICH WAS ISSUED TO BLACKROCK WITHOUT ANY PRIOR NOTICE OR OPPORTUNITY TO BE HEARD, FINDS THAT BLACKROCK VIOLATED THE MISSISSIPPI SECURITIES LAWS, AND ORDERS BLACKROCK TO REFRAIN FROM FUTURE VIOLATIONS OF THOSE LAWS. ON APRIL 25, 2024, BLACKROCK EXERCISED ITS RIGHT UNDER MISSISSIPPI TO REQUEST AN ADMINISTRATIVE HEARING TO CONTEST THE ALLEGATIONS."
1998813,"AMENDED","","","","","","","","","Y","","","","","","","Y","Firm and Affiliates","1727353","","","","","N","State","STATE OF INDIANA SECURITIES COMMISSIONER","Cease and Desist","","08/22/2024","Y","","24-0013 CD","","Other","ETFS","ON AUGUST 22, 2024, THE INDIANA SECURITIES COMMISSIONER (THE ""COMMISSIONER"") ISSUED A CEASE AND DESIST ORDER (THE ""ORDER"") AGAINST BLACKROCK, INC. AND SEVERAL OF ITS ADVISORY AFFILIATES, (COLLECTIVELY, ""BLACKROCK"").  THE ORDER ALLEGES THAT BLACKROCK HAS MADE MISLEADING STATEMENTS ABOUT HOW WE MANAGE OUR NON-ESG AND ESG FUNDS.  WITH RESPECT TO NON-ESG FUNDS, THE ORDER CITES TO OUR PARTICIPATION IN CLIMATE ORGANIZATIONS AND OUR STATEMENTS REGARDING ESG INTEGRATION AND STEWARDSHIP ACTIVITIES, AMONG OTHER THINGS, AS EVIDENCE THAT OUR NON-ESG FUNDS ACTUALLY PURSUE AN ESG STRATEGY.  WITH RESPECT TO ESG FUNDS, THE ORDER ASSERTS THAT BLACKROCK FALSELY CLAIMS THAT SUSTAINABLE INVESTING WILL GENERATE BETTER RETURNS.  THE ORDER FINDS THAT THIS ACTIVITY VIOLATES INDIANA'S SECURITIES LAW AND DIRECTS BLACKROCK TO CEASE ENGAGING IN THE REFERENCED ACTIVITIES.","Pending","","","","","","N","","N","N","N","N","N","N","","","ON AUGUST 22, 2024, THE INDIANA SECURITIES COMMISSIONER (THE ""COMMISSIONER"") ISSUED A CEASE AND DESIST ORDER (THE ""ORDER"") AGAINST BLACKROCK, INC. AND SEVERAL OF ITS ADVISORY AFFILIATES, (COLLECTIVELY, ""BLACKROCK"").  THE ORDER ALLEGES THAT BLACKROCK HAS MADE MISLEADING STATEMENTS ABOUT HOW WE MANAGE OUR NON-ESG AND ESG FUNDS.  WITH RESPECT TO NON-ESG FUNDS, THE ORDER CITES TO OUR PARTICIPATION IN CLIMATE ORGANIZATIONS AND OUR STATEMENTS REGARDING ESG INTEGRATION AND STEWARDSHIP ACTIVITIES, AMONG OTHER THINGS, AS EVIDENCE THAT OUR NON-ESG FUNDS ACTUALLY PURSUE AN ESG STRATEGY.  WITH RESPECT TO ESG FUNDS, THE ORDER ASSERTS THAT BLACKROCK FALSELY CLAIMS THAT SUSTAINABLE INVESTING WILL GENERATE BETTER RETURNS.  THE ORDER FINDS THAT THIS ACTIVITY VIOLATES INDIANA'S SECURITIES LAW AND DIRECTS BLACKROCK TO CEASE ENGAGING IN THE REFERENCED ACTIVITIES."
1998813,"AMENDED","","","","","","","Y","","","","","","","","","","Affiliates","1727338","","","","","N","Foreign","FINANSINSPEKTIONEN (SWEDISH FINANCIAL SUPERVISORY AUTHORITY (THE ""SFSA"")","Civil and Administrative Penalt(ies) /Fine(s)","","07/15/2014","Y","","","","Other","INVESTMENT IN CANADIAN EQUITY SECURITIES","THE FINANCIAL SUPERVISORY AUTHORITY OF SWEDEN (THE ""SFSA"") ALLEGED THAT BLACKROCK, INC. VIOLATED LOCAL SWEDISH LAW BY NOT FILING IN SWEDEN, WITHIN A PRESCRIBED TIME, REPORTS THAT ITS COLLECTIVE SHAREHOLDINGS IN LUNDIN MINING CORPORATION (A CANADIAN COMPANY WITH A PRIMARY LISTING ON TORONTO STOCK EXCHANGE AND A LISTING OF SWEDISH DEPOSITARY RECEIPTS ON NASDAQ OMX STOCKHOLM) CROSSED CERTAIN OWNERSHIP THRESHOLDS.","Final","","Decision","10/15/2014","Y","","Y","138200","N","N","N","N","N","N","","FINANCIAL SUPERVISORY AUTHORITY OF SWEDEN IMPOSED A SPECIAL FEE OF 1,000,000 SEK (APPROXIMATELY $138,200 USD). BLACKROCK, INC. PAID THE SPECIAL FEE ON OCTOBER 15, 2014.","BLACKROCK, INC. PAID THE SPECIAL FEE ON OCTOBER 15, 2014"
1998813,"AMENDED","","","","","","","Y","","","","","","","","","","Affiliates","1727339","","","","","N","Foreign","FINANSSIVALVONTA - THE FINANCIAL SUPERVISORY AUTHORITY OF FINLAND","Reprimand","","05/26/2015","Y","","","","Other","INVESTMENT IN EQUITY SECURITIES OF A FINNISH ISSUER.","ON SEPTEMBER 12, 2013, BLACKROCK, INC. BROUGHT TO THE ATTENTION OF THE FINANCIAL SUPERVISORY AUTHORITY OF FINLAND (""FINNISH FSA"") THAT BLACKROCK, INC. HAD NOT FILED, WITHIN THE SPECIFIED TIME PERIOD, A NOTIFICATION THAT THE INDIRECT AGGREGATE SHAREHOLDING IN A FINNISH ISSUER, OUTOTEC OYJ, CROSSED A CERTAIN THRESHOLD (""LATE NOTIFICATION"").","Final","","Decision","06/05/2015","Y","","N","","N","N","N","N","N","N","THE FINNISH FSA ISSUED A PUBLIC REPRIMAND TO BLACKROCK, INC.","ON JUNE 5, 2015, THE FINNISH FSA ISSUED A PUBLIC REPRIMAND TO BLACKROCK, INC. BECAUSE OF THE LATE NOTIFICATION.","BLACKROCK, INC. IS NOT APPEALING THE DECISION AND CONSIDERS THE MATTER CLOSED."
