"FilingID","Initial/Amended","11.H(1)(a)","11.H(1)(b)","11.H(1)(c)","11.H(2)","Filed Against","ReferenceID","Remove-Affiliate","Remove-Expired","Remove-Filed in Error","Error Explantion","Affiliate Submitted","Initiated By","Relief Sought","Other Relief Sought","Filing Date","Filing Date Exact","Filing Date Explanation","Principal Product","Other Product","Court","Employing Firm","Allegations","Status","Appeal Details","Date Served","Date Served Exact","Date Served Explanation","Resolution Type","Resolution Date","Resolution Date Exact","Resolution Date Explanation","Monetary Sanction","Monetary Amount","Revocation/Expulsion/Denial","Censure","Bar","Disgorgement/Restitution","Cease and Desist/Injunction","Suspension","Other Sanctions","Sanction Detail","Summary"
2012572,"AMENDED","","","","Y","Firm and Affiliates","1739765","","","","","N","MAYBERRY, ET AL. AND THE KY. ATTORNEY GENERAL (ON BEHALF OF THE COMMONWEALTH OF KY.); ""TIER 3"" MEMBERS OF KY. RETIREMENT SYSTEM","Money Damages (Private/Civil Complaint)","PUNITIVE DAMAGES","12/27/2017","N","MAYBERRY, ET AL FILED 12/27/17 AND KY. ATTORNEY GENERAL INTERVENING COMPLAINT 12/28/20 AND AMENDED INTERVENING COMPLAINT 5/24/21; COMMONWEALTH OF KENTUCKY AG SEPARATE COMPLAINT 7/21/20; ""TIER 3"" COMPLAINT 1/6/21; SEPARATE TIER 3 COMPLAINT , 21-CI-645 8/19/21","No Product","","COUNTY OF FRANKLIN CIRCUIT COURT, COMMONWEALTH OF KENTUCKY; CASE NO. CI-17-1348 (MAYBERRY & AG INTERVENING); CASE NO. 20-CI-00590 AND CASE NO. 20-CI-00590 (KENTUCKY AG SEPARATE COMPLAINTS); CASE NO. 21-CI-00020 (""TIER 3"" COMPLAINT) (REMOVED BY DEFENDANTS TO U.S. DISTRICT COURT FOR EASTERN DISTRICT OF KY, 3:21-CV-29); CASE NO. 21-CI-645 (SEPARATE ""TIER 3"" COMPLAINT)","RVK, INC.","IN DECEMBER 2017, OUR FIRM-ALONG WITH 31 OTHER ORGANIZATIONS AND INDIVIDUALS-WAS NAMED IN A COMPLAINT FILED, NOT BY A CLIENT, BUT BY EIGHT INDIVIDUAL PLAN PARTICIPANTS OF KENTUCKY RETIREMENT SYSTEMS (KRS, NOW KNOWN AS KPPA) (CASE 1348). THIS CASE EVENTUALLY LED TO OTHER, VERY SIMILAR CASES (DISCUSSED BELOW). THE CLAIMS AGAINST RVK WERE COMPLETELY MERITLESS. IN RVK'S 38-YEAR HISTORY, THE FIRM HAS NEVER BEEN NAMED IN A COMPLAINT FILED BY A CLIENT. AND HERE, RVK'S FORMER CLIENT-KRS-HAS OPTED NOT TO ASSERT ANY CLAIMS. AS DESCRIBED BELOW, RVK HAS BEEN A PARTY TO FIVE NEARLY IDENTICAL CASES IN KENTUCKY. TWO OF THEM WERE DISMISSED AND ARE FINAL; TWO WERE DISMISSED AND ARE ON APPEAL; ONE IS CURRENTLY STAYED. IN THE ORIGINAL CASE (1348), THE KENTUCKY SUPREME COURT ORDERED IN JULY 2020 THAT THE COMPLAINT BE DISMISSED FOR LACK OF STANDING. SHORTLY THEREAFTER, A GROUP OF PRIVATE PLAINTIFFS WHO PARTICIPATE IN KRS'S HYBRID CASH BALANCE PLAN (THE ""TIER 3"" PLAINTIFFS) AND WHO WERE REPRESENTED BY SOME OF THE SAME ATTORNEYS SOUGHT TO REVIVE THE SUIT. THE KENTUCKY ATTORNEY GENERAL (AG) ALSO SOUGHT TO INTERVENE, AND FILED A DUPLICATE CASE (CASE 590). THE TIER 3 PLAINTIFFS FILED TWO ADDITIONAL SUITS (CASE 645 AND CASE 20) THAT WERE SUBSTANTIALLY SIMILAR TO THE ORIGINAL SUIT AND THE AG'S SUIT. NONE OF THE COMPLAINTS ALLEGED ANY NEW CLAIMS AGAINST RVK. ON DECEMBER 28, 2020, THE TRIAL COURT DISMISSED THE PRIVATE PLAINTIFFS FROM THE ORIGINAL CASE (1348) BUT ALLOWED THE AG TO INTERVENE. IN APRIL 2023, THE KENTUCKY COURT OF APPEALS RULED THAT CASE 1348 SHOULD HAVE BEEN DISMISSED. THE DISMISSAL OF CASE 1348 IS NOW FINAL. ON APRIL 8, 2024, THE OAG FILED ANOTHER NEAR-DUPLICATE NEW CASE (CASE 354), WHICH WAS CONSOLIDATED WITH CASE 590. ON MAY 1, 2024, THE COURT GRANTED RVK'S MOTION TO DISMISS IN THE AG'S CASE 590 AND DISMISSED RVK. ON JULY 3, THE COURT DISMISSED RVK FROM THE AG'S OTHER CASE (354). THE AG APPEALED THE DISMISSALS AND AGAIN SOUGHT TO AMEND ITS COMPLAINT. THE APPEAL IS ONGOING. ALSO ON MAY 1, 2024, THE COURT GRANTED RVK'S MOTION TO DISMISS IN THE TIER 3 SUIT (CASE 645). THESE PLAINTIFFS DID NOT APPEAL, AND THIS DISMISSAL IS FINAL. THE TIER 3 PLAINTIFFS' OTHER SUIT WAS FILED IN 2021, AND IS (RELEVANT TO RVK) MATERIALLY IDENTICAL TO THE OTHER SUITS EXCEPT IT WAS FILED AS A PUTATIVE CLASS ACTION. THIS ACTION WAS REMOVED TO FEDERAL COURT, AND HAS BEEN STAYED PENDING THE STATE LITIGATION. FOR ITS PART, KPPA RETAINED AN OUTSIDE LAW FIRM (CALCATERRA POLLACK LLP) IN NOVEMBER 2020 TO INVESTIGATE AND ISSUE A REPORT. AFTER RECEIPT OF THE REPORT, KPPA'S BOARD VOTED ON MAY 26, 2021, NOT TO ""INTERVENE AS A PLAINTIFF IN THE ATTORNEY GENERAL'S AMENDED COMPLAINT"" OR ""FILE ANY LITIGATION AGAINST ANY PARTY . . . AT THIS TIME."" THE REPORT STATED THAT AFTER EXAMINING 192,000 DOCUMENTS, REVIEWING BOARD MEETING MATERIALS AND RECORDINGS, AND CONDUCTING SEVERAL INTERVIEWS, THE FIRM CONCLUDED THAT RVK ""MET [ITS] CONTRACTUAL AND FIDUCIARY DUTIES,"" ""HONESTLY DISCLOS[ED] THE INVESTMENT CHALLENGES KRS FACED,"" AND ""SERVED AS A VALUABLE CONSULTANT."" THE FIRM FOUND NO ""INDICIA OF COLLUSIONS, COVER UP, OR FIDUCIARY FAILURE"" BY RVK, AND FOUND NO ""VIOLATIONS OF FIDUCIARY DUTY OR ILLEGAL ACTIVITY"" BY RVK. THE FULL REPORT IS AVAILABLE AT HTTPS://TINYURL.COM/4YNKAH6F.  FROM THE FILING OF THE FIRST SUIT TO NOW, RVK HAS MAINTAINED THAT OUR FIRM'S YEARS OF SERVICE TO KRS WERE THOROUGHLY PROFESSIONAL, HIGHLY TRANSPARENT, AND ALWAYS CONSISTENT WITH OUR CONTRACTUAL AND FIDUCIARY DUTIES.","On Appeal","KY COURT OF APPEALS, NOTICE OF APPEAL IN CASES 590 AND 354 FILED JULY 26, 2024. CASES 1348 AND 645 ARE DISMISSED AND FINAL. CASE 20 IS STAYED.","07/20/2020","N","CONDENSED SUMMARY: ORIGINAL SUIT (CASE NO. CI-17-1348) SERVED ON OR ABOUT 1/24/18. AG'S SEPARATE COMPLAINT (CASE NO. CI-20-0598) SERVED ON VOYTKO ON 8/7/20. SERVICE ATTEMPTED ON RVK ON 8/3/20. SERVICE ACCEPTED ON MS. GRATSINGER AND RVK BY AGREEMENT WITH THE AG SUBJECT TO CONDITIONS. CASE NO. 21-CI-00020 ('TIER 3' COMPLAINT) SERVED ON VOYTKO 1/26/21 AND ON GRATSINGER ON OR ABOUT 2/3/21; SERVICE WAS ATTEMPTED ON RVK ON OR ABOUT 2/10/21.","Other","01/10/2024","N","DISMISSAL OF ORIGINAL LAWSUIT (1348) BECAME FINAL ON 1/10/2024. DISMISSAL OF CASE 645 BECAME FINAL ON MAY 31, 2024. CASES 590 AND 354 ARE ON APPEAL; CASE 20 IS STAYED.","","","","","","","","","NO SANCTIONS ORDERED OR RELIEF GRANTED IN RESOLVED CASES - OTHER CASES ARE ONGOING, SEE ABOVE.","N/A","IN DECEMBER 2017, OUR FIRM-ALONG WITH 31 OTHER ORGANIZATIONS AND INDIVIDUALS-WAS NAMED IN A COMPLAINT FILED, NOT BY A CLIENT, BUT BY EIGHT INDIVIDUAL PLAN PARTICIPANTS OF KENTUCKY RETIREMENT SYSTEMS (KRS, NOW KNOWN AS KPPA) (CASE 1348). THIS CASE EVENTUALLY LED TO OTHER, VERY SIMILAR CASES (DISCUSSED BELOW). THE CLAIMS AGAINST RVK WERE COMPLETELY MERITLESS. IN RVK'S 38-YEAR HISTORY, THE FIRM HAS NEVER BEEN NAMED IN A COMPLAINT FILED BY A CLIENT. AND HERE, RVK'S FORMER CLIENT-KRS-HAS OPTED NOT TO ASSERT ANY CLAIMS. AS DESCRIBED BELOW, RVK HAS BEEN A PARTY TO FIVE NEARLY IDENTICAL CASES IN KENTUCKY. TWO OF THEM WERE DISMISSED AND ARE FINAL; TWO WERE DISMISSED AND ARE ON APPEAL; ONE IS CURRENTLY STAYED. IN THE ORIGINAL CASE (1348), THE KENTUCKY SUPREME COURT ORDERED IN JULY 2020 THAT THE COMPLAINT BE DISMISSED FOR LACK OF STANDING. SHORTLY THEREAFTER, A GROUP OF PRIVATE PLAINTIFFS WHO PARTICIPATE IN KRS'S HYBRID CASH BALANCE PLAN (THE ""TIER 3"" PLAINTIFFS) AND WHO WERE REPRESENTED BY SOME OF THE SAME ATTORNEYS SOUGHT TO REVIVE THE SUIT. THE KENTUCKY ATTORNEY GENERAL (AG) ALSO SOUGHT TO INTERVENE, AND FILED A DUPLICATE CASE (CASE 590). THE TIER 3 PLAINTIFFS FILED TWO ADDITIONAL SUITS (CASE 645 AND CASE 20) THAT WERE SUBSTANTIALLY SIMILAR TO THE ORIGINAL SUIT AND THE AG'S SUIT. NONE OF THE COMPLAINTS ALLEGED ANY NEW CLAIMS AGAINST RVK. ON DECEMBER 28, 2020, THE TRIAL COURT DISMISSED THE PRIVATE PLAINTIFFS FROM THE ORIGINAL CASE (1348) BUT ALLOWED THE AG TO INTERVENE. IN APRIL 2023, THE KENTUCKY COURT OF APPEALS RULED THAT CASE 1348 SHOULD HAVE BEEN DISMISSED. THE DISMISSAL OF CASE 1348 IS NOW FINAL. ON APRIL 8, 2024, THE OAG FILED ANOTHER NEAR-DUPLICATE NEW CASE (CASE 354), WHICH WAS CONSOLIDATED WITH CASE 590. ON MAY 1, 2024, THE COURT GRANTED RVK'S MOTION TO DISMISS IN THE AG'S CASE 590 AND DISMISSED RVK. ON JULY 3, THE COURT DISMISSED RVK FROM THE AG'S OTHER CASE (354). THE AG APPEALED THE DISMISSALS AND AGAIN SOUGHT TO AMEND ITS COMPLAINT. THE APPEAL IS ONGOING. ALSO ON MAY 1, 2024, THE COURT GRANTED RVK'S MOTION TO DISMISS IN THE TIER 3 SUIT (CASE 645). THESE PLAINTIFFS DID NOT APPEAL, AND THIS DISMISSAL IS FINAL. THE TIER 3 PLAINTIFFS' OTHER SUIT WAS FILED IN 2021, AND IS (RELEVANT TO RVK) MATERIALLY IDENTICAL TO THE OTHER SUITS EXCEPT IT WAS FILED AS A PUTATIVE CLASS ACTION. THIS ACTION WAS REMOVED TO FEDERAL COURT, AND HAS BEEN STAYED PENDING THE STATE LITIGATION. FOR ITS PART, KPPA RETAINED AN OUTSIDE LAW FIRM (CALCATERRA POLLACK LLP) IN NOVEMBER 2020 TO INVESTIGATE AND ISSUE A REPORT. AFTER RECEIPT OF THE REPORT, KPPA'S BOARD VOTED ON MAY 26, 2021, NOT TO ""INTERVENE AS A PLAINTIFF IN THE ATTORNEY GENERAL'S AMENDED COMPLAINT"" OR ""FILE ANY LITIGATION AGAINST ANY PARTY . . . AT THIS TIME."" THE REPORT STATED THAT AFTER EXAMINING 192,000 DOCUMENTS, REVIEWING BOARD MEETING MATERIALS AND RECORDINGS, AND CONDUCTING SEVERAL INTERVIEWS, THE FIRM CONCLUDED THAT RVK ""MET [ITS] CONTRACTUAL AND FIDUCIARY DUTIES,"" ""HONESTLY DISCLOS[ED] THE INVESTMENT CHALLENGES KRS FACED,"" AND ""SERVED AS A VALUABLE CONSULTANT."" THE FIRM FOUND NO ""INDICIA OF COLLUSIONS, COVER UP, OR FIDUCIARY FAILURE"" BY RVK, AND FOUND NO ""VIOLATIONS OF FIDUCIARY DUTY OR ILLEGAL ACTIVITY"" BY RVK. THE FULL REPORT IS AVAILABLE AT HTTPS://TINYURL.COM/4YNKAH6F.  FROM THE FILING OF THE FIRST SUIT TO NOW, RVK HAS MAINTAINED THAT OUR FIRM'S YEARS OF SERVICE TO KRS WERE THOROUGHLY PROFESSIONAL, HIGHLY TRANSPARENT, AND ALWAYS CONSISTENT WITH OUR CONTRACTUAL AND FIDUCIARY DUTIES."
2012573,"AMENDED","","","","","Advisory Firm","1739766","","","","","Y","","","","","","","","","","","","","","","","","","","","","","","","","","","","","","",""
2012704,"AMENDED","","","Y","Y","Affiliates","1739928","","","","","N","VERBRAUCHERZENTRALE BADEN-WURTTEMBERG E.V. (VZBW)","Injunction","","09/26/2022","Y","","Equity Listed (Common & Preferred Stock)","","""LANDGERICHT FRANKFURT AM MAIN."" AKTENZEICHEN: 3-10 O 83/22.","N/A","THE VERBRAUCHERZENTRALE BADEN-WURTTEMBERG E.V. (""VZBW"") ALLEGED THAT DWS INVESTMENT GMBH (""DWS"") MADE MISLEADING STATEMENTS IN VIOLATION OF THE GERMAN ACT AGAINST UNFAIR COMPETITION (""UWG"") IN TWO MARKETING DOCUMENTS FOR A FUND ENTITLED ""DWS INVEST ESG CLIMATE TECH"" USED VIS-A-VIS CONSUMERS IN GERMANY.","Final","N/A","10/14/2022","Y","","Settled","03/10/2023","Y","","","","","","","","Y","","N/A","PURSUANT TO THE OUT-OF-COURT SETTLEMENT (THE ""SETTLEMENT"") DWS AND VZBW AGREED THAT, BEGINNING MARCH 22, 2023, DWS WOULD NO LONGER USE THE TWO MARKETING DOCUMENTS FOR THE FUND DWS ESG CLIMATE TECH VIS-A-VIS CONSUMERS IN GERMANY WITHOUT MAKING CERTAIN CHANGES TO THE MARKETING DOCUMENTS AND ISSUING A CORRESPONDING DECLARATION.","ON JULY 27, 2022, VZBW SENT A LETTER (THE ""LETTER"") TO DWS DEMANDING THAT DWS CEASE AND DESIST FROM MAKING CERTAIN STATEMENTS IN TWO MARKETING DOCUMENTS FOR A FUND ENTITLED ""DWS INVEST ESG CLIMATE TECH"" USED VIS-A-VIS CONSUMERS IN GERMANY WHICH THE VZBW ALLEGED WERE IN VIOLATION OF THE UWG.  ON AUGUST 18, 2022, DWS RESPONDED TO THE LETTER AND DENIED THE STATEMENTS IN THE MARKETING DOCUMENTS WERE IN VIOLATION OF THE UWG.  ON OCTOBER 14, 2022, VZBW SERVED DWS WITH THE LAWSUIT, ALLEGING THE SAME VIOLATIONS AS IN THE LETTER, IN THE LANDGERICHT FRANKFURT AM MAIN (THE DISTRICT COURT OF FRANKFURT AM MAIN).  ON MARCH 7, 2023, DWS, WITHOUT ADMITTING OR DENYING THE ALLEGATIONS, AGREED WITH VZBW TO THE SETTLEMENT, IN WHICH DWS AND VZBW AGREED THAT BEGINNING MARCH 22, 2023, DWS WOULD NO LONGER USE THE TWO MARKETING DOCUMENTS FOR THE FUND DWS ESG CLIMATE TECH VIS-A-VIS CONSUMERS IN GERMANY WITHOUT MAKING CERTAIN CHANGES TO THE MARKETING DOCUMENTS AND ISSUING A CORRESPONDING DECLARATION.  BOTH DWS AND VZBW SUBSEQUENTLY DECLARED THAT A COURT DECISION WAS NO LONGER NEEDED AND THE LANDGERICHT FRANKFURT AM MAIN DECLARED THE LAWSUIT TO BE OVER WITHOUT A COURT RULING ON MARCH 10, 2023 DUE TO THE SETTLEMENT."
2012704,"AMENDED","","Y","","","Affiliates","1739926","","","","","N","PROCURA DELLA REPUBBLICA PRESSO IL TRIBUNALE DI MILANO","Disgorgement","MONEY DAMAGES","01/13/2016","Y","","Derivative(s)","","TRIBUNALE ORDINARIO DI MILANO - SEZIONE SECONDA; 11622/16 REG. GEN.","N/A","THE MILAN PUBLIC PROSECUTOR ALLEGED THAT DEUTSCHE BANK AG/DEUTSCHE BANK AG LONDON BRANCH (""DB AG"") FAILED TO PROVIDE ADEQUATE MANAGEMENT AND SUPERVISION UNDER ITALIAN LEGISLATIVE DECREE 231 (NON-CRIMINAL LIABILITY) IN CONNECTION WITH ALLEGEDLY UNLAWFUL REPO TRANSACTIONS BETWEEN DB AG AND BANCA MONTE DEI PASCHI DI SIENA (""BMPS"") AND ITS SUBSIDIARY SANTORINI. THE TRANSACTIONS WERE ALLEGEDLY INTENDED TO HIDE BMPS LOSSES BY ALLOWING BMPS TO ACCOUNT FOR THE TRADES AS A FINANCING ON AN ACCRUAL BASIS, AND PERMITTED SOME BMPS SENIOR MANAGEMENT TO DISSEMINATE FALSE INFORMATION TO THE MARKET THROUGH THE PUBLICATION OF PRESS RELEASES QUOTING FINANCIAL DATA EMERGING FROM CERTAIN BMPS FINANCIAL STATEMENTS.","Pending","","11/08/2016","N","ON NOVEMBER 8, 2019, DBAG WAS FOUND NON-CRIMINALLY LIABLE UNDER LEGISLATIVE DECREE 231 AND SUBJECTED TO FINANCIAL PENALTIES DESCRIBED BELOW. THE COURT'S REASONING FOR ITS DECISION IS DUE TO BE PUBLISHED WITHIN 90 DAYS OF THE VERDICT, AFTER WHICH THERE ARE 45 DAYS TO NOTICE AN APPEAL. THE STATUS OF THE DISPOSITION IS PENDING, AS ALL PENALTIES WILL ONLY TAKE EFFECT AFTER THE CONCLUSION OF ANY APPEAL TO THE COURT OF APPEAL AND ANY SUBSEQUENT APPEAL TO THE SUPREME COURT OF CASSATION.","","","","","","","","","","","","","","","ON NOVEMBER 8, 2019, THE TRIBUNALE ORDINARIO DI MILANO - SEZIONE SECONDA FOUND DB AG LIABLE (NON-CRIMINALLY) FOR FAILING TO PROVIDE ADEQUATE MANAGEMENT AND SUPERVISION, IN CONNECTION WITH ALLEGEDLY UNLAWFUL REPO TRANSACTIONS BETWEEN DB AG AND BANCA MONTE DEI PASCHI DI SIENA (""BMPS"") AND ITS SUBSIDIARY SANTORINI. THE COURT ALSO SUBJECTED DB AG TO CONFISCATION OF 64.891 MILLION EUROS IN PROFITS AND FINED DB AG 3 MILLION EUROS. THE PENALTIES AND SENTENCES WILL ONLY BECOME EFFECTIVE AFTER THE CONCLUSION OF ANY APPEAL."
2012704,"AMENDED","Y","Y","","","Affiliates","1739927","","","","","N","U.S. COMMODITY FUTURES TRADING COMMISSION (""CFTC"")","Civil Penalty(ies)/Fine(s)","INJUNCTION AND COURT ORDER APPOINTING COMPLIANCE MONITOR","08/18/2016","Y","","Derivative(s)","","U.S. COMMODITY FUTURES TRADING COMMISSION V. DEUTSCHE BANK, 1:16-CV-06544 SOUTHERN DISTRICT OF NEW YORK (""SDNY"")","","THE CFTC ALLEGED THAT, WITH RESPECT TO THE REPORTING OF SWAP DATA, DEUTSCHE BANK AG (""DBAG"") FAILED TO PROPERLY REPORT AND CORRECT ERRORS IN REAL-TIME DATA, TO CORRECT ERRORS AND OMISSIONS IN PREVIOUSLY REPORTED DATA, PROVIDE DILIGENT SUPERVISION, AND MAINTAIN AN ADEQUATE BUSINESS CONTINUITY AND DISASTER RECOVERY PLAN. THE CFTC ALSO ALLEGED THAT DBAG VIOLATED A 2015 CFTC ORDER THAT RESOLVED A CFTC INVESTIGATION INTO A DIFFERENT TYPE OF SWAP REPORTING ERROR.","Final","","","","","Consent","06/17/2020","Y","","Y","9000000","","","","","Y","","","WITHOUT ADMITTING OR DENYING THE ALLEGATIONS, DBAG AGREED TO A PERMANENT INJUNCTION REQUIRING IT TO COMPLY WITH THE 2015 CFTC ORDER AND RESTRAINING IT FROM VIOLATING CERTAIN PROVISIONS OF THE COMMODITY EXCHANGE ACT (""CEA"") AND CFTC REGULATIONS RELATED TO SWAP DATA REPORTING REQUIREMENTS, BUSINESS CONTINUITY AND DISASTER RECOVERY PLANNING, AND SUPERVISION. DBAG ALSO AGREED TO PAY A $9,000,000 CIVIL MONEY PENALTY. THE FINE WAS PAID ON JULY 1, 2020.","IN AUGUST 2016, THE CFTC FILED A COMPLAINT IN THE U.S. DISTRICT COURT FOR THE SOUTHERN DISTRICT OF NEW YORK (""SDNY"") FOLLOWING AN INADVERTENT FIVE-DAY OUTAGE OF DBAG'S SWAP REPORTING PLATFORM IN APRIL 2016. DURING THE OUTAGE, DBAG WAS UNABLE TO SUBMIT ANY PRICE OR TRANSACTION DATA TO THE DATA REPOSITORY. AT THE TIME OF THE OUTAGE, DBAG WAS SUBJECT TO A CFTC SETTLEMENT ORDER DATED SEPTEMBER 30, 2015, ARISING OUT OF A DIFFERENT TYPE OF SWAP REPORTING ERROR, WHICH REQUIRED DBAG TO REMEDIATE ITS SWAP DATA REPORTING PROGRAM. IN CONNECTION WITH THESE REMEDIAL UNDERTAKINGS, DBAG ATTEMPTED TO PERFORM A MAINTENANCE UPGRADE TO ITS SWAP REPORTING PLATFORM, DURING WHICH ITS VENDOR CAUSED THE OUTAGE BY INADVERTENTLY COPYING OUTDATED OR UNSYNCHRONIZED DATA FILES FROM THE BACKUP PLATFORM TO THE MAIN PLATFORM. BECAUSE THE BACKUP PLATFORM WAS ALSO AFFECTED, DBAG WAS UNABLE TO PROMPTLY RESUME REPORTING AFTER THE INCIDENT AS PRESCRIBED BY ITS BUSINESS CONTINUITY AND DISASTER RECOVERY PLAN. DBAG PROMPTLY NOTIFIED THE CFTC OF THE OUTAGE AND PROVIDED EXTENSIVE COOPERATION TO THE CFTC'S STAFF FROM THE TIME OF THE OUTAGE THROUGH THE TIME OF THE RESOLUTION OF THE LAWSUIT. ON JUNE 17, 2020, DBAG, WITHOUT ADMITTING OR DENYING THE FINDINGS OR CONCLUSIONS THEREIN, ENTERED INTO A SETTLEMENT WITH THE CFTC. SDNY APPROVED THE SETTLEMENT IN ITS CONSENT ORDER FOR PERMANENT INJUNCTION, CIVIL MONETARY PENALTY, AND OTHER EQUITABLE RELIEF AGAINST DEUTSCHE BANK AG (THE ""ORDER""). THE ORDER ENJOINED DBAG FROM VIOLATING CERTAIN CEA PROVISIONS AND CFTC RULES RELATED TO SWAP DATA REPORTING REQUIREMENTS, BUSINESS CONTINUITY AND DISASTER RECOVERY PLANNING, AND SUPERVISION; ORDERED DBAG TO COMPLY WITH ITS 2015 CFTC ORDER; AND REQUIRED DBAG TO PAY A CIVIL MONEY PENALTY OF $9,000,000, THE FINE WAS PAID ON JULY 1, 2020."
2012711,"AMENDED","","","Y","Y","Affiliates","1740010","","","","","N","VERBRAUCHERZENTRALE BADEN-WURTTEMBERG E.V. (VZBW)","Injunction","","09/26/2022","Y","","Equity Listed (Common & Preferred Stock)","","""LANDGERICHT FRANKFURT AM MAIN."" AKTENZEICHEN: 3-10 O 83/22.","N/A","THE VERBRAUCHERZENTRALE BADEN-WURTTEMBERG E.V. (""VZBW"") ALLEGED THAT DWS INVESTMENT GMBH (""DWS"") MADE MISLEADING STATEMENTS IN VIOLATION OF THE GERMAN ACT AGAINST UNFAIR COMPETITION (""UWG"") IN TWO MARKETING DOCUMENTS FOR A FUND ENTITLED ""DWS INVEST ESG CLIMATE TECH"" USED VIS-A-VIS CONSUMERS IN GERMANY.","Final","N/A","10/14/2022","Y","","Settled","03/10/2023","Y","","","","","","","","Y","","N/A","PURSUANT TO THE OUT-OF-COURT SETTLEMENT (THE ""SETTLEMENT"") DWS AND VZBW AGREED THAT, BEGINNING MARCH 22, 2023, DWS WOULD NO LONGER USE THE TWO MARKETING DOCUMENTS FOR THE FUND DWS ESG CLIMATE TECH VIS-A-VIS CONSUMERS IN GERMANY WITHOUT MAKING CERTAIN CHANGES TO THE MARKETING DOCUMENTS AND ISSUING A CORRESPONDING DECLARATION.","ON JULY 27, 2022, VZBW SENT A LETTER (THE ""LETTER"") TO DWS DEMANDING THAT DWS CEASE AND DESIST FROM MAKING CERTAIN STATEMENTS IN TWO MARKETING DOCUMENTS FOR A FUND ENTITLED ""DWS INVEST ESG CLIMATE TECH"" USED VIS-A-VIS CONSUMERS IN GERMANY WHICH THE VZBW ALLEGED WERE IN VIOLATION OF THE UWG.  ON AUGUST 18, 2022, DWS RESPONDED TO THE LETTER AND DENIED THE STATEMENTS IN THE MARKETING DOCUMENTS WERE IN VIOLATION OF THE UWG.  ON OCTOBER 14, 2022, VZBW SERVED DWS WITH THE LAWSUIT, ALLEGING THE SAME VIOLATIONS AS IN THE LETTER, IN THE LANDGERICHT FRANKFURT AM MAIN (THE DISTRICT COURT OF FRANKFURT AM MAIN).  ON MARCH 7, 2023, DWS, WITHOUT ADMITTING OR DENYING THE ALLEGATIONS, AGREED WITH VZBW TO THE SETTLEMENT, IN WHICH DWS AND VZBW AGREED THAT BEGINNING MARCH 22, 2023, DWS WOULD NO LONGER USE THE TWO MARKETING DOCUMENTS FOR THE FUND DWS ESG CLIMATE TECH VIS-A-VIS CONSUMERS IN GERMANY WITHOUT MAKING CERTAIN CHANGES TO THE MARKETING DOCUMENTS AND ISSUING A CORRESPONDING DECLARATION.  BOTH DWS AND VZBW SUBSEQUENTLY DECLARED THAT A COURT DECISION WAS NO LONGER NEEDED AND THE LANDGERICHT FRANKFURT AM MAIN DECLARED THE LAWSUIT TO BE OVER WITHOUT A COURT RULING ON MARCH 10, 2023 DUE TO THE SETTLEMENT."
2012711,"AMENDED","","Y","","","Affiliates","1740009","","","","","N","PROCURA DELLA REPUBBLICA PRESSO IL TRIBUNALE DI MILANO","Disgorgement","MONEY DAMAGES","01/13/2016","Y","","Derivative(s)","","TRIBUNALE ORDINARIO DI MILANO - SEZIONE SECONDA; 11622/16 REG. GEN.","N/A","THE MILAN PUBLIC PROSECUTOR ALLEGED THAT DEUTSCHE BANK AG/DEUTSCHE BANK AG LONDON BRANCH (""DB AG"") FAILED TO PROVIDE ADEQUATE MANAGEMENT AND SUPERVISION UNDER ITALIAN LEGISLATIVE DECREE 231 (NON-CRIMINAL LIABILITY) IN CONNECTION WITH ALLEGEDLY UNLAWFUL REPO TRANSACTIONS BETWEEN DB AG AND BANCA MONTE DEI PASCHI DI SIENA (""BMPS"") AND ITS SUBSIDIARY SANTORINI. THE TRANSACTIONS WERE ALLEGEDLY INTENDED TO HIDE BMPS LOSSES BY ALLOWING BMPS TO ACCOUNT FOR THE TRADES AS A FINANCING ON AN ACCRUAL BASIS, AND PERMITTED SOME BMPS SENIOR MANAGEMENT TO DISSEMINATE FALSE INFORMATION TO THE MARKET THROUGH THE PUBLICATION OF PRESS RELEASES QUOTING FINANCIAL DATA EMERGING FROM CERTAIN BMPS FINANCIAL STATEMENTS.","Pending","","11/08/2019","N","ON NOVEMBER 8, 2019, DBAG WAS FOUND NON-CRIMINALLY LIABLE UNDER LEGISLATIVE DECREE 231 AND SUBJECTED TO FINANCIAL PENALTIES DESCRIBED BELOW. THE COURT'S REASONING FOR ITS DECISION IS DUE TO BE PUBLISHED WITHIN 90 DAYS OF THE VERDICT, AFTER WHICH THERE ARE 45 DAYS TO NOTICE AN APPEAL. THE STATUS OF THE DISPOSITION IS PENDING, AS ALL PENALTIES WILL ONLY TAKE EFFECT AFTER THE CONCLUSION OF ANY APPEAL TO THE COURT OF APPEAL AND ANY SUBSEQUENT APPEAL TO THE SUPREME COURT OF CASSATION.","","","","","","","","","","","","","","","ON NOVEMBER 8, 2019, THE TRIBUNALE ORDINARIO DI MILANO - SEZIONE SECONDA FOUND DB AG LIABLE (NON-CRIMINALLY) FOR FAILING TO PROVIDE ADEQUATE MANAGEMENT AND SUPERVISION, IN CONNECTION WITH ALLEGEDLY UNLAWFUL REPO TRANSACTIONS BETWEEN DB AG AND BANCA MONTE DEI PASCHI DI SIENA (""BMPS"") AND ITS SUBSIDIARY SANTORINI. THE COURT ALSO SUBJECTED DB AG TO CONFISCATION OF 64.891 MILLION EUROS IN PROFITS AND FINED DB AG 3 MILLION EUROS. THE PENALTIES AND SENTENCES WILL ONLY BECOME EFFECTIVE AFTER THE CONCLUSION OF ANY APPEAL."
2012711,"AMENDED","Y","Y","","","Affiliates","1740008","","","","","N","U.S. COMMODITY FUTURES TRADING COMMISSION (""CFTC"")","Civil Penalty(ies)/Fine(s)","INJUNCTION AND COURT ORDER APPOINTING COMPLIANCE MONITOR","08/18/2016","Y","","Derivative(s)","","U.S. COMMODITY FUTURES TRADING COMMISSION V. DEUTSCHE BANK, 1:16-CV-06544 SOUTHERN DISTRICT OF NEW YORK (""SDNY"")","","THE CFTC ALLEGED THAT, WITH RESPECT TO THE REPORTING OF SWAP DATA, DEUTSCHE BANK AG (""DBAG"") FAILED TO PROPERLY REPORT AND CORRECT ERRORS IN REAL-TIME DATA, TO CORRECT ERRORS AND OMISSIONS IN PREVIOUSLY REPORTED DATA, PROVIDE DILIGENT SUPERVISION, AND MAINTAIN AN ADEQUATE BUSINESS CONTINUITY AND DISASTER RECOVERY PLAN. THE CFTC ALSO ALLEGED THAT DBAG VIOLATED A 2015 CFTC ORDER THAT RESOLVED A CFTC INVESTIGATION INTO A DIFFERENT TYPE OF SWAP REPORTING ERROR.","Final","","","","","Consent","06/17/2020","Y","","Y","9000000","","","","","Y","","","WITHOUT ADMITTING OR DENYING THE ALLEGATIONS, DBAG AGREED TO A PERMANENT INJUNCTION REQUIRING IT TO COMPLY WITH THE 2015 CFTC ORDER AND RESTRAINING IT FROM VIOLATING CERTAIN PROVISIONS OF THE COMMODITY EXCHANGE ACT (""CEA"") AND CFTC REGULATIONS RELATED TO SWAP DATA REPORTING REQUIREMENTS, BUSINESS CONTINUITY AND DISASTER RECOVERY PLANNING, AND SUPERVISION. DBAG ALSO AGREED TO PAY A $9,000,000 CIVIL MONEY PENALTY. THE FINE WAS PAID ON JULY 1, 2020.","IN AUGUST 2016, THE CFTC FILED A COMPLAINT IN THE U.S. DISTRICT COURT FOR THE SOUTHERN DISTRICT OF NEW YORK (""SDNY"") FOLLOWING AN INADVERTENT FIVE-DAY OUTAGE OF DBAG'S SWAP REPORTING PLATFORM IN APRIL 2016. DURING THE OUTAGE, DBAG WAS UNABLE TO SUBMIT ANY PRICE OR TRANSACTION DATA TO THE DATA REPOSITORY. AT THE TIME OF THE OUTAGE, DBAG WAS SUBJECT TO A CFTC SETTLEMENT ORDER DATED SEPTEMBER 30, 2015, ARISING OUT OF A DIFFERENT TYPE OF SWAP REPORTING ERROR, WHICH REQUIRED DBAG TO REMEDIATE ITS SWAP DATA REPORTING PROGRAM. IN CONNECTION WITH THESE REMEDIAL UNDERTAKINGS, DBAG ATTEMPTED TO PERFORM A MAINTENANCE UPGRADE TO ITS SWAP REPORTING PLATFORM, DURING WHICH ITS VENDOR CAUSED THE OUTAGE BY INADVERTENTLY COPYING OUTDATED OR UNSYNCHRONIZED DATA FILES FROM THE BACKUP PLATFORM TO THE MAIN PLATFORM. BECAUSE THE BACKUP PLATFORM WAS ALSO AFFECTED, DBAG WAS UNABLE TO PROMPTLY RESUME REPORTING AFTER THE INCIDENT AS PRESCRIBED BY ITS BUSINESS CONTINUITY AND DISASTER RECOVERY PLAN. DBAG PROMPTLY NOTIFIED THE CFTC OF THE OUTAGE AND PROVIDED EXTENSIVE COOPERATION TO THE CFTC'S STAFF FROM THE TIME OF THE OUTAGE THROUGH THE TIME OF THE RESOLUTION OF THE LAWSUIT. ON JUNE 17, 2020, DBAG, WITHOUT ADMITTING OR DENYING THE FINDINGS OR CONCLUSIONS THEREIN, ENTERED INTO A SETTLEMENT WITH THE CFTC. SDNY APPROVED THE SETTLEMENT IN ITS CONSENT ORDER FOR PERMANENT INJUNCTION, CIVIL MONETARY PENALTY, AND OTHER EQUITABLE RELIEF AGAINST DEUTSCHE BANK AG (THE ""ORDER""). THE ORDER ENJOINED DBAG FROM VIOLATING CERTAIN CEA PROVISIONS AND CFTC RULES RELATED TO SWAP DATA REPORTING REQUIREMENTS, BUSINESS CONTINUITY AND DISASTER RECOVERY PLANNING, AND SUPERVISION; ORDERED DBAG TO COMPLY WITH ITS 2015 CFTC ORDER; AND REQUIRED DBAG TO PAY A CIVIL MONEY PENALTY OF $9,000,000, THE FINE WAS PAID ON JULY 1, 2020."
