"FilingID","Miscellaneous"
2007960,"As it relates to section 5(D), field (n)(3) and section 5(I)(2)(b), Adviser attributes $0 of its regulatory assets under management for the 20 UMA/wrap fee programs for which it is a portfolio manager."
2008018,"Schedule A/C Direct Owners / Executive Officers: Avraham Dreyfuss (CRD No. 7939655) does not have a middle name."
2008133,"WITH RESPECT TO 5.A. AND B., THE WINTHROP CORPORATION, A DIRECT OWNER OF THE REGISTRANT REFERENCED IN SCHEDULE A, ALLOCATES CERTAIN EMPLOYEES TO PERFORM ALL WORK FOR THE REGISTRANT.  REGISTRANT IS THE SOLE OWNER OF A LIMITED LIABILITY COMPANY (LLC) NAMED IN SECTION 7.A. THE LLC IS AN RIA, BUT IT IS NOT A PRIVATE FUND AND REGISTRANT'S CLIENTS ARE NOT SOLICITED TO INVEST IN IT.  06/2025 - OTAA being filed to reflect CIO retiring"
2008137,"REGISTRANT'S SUBSIDIARY IS THE SOLE OWNER OF A LIMITED LIABILITY COMPANY (LLC) NAMED IN SECTION 7.A. THE LLC IS AN RIA, BUT IT IS NOT A PRIVATE FUND AND NEITHER REGISTRANT'S NOR ITS SUBSIDIARY'S CLIENTS ARE SOLICITED TO INVEST IN IT.  06/2025-OTAA filed to remove Mr. Van Daalen from Sched A (retired)"
2008139,"WITH RESPECT TO 5.A. AND B., THE WINTHROP CORPORATION, AN INDIRECT OWNER OF THE REGISTRANT REFERENCED IN SCHEDULE B, ALLOCATES CERTAIN EMPLOYEES TO PERFORM ALL WORK FOR THE REGISTRANT.  06/25 - OTAA filed to upload remove Mr. Van Daalen from Sched A (retired)"
2008141,"The Florida Office of Financial Regulation considers advisors who deduct fees directly from client accounts to have custody of the assets of those clients and require Section 9, Custody, to be answered affirmatively for this reason. Tripletail Wealth Management, LLC does not otherwise have physical custody of any client assets, and follows the safeguards prescribed by Florida to protect client assets including notifying the state that fees are directly deducted from accounts, obtaining written authorization from the client to deduct the fees, ensuring that clients receive statements at least quarterly from the qualified custodian where the assets are held showing all transactions in the account, and providing clients with a calculation of the fee each time fees are deducted from the account."
2008145,"Item 9 does not allow Hobart to indicate that Hobart has custody of $118,282,424 (as of 12-31-24) as a result of third-party standing letters of authorization. Hobart has implemented procedures to comply with the requirements outlined by the SEC in its February 21, 2017 No-Action Letter to the Investment Adviser Association and thus, is not required to receive an audit for these funds."
2008153,"EXPLANATION FOR ITEM 8G TO FORM ADV, PART 1A:  SOME BROKER/DEALERS PROVIDE RESEARCH AND BROKERAGE SERVICES TO FAIRMOUNT IN ACCORDANCE WITH SECTION 28(e) OF THE SECURITIES EXCHANGE ACT OF 1934. HOWEVER, FAIRMOUNT DOES NOT PAY FOR ANY SUCH SERVICES WITH SOFT DOLLARS."
2008000,"Schedule A - Alison Davis does not have a middle name."
2007356,"Item 5B(5) Certain IARs maintain insurance licenses for the purposes of providing advice only; no associates are agents of any company or agency, none sell insurance products, and none receive compensation for the sale of insurance products or continuing commissions (trails) for insurance products.  SCHEDULE D/SECTION 1F: ALL OFFICES ARE OF COMPARABLE SCALE AND LISTED ACCORDINGLY.  SECTION 7: AN IAR OF GARRETT INVESTMENT ADVISORS IS A CPA AND MEMBER OF A CPA FIRM AS AN OBA."
2008197,"In January 2024, PLL Fund entered into a multi-state settlement, led by the Texas State Securities Board and over 30 other states, that allowed the Fund to avoid financial penalties by returning customer assets in accordance with the settlement?s requirements. In June 2024, the Fund and other affiliated entities, reached a similar settlement with money transmitter regulators led by the Washington Department of Financial Institutions. Most of these settlements were also signed by Mr. William Barhydt, who, under certain money transmitter settlement terms, must refrain from serving in a control person role at money transmitters for five years. PLL Fund and the other affiliates are currently in compliance with all of the settlement obligations."
2008212,"ITEM 6.B.(1) - HTP OPERATES AND PROVIDES MULTIFAMILY OFFICE SERVICES TO TARGET CLIENTS WHOSE TYPICAL LIQUID ASSETS EXCEED $25 MILLION DOLLARS OR WHOSE TOTAL NET WORTH EXCEEDS $50 MILLION DOLLARS. THESE SERVICES CAN INCLUDE THE MANAGING OF NON-SECURITIZED REAL ESTATE HOLDINGS, THE MANAGEMENT OF BUSINESS ENTITIES, INCLUDING CLOSELY-HELD BUSINESSES, THE HIRING OF OUTSIDE CONSULTANTS, INCLUDING BOOKKEEPERS AND BOOKKEEPING SERVICES, ATTORNEYS, PRIVATE BANKERS, ACCOUNTANTS, INSURANCE ADVISORS, PRIVATE SECURITY SERVICES, FAMILY EDUCATION ADVISORS, REAL ESTATE MANAGEMENT FIRMS, AND AD HOC CONCIERGE SERVICES THAT ARE TYPICALLY REQUESTED BY FAMILY OFFICES. HT PARTNERS WILL ALSO ASSIST CLIENTS WHO FIT OUR PROFILE IN THE CREATION AND DESIGN OF A FAMILY OFFICE ENTITY INCLUDING ONGOING MANAGEMENT OF THAT ENTITY ONCE IT IS CREATED.  HTP EMPLOYEES AND PRINCIPAL OFFICERS MAY SPEND UP TO 30% OF THEIR TIME ON THESE NON-ADVISORY ACTIVITIES."
2007814,"INSIGNEO ADVISORY SERVICES, LLC SERVES AS INVESTMENT ADVISER TO INSIGNEO ACCESS - VINTAGE FUND I LP, WHICH IS A DELAWARE LIMITED PARTNERSHIP ORGANIZED IN JANUARY 2022. THE PARTNERSHIP IS OFFERING LIMITED PARTNERSHIP INTERESTS IN THE PARTNERSHIP PURSUANT TO THE PRIVATE OFFERING MEMORANDUM. INSIGNEO ADVISORY SERVICES LLC WILL EXERCISE FULL AND EXCLUSIVE DISCRETIONARY AUTHORITY TO INVEST AND, SUBJECT TO CERTAIN LIMITATIONS, REINVEST THE PARTNERSHIP'S ASSETS."
2007563,"Custody is  disclosed in Item 9A of Form ADV part 1A because Carlton Hofferkamp & Jenks Wealth Management, LLC has authority to transfer money from client account(s), which constitutes a standing letter of authorization (SLOA). Accordingly, Carlton Hofferkamp & Jenks Wealth Management, LLC will follow the safeguards specified by the SEC rather than undergo an annual audit."
2011011,"Item 9 does not allow Bayntree to indicate that the Firm has custody as a result of standing letters of authorization. Bayntree has implemented procedures to comply with the requirements outlined by the SEC in its February 21, 2017 No-Action Letter to the Investment Adviser Association and is therefore not required to receive an audit for these funds."
2013004,"In accordance with the SEC no-action letter with respect to Rule 206(4)-2 under the Investment Advisers Act of 1940, our firm has disclosed the number of clients with Standing Letters of Authorization (""SLOA"") directed to third parties and the value of assets in those client accounts in Item 9. Further, our firm is not subject to the surprise independent examination requirement as we have adopted safeguards disclosed in Item 15 of our Firm Brochure in accordance with the no-action letter."
2013040,"- Mr. CHO,Wanyoun by Ms. ZHU, Lili as the Chief Executive Officer since August 2025. - Regarding Section 5 on Marketing activities - there is no marketing activities targeted US individuals/ corporations. When issuing marketing materials, we ensure it is compliant with applicable rules and regulations e.g. HK SFC."
2005950,"The Firm has reviewed the instructions to Schedule B and notes there are no indirect owners required to be reported on Schedule B. The owner is a public reporting company."
2011007,"Section 1.F of Schedule D - Offices listed are BlackRock, Inc., offices from which certain SpiderRock Advisors employees work. For Section 1.F of Schedule D and Item 5.B.(1), personnel involved in investment functions include portfolio management, strategy and trading, research, client service, and business development teams. Item 5.D.(1)(n) and Item 5.D.(3)(n) ?Other? category includes Family Offices."
2009367,"Applicant is neither endorsed nor recommended by any wrap fee program sponsor firm other than Stephens, Inc, Envestnet, Janney Montgomery Scott ? Advisor Program, LPL, Raymond James ? CS, Robert W. Baird, Inc. ? Managed Account Network, Morgan Stanley ? CES and Select UMA, SmartX and Sanctuary Wealth.  Applicant manages certain accounts in programs that permit a ?dual contract? in which the client of the sponsor firm hires applicant."
2010356,"Item 1.L. Some of the Firm's books and records are maintained at Branch locations.   RAUM and related data are presented as of 12/31/2024 and include assets of Osaic FS, Inc. and Osaic FA, Inc. (a former advisory affiliate of Osaic Wealth, Inc), which merged with Osaic Wealth Inc. January 17, 2025.  Schedule A - All individuals reported on Part 1, Schedule A who have a middle name or middle initials have been reported as such in the Schedule A, replicating their individual FINRA CRD filing. Certain individuals on Schedule A are reported without a middle name or middle initial because their full legal name does not contain a middle name or middle initial."
2010413,"Item 1.L. Some of the Firm's books and records are maintained at Branch locations."
2010359,"No individuals or entities own 25% or more of Warbler Labs Incorporated.  Heron Advisory, Inc. d.b.a Heron Finance (""Heron"") has an operational interactive website (www.heronfinance.com) and therefore is eligible to register under the internet adviser exemption.  Item 9C(1):  Inspira is Heron's Finance's independent qualified custodian.  Heron Finance distributes investors quarterly statements directly and is in process of obtaining an independent public accountant to complete the surprise exam."
2010632,"ITEM 5.D: THE REGISTRANT DOES NOT CURRENTLY HAVE ANY ADVISORY CLIENTS OR REGULAOTRY ASSETS UNDER MANAGEMENT, HOWEVER UPON EFFECTIVENESS AS AN SEC REGISTERED INVESTMENT ADVISER AND ITS START OF BUSINESS, THE REGISTRANT WILL PROVIDE ADVISORY SERVICES TO A POOLED INVESTMENT VEHICLE.  ITEM 8.G.(1): INDICATES ""YES"" BECAUSE A RELATED PARTY OF THE REGISTRANT MAY RECEIVE SOFT DOLLAR BENEFITS. THE REGISTRANT CURRENTLY HAS NO ""SOFT DOLLAR"" ARRANGEMENTS. SCHEDULE B. THE TIAA BOARD OF GOVERNORS IS A NEW YORK NOT-FOR-PROFIT CORPORATION, AND REFLECTS THE ULTIMATE INDIRECT OWNER OF THE REGISTRANT.  SCHEDULE D, SECTION 7.A: EXCLUDES RELATED PERSONS FOR WHICH THE REGISTRANT (1) HAS NO BUSINESS DEALINGS WITH IN CONNECTION WITH ADVISORY SERVICES THE REGISTRANT PROVIDE TO ITS CLIENTS; (2) DOES NOT CONDUCT SHARED OPERATIONS WITH THE RELATED PERSON; (3) DOES NOT REFER CLIENTS OR BUSINESS TO THE RELATED PERSON, AND THE RELATED PERSON DOES NOT REFER PROSPECTIVE CLIENTS OR BUSINESS TO THE REGISTRANT; (4) DOES NOT SHARE SUPERVISED PERSONS OR PREMISES WITH THE RELATED PERSON; AND (5) DOES NOT HAVE REASON TO BELIEVE THAT THE REGISTRANT'S RELATIONSHIP WITH THE RELATED PERSON OTHERWISE CREATES A CONFLICT OF INTEREST WITH THE REGISTRANT'S CLIENTS. UPON REQUEST, COMPLETE INFORMATION ABOUT SUCH RELATED PERSONS WILL BE MADE AVAILABLE TO THE STAFF OF THE SEC."
2013186,"ITEM 9.A. SOLELY REFLECTS CUSTODY PURSUANT TO STANDING LETTERS OF AUTHORIZATION (?SLOA?) OR OTHER SIMILAR ASSET TRANSFER AUTHORIZATION ARRANGEMENTS ESTABLISHED BY CLIENTS WITH QUALIFIED CUSTODIANS."
2013282,"The firm includes ""commissions"" as a form of compensation in response to Item 5.E due to the firm's ongoing collection of insurance sales commissions in its capacity as an insurance agency. Neither the firm nor its representatives solicit or place new commission-based insurance products, but continue to collect trail commissions for prior insurance sales.  The firm responds affirmatively to Item 5.I(2)(b) to indicate that a portion of the firm's regulatory assets under management are managed via an unaffiliated third-party adviser's wrap fee program. The firm is not, itself, a wrap fee program manager, but has regulatory assets under management attributable to another firm's wrap fee program."
2013287,"Upon SEC Registration, BufferLABS plans to be a sub-advisor to a buffered ETF."
2011197,"In Section 1 F Other Offices, we selected that one employee performs investment advisory functions from the office location for several offices. However some of the offices are staffed based on arranged meetings so may have zero or more than one employee performing investment advisory functions from the various offices at any given time. The Troy Office has 1 employee performing investment advisory functions. The Ann Arbor and Bloomfield Hills Offices each have 2 employees performing investment advisory functions.   Registrant is relying on the SEC No-Action Letter issued to the Investment Adviser Association (publicly available February 21, 2017). Pursuant to the instructions in that No Action Letter, Registrant is reporting those regulatory assets under management that are subject to a SLOA to one or more third parties under Item 9.A.  The only assets reported therein are reported solely because the are subject to Standing Letters of Authorization. Item 9 A (1) (a) and (b) and Item 9 A (2)  were answered yes due to the SEC No-Action Letter definition of custody.  Registrant has third party SLOA to transfer cash, but not securities, on some client accounts. Item 9.F reflects only those persons that act as qualified custodians for clients with third party SLOA."
2010959,"REGISTRANT AND ITS AFFILIATES HAVE LITTLE TO NO VISIBILITY INTO THE UNDERLYING INVESTORS IN THE COLLATERALIZED DEBT OBLIGATION VEHICLES (""CDOS""), COLLATERALIZED LOAN OBLIGATION VEHICLES (""CLOS"") AND ASSET BACKED SECURITY VEHICLES (""ABS"") IT MANAGES THAT ARE LISTED IN SCHEDULE D SECTION 7.B.1. THUS, REGISTRANT IS UNABLE TO PROVIDE CERTAIN INFORMATION ON THE COMPOSITION OF THE INVESTORS (E.G., NUMBER OF BENEFICIAL OWNERS, NUMBER OF FUND OF FUNDS INVESTORS, NUMBER OF NON-U.S. INVESTORS) AND HAVE INCLUDED ""0"" (ZERO) IN ITS RESPONSE TO THOSE QUESTIONS WITH RESPECT TO THE CDOS, CLOS AND ABS."
2011250,"Schedule A. Individuals listed on Schedule A do not currently have ownership of the Registrant. These individuals are involved in the design of the ADV disclosures and will have ownership listed on Schedule A in the future.  The Registrant respectfully requests an approval date of October 16, 2025."
2011267,"In response to Item 7.B (16): Michael Christians and Dennis Berry are Members of Funds managed by Black Knight Alternative Investments, LLC.  Please see the ERA filings for Black Knight Alternative Investments, LLC."
2008971,"DISCLOSURES REGARDING BRANDON E. LACOFF OUTSIDE BUSINESS ACTIVITY: ONE OF THE FIRM'S INDIRECT OWNERS, BRANDON E. LACOFF, IS INVOLVED IN BUSINESSES SUCH AS REAL ESTATE, LAW, AND ACCOUNTING. THESE OUTSIDE ACTIVITIES MAY PRESENT A CONFLICT OF INTEREST. PLEASE SEE OUR FORM ADV PART 2A FOR ADDITIONAL DISCLOSURE.  Custody is reported in Item 9A solely due to certain standing letters of authorization that permit the distribution of client funds to third parties. The firm endeavors to comply with the SEC no-action letter to the Investment Adviser Association dated February 21, 2017 in this regard."
2009065,"Sound Point CRE Management, LP (?CRE?) and SPCRE InPoint Advisers, LLC (?SPCRE?), which are both under common control with the Registrant and provide advisory services in a sub-advisory caacity to one or more real estate investment trusts, were both previously registered as Exept Reporting Advisers with the SEC. On 2/14/2024 both CRE and SPCRE filed their final Exempt Reporting Adviser report with the SEC because they no longer meet the requirements necessary to be registered as an Exempt Reporting Adviser. Neither CRE nor SPCRE are obligated to register as an investment adviser in the State of New York because they both have fewer than six (6) New York clients. Although not registered with the SEC or as a state registered adviser, both CRE and SPCRE continue to be subject to the compliance program of Sound Point Capital Management LP, an SEC registered investment adviser.  WITH RESPECT TO THE QUESTIONS REGARDING Sound Point Commerical Real Estate Finance LLC (""SPCREF"")RELATED PERSON IN ITEM 7.A, Stone Point Capital LLC may be deemed to be under common control with SPCREF because one of its principals is a member of Sound Point Capital Management LP?s Board of Managers, which includes certain rights of approval over actions Sound Point Capital Management, LP (""Sound Point"") that could indirectly impact SPCREF's client accounts; however, the role does not involve control over Sound Point or SPCREF?s day-to-day operations or the right to participate in any committees that make investment decisions for SPCREF's client accounts. CERTAIN PERSONS WHO MAY BE DEEMED RELATED PERSONS of SPCREF BECAUSE OF POTENTIAL COMMON CONTROL ARE NOT INCLUDED IF: (I) SPCREF HAS NO BUSINESS DEALINGS IN CONNECTION WITH ADVISORY SERVICES SPCRE PROVIDES TO ITS CLIENTS; (2) SPCREF DOES NOT CONDUCT SHARED OPERATIONS; (3) SPCREF DOES NOT REFER CLIENTS OR BUSINESS, AND WHO DOES NOT REFER PROSPECTIVE CLIENTS OR BUSINESS TO SPCREF; AND (4) SPCREF DOES NOT SHARE SUPERVISED PERSONS OR PREMISES.  IN ADDITION, SPCRE DOES NOT BELIEVE THAT ITS RELATIONSHIP WITH SUCH COMPANIES OTHERWISE CREATES A CONFLICT OF INTEREST WITH SPCREF'S CLIENTS."
2004483,"EXCEPT AS OTHERWISE INDICATED, THE VALUES REFLECTED IN RESPONSES HEREIN ARE AS OF JULY 31, 2025.  IN RESPONSE TO ITEM 5.F.(3), REGISTRANT PROVIDES INFORMATION AT THE MASTER FUND LEVEL AND INCLUDES THE PORTION OF THE ASSETS OF TAPROOT MASTER FUND LP THAT IS ATTRIBUTABLE TO THE DELAWARE-DOMICILED FEEDER FUND THAT INVESTS IN IT.  IN ITEM 5.L.1.B., THE REGISTRANT HAS ANSWERED ?NO? BECAUSE IT DOES NOT OFFER SPECIFIC INVESTMENT ADVICE AS THAT TERM IS USED IN 206(4)(A)(5), I.E., ?SPECIFIC INVESTMENT ADVICE PROVIDED BY THE INVESTMENT ADVISER WHERE SUCH INVESTMENT ADVICE IS NOT PRESENTED IN A MANNER THAT IS FAIR AND BALANCED.? THE VALUES REFLECTED IN SCHEDULE D, SECTION 7.B.(1) REPRESENT THE REGULATORY ASSETS UNDER MANAGEMENT (?RAUM?) FOR EACH CLIENT? PROVIDED THAT, IN ORDER TO AVOID DOUBLE COUNTING OF REGISTRANT?S RAUM, FOR MASTER/-FEEDER ARRANGEMENTS, ONLY THE MASTER- FUND?S RAUM IS INCLUDED.    THE RESPONSES TO ITEM 7.B.(1), QUESTION 23 REFLECT THAT THE FUNDS, WHICH WERE FORMED IN MARCH 2025 AND LAUNCHED ON JULY 1, 2025, WILL BE SUBJECT TO ANNUAL AUDIT FOR ITS FIRST FISCAL YEAR ENDING DECEMBER 31, 2025.  ERNST & YOUNG LTD. HAS BEEN ENGAGED TO SERVE AS INDEPENDENT AUDITORS FOR TAPROOT MASTER FUND LP, TAPROOT FUND (US) LP, AND TAPROOT FUND (CAYMAN) LTD. FOR ITS PERIOD ENDING DECEMBER 31, 2025. THE RESPONSE TO ITEM 7.B.(1), QUESTION 27 REFLECTS THAT THE FUNDS WERE NOT IN OPERATION DURING THE LAST FISCAL YEAR (12/31/24)."
2011366,"Item 5.A The employee numbers in Item 5.A are generated by Mercer Global Advisors? payroll system and do not reflect new employees that joined the firm due to acquisitions that closed on 12/31/2024 as the employee start date with the firm is 1/1/2025.  Item 5.F.(2)  Regulatory Assets Under Management reported in Item 5.F.(2) does not include all assets gained from recent acquisitions where the advisory agreements have been properly assigned to Mercer Global Advisors, but the custodial accounts have yet to be transferred and/or the accounts have yet to be migrated to our portfolio management system. Mercer Global Advisors provides a larger asset number in its marketing materials.  Item 9.A Mercer Global Advisors has custody of client funds and securities where the firm acts pursuant to a Standing Letter of Authorization (?SLOA?) or other similar arrangement established by a client with a qualified custodian and authorizes Mercer Global Advisors to transfer client assets to a third party and designate the amount or timing of transfers with that custodian.    Mercer Global Advisors does not maintain physical custody of client assets.  Mercer Global Advisors has custody for a limited number of clients as we provide bill paying and reporting services where we have client log on information.  In addition, Mercer Global Advisors financial advisors act, in limited instances, as trustee for client accounts. Because of these actions, Mercer Global Advisors Inc. is deemed to have custody of client assets and must undergo an independent examination at least once during each calendar year by an independent public accountant, pursuant to a written agreement between the firm and the accountant, at a time to be determined by the accountant without prior notice or announcement and that is irregular from year to year.  Schedule C- In the course of normal operations as our business grows, employees of Mercer Global Advisors Inc. may choose to move into different positions within the firm.  Two of our executive officers still serve in a senior management role within the firm, but no longer fall under the defined roles in Schedule C.   Schedule B- All indirect owners with an ownership interest of 25% or more and current information are reported on Schedule B."
2011374,"The Regulatory Assets under Management, client numbers, and account numbers are current as of February 15, 2024."
2010674,"Item 9: In response to the no--action letter issued by the SEC on February 21, 2017, the Advisor is reporting in Item 9 the clients (1137) and assets ($4,206,596,863) that are subject to standing letters of authorization for money movements. These accounts meet the seven conditions from the no action letter and therefore are not be subject to the ?independent verification? requirement for custody."
2009035,"DENHAM CALCULATED ITS REGULATORY ASSETS UNDER MANAGEMENT BY PROVIDING THE TOTAL OF FAIR VALUE OF INVESTMENTS, CASH ON HAND AND TOTAL CAPITAL AVAILABLE TO BE CALLED FROM INVESTORS OF EACH CLIENT. THE GROSS ASSET VALUE OF EACH CLIENT AS REPORTED ON SCHEDULE 7.B.(1) WAS CALCULATED USING THE SAME METHODOLOGY.   THE FORM ADV DEFINITIONS REQUIRE THE FUNDS TO BE CLASSIFIED AS HEDGE FUNDS BECAUSE OF THE FUNDS' ABILITY TO INVEST IN DERIVATIVE SECURITIES IN CERTAIN LIMITED CIRCUMSTANCES; HOWEVER, THE REGISTRANT OPERATES THE FUNDS FOR ALL PRACTICAL PURPOSES AS PRIVATE EQUITY FUNDS.  SCHEDULE D, SECTION 7.B.(1)- 23(g) THE FINANCIAL STATEMENTS FOR RIO ENERGY INVESTMENT HOLDINGS LLC (""REIH LLC"") ARE NOT AUDITED, BUT ARE DISTRIBUTED TO INVESTORS ON A QUARTERLY/ANNUAL BASIS.  THE YEAR END (DECEMBER 31) FINANCIAL STATEMENTS FOR REIH LLC ARE NOT REQUIRED TO BE FINALIZED AND DISTRIBUTED TO INVESTORS UNTIL 120 DAYS AFTER YEAR END.  FOR THAT REASON, 9/30/2024 FIGURES ARE BEING REFLECTED FOR REIH LLC IN THIS FILING.  VALUES PROVIDED IN SECTION 5.D., 5.F.(2) AND 9.A.(2)A HAVE BEEN CALCULATED USING 12/31/2024 FIGURES, WITH THE EXCEPTION OF REIH LLC, WHICH USES 9/30/2024 FIGURES (AS DESCRIBED ABOVE).   DENHAM SUSTAINABLE INFRA GP LLC IS A DISREGARDED ENTITY OF STUART PORTER, WHO IS THE SOLE MEMBER, AND THEREFORE DOES NOT HAVE AN EIN.  STUART PORTER'S CRD NUMBER IS 1778869, WHICH CANNOT BE LISTED AS DENHAM SUSTAINABLE INFRA GP LLC'S EIN.  THEREFORE, WE HAVE LISTED THE EIN AS 00-0000000.  Except in the case of Registrant?s Chief Compliance Officer, for purposes of Item 1.F.(5) and corresponding Section 1.F of Schedule D, Registrant has excluded from reporting as office locations the residential addresses of its remote-working advisory personnel. For the avoidance of doubt, none of the foregoing remote-working personnel hold their individual residences out to the public as a place of business of the Registrant, nor maintain at such locations any books or records required to be maintained under federal securities laws, including Rule 204-2 under the Investment Advisers Act of 1940, as amended.  To provide more context, DCPF VI Oil and Gas Coinvestment Fund LP was dissolved 12/31/2024. This amendment is being filed to remove DCPF VI Oil and Gas Coinvestment Fund LP from Form ADV, so that the correct funds are being reflected in Denham's Q1 2025 Form PF."
2008786,"In response to Item 9.A, the Firm reports custody over $111,015,363 of client funds and securities. As of 12/31/23, of this total amount, approximately $9,000,000 represents custody subject to annual surprise CPA examination. The service(s) which result in this form of custody are further described in the Firm's Disclosure Brochure (Form ADV Part 2A).   The remaining amount reflects custody attributable to third-party standing letters of authorization, which are reportable as custody on this ADV Part 1 but are not subject to annual surprise CPA examination, in accordance with the Investment Adviser Association No-Action Letter (dated February 21, 2017)."
2006148,"REGISTRANT'S RESPONSE TO ITEM 9.A.(2) INCLUDES ASSETS IN ACCOUNTS FROM WHICH REGISTRANT HAS THE AUTHORITY TO TRANSFER FUNDS VIA STANDING LETTERS OF AUTHORIZATION (SLOAs). THESE TRANSFER AUTHORIZATIONS MEET THE REQUIREMENTS OF THE SEC'S FEBRUARY 21, 2017 NO-ACTION LETTER ON CUSTODY. THEREFORE, THESE ASSETS ARE NOT SUBJECT TO AN ANNUAL SURPRISE EXAMINATION."
