"FilingID","Miscellaneous"
2004882,"Oaktree?s asset management business is indirectly controlled by Brookfield Oaktree Holdings, LLC (?BOH?) (which changed its name on March 15, 2024, from Oaktree Capital Group, LLC) and Oaktree Capital Holdings, LLC (?OCH?) (which changed its name on March 15, 2024, from Atlas OCM Holdings, LLC).  A majority of Oaktree?s business is owned by Brookfield Corporation and Brookfield Asset Management Ltd. (collectively, ?Brookfield?) and the remainder is owned by current and former Oaktree executives and employees, and certain related individuals and entities.  Brookfield?s ownership interest in Oaktree?s business is held through BOH, OCH and related entities. Brookfield and Oaktree operate their respective investment businesses largely independently, with each operating under its own brand and led by its existing management and investment teams, and Oaktree and Brookfield generally managing their investment operations independently of each other subject to an information barrier between the firms. Oaktree does not consider Brookfield or its affiliates to be its ?advisory affiliates? or ?related persons? for purposes of this Form ADV. For more information regarding Brookfield and its affiliates, please refer to the Form ADV of Brookfield affiliated investment advisers: Brookfield Public Securities Group LLC (CRD# 110497), Brookfield Asset Management Private Institutional Capital Adviser (Credit), LLC (CRD# 170811), Brookfield Asset Management PIC U.S. LLC (CRD# 151599), Brookfield Asset Management PIC BMG, LLC. (CRD# 312797), Brookfield Asset Management Reinsurance Advisor LLC (CRD# 312792) and, Brookfield BHS Advisors LLC (CRD# 309500). Oaktree Capital Group Holdings, L.P. (?OCGH?) holds 100% of the Class B units of OCH which, during the period (the ?Initial Period?, which is more specifically described in the Form 8-K filed October 4, 2019, available through EDGAR) from September 30, 2019 through the date on which Brookfield delivers a written election to end the Initial Period (which election cannot be delivered before September 30, 2026 unless certain events occur before then), entitle OCGH to 10 votes per Class B unit on all matters to be submitted to a vote of the OCH members. In addition, during the Initial Period, the board of directors of OCH is comprised of two individuals selected by OCGH, two selected by Brookfield, and the remaining directors nominated by OCGH and subject to joint written appointment by each of OCGH and Brookfield. As a result, during the Initial Period, OCGH controls OCH and, indirectly, the Registrant, although OCH is prohibited from taking certain actions without the consent of Brookfield. The General Partner of the Limited Partnerships listed in Section 7.B.(1) of Schedule D has the authority to waive the minimum investment requirement. Some of the Limited Partnerships for which the Registrant acts as General Partner or Investment Adviser are closed-end limited partnerships. As such, clients are not solicited to invest in such closed-end limited partnerships after the final closing has occurred. We have excluded from our disclosure limited partnerships and/or limited liability companies organized and operated solely for the benefit of our employees as well as any special purpose vehicles that were formed in relation to a specific investment or private fund. For certain private funds reported in Section 7.B.(1) of schedule D that are denominated in Euro, the Gross Asset Value and minimum investment commitment values have been converted to USD for purposes of reporting. For all private funds reported in Section 7.B.(1), the Gross Asset Value has been rounded to the nearest thousands. For purposes of Item 5: Information About Your Advisory Business ? Regulatory Assets Under Management, Oaktree advises certain funds of funds that invest solely in other private funds advised by Oaktree, as noted in Section 7.B.(1) of Schedule D. for purposes of calculating Regulatory Assets Under Management as reported in Item 5 and reporting of the Gross Asset Value of private funds in Section 7.B.(1) of Schedule D, the limited partner interests held in the other Oaktree private funds by the funds of funds have been excluded from the Gross Asset Values of such funds of funds. As such, the Gross Asset Value of such funds of funds may be reported as zero in Schedule D, Item 7.B.(1), if such funds of funds have no other assets other than the limited partner interests in the other Oaktree private funds. In addition, feeder funds are consolidated with the main fund to which they relate for purposes of financial statement reporting. Therefore, for purposes of reporting Gross Asset Values for feeder funds requiring separate reporting from the main fund in Schedule D, Item 7.B.(1), the Gross Asset Value for the feeder fund is included in Gross Asset Value for the associated main fund and has been reported separately for each such feeder fund. For purposes of calculating the gross asset values in Schedule D, Item 7.B.(1), any uncalled commitment amounts are not included for each relevant private fund. For purposes of reporting beneficial owners, for the feeder funds requiring separate reporting from the main fund in Schedule D, Item 7.B.(1), the number of beneficial owners for the feeder fund is included in the beneficial owner value for the associated main fund and has been reported separately for each such feeder fund. All funds with financial statements subject to an annual audit, listed on Schedule D, Section 7.B.(1), are audited by the same overarching auditing firm; however, in circumstances where the main fund and feeder fund are audited by entities of such auditing firm in separate jurisdictions, the specific entity auditing the feeder is not separately disclosed. The General Partner of certain private funds reported in Section 7.B.(1) may make an investment through an Oaktree or Oaktree affiliate-managed Alternative Investment Vehicle (""AIV""). Each AIV is governed by organizational documents containing provisions substantially similar to those of the fund to which they relate. Investments made through the AIVs are funded by contributions either directly to these entities or contributions to the funds to which they relate that are subsequently transferred to the AIV, such that in both cases investors will directly own a limited partnership interest in the AIV. Financial results for each AIV are reported on a consolidated basis with the fund to which they relate. For certain private funds listed in Schedule D, Section 7.B.(1) that are securitized asset funds, senior noteholders are treated as creditors while the income noteholders (who possess an equity-like claim on fund assets) are treated as beneficial owners of the fund for purposes of Ownership questions 13-16. In addition, for certain securitized asset funds, registrant has responded ?No? to questions 23(G) and (H) due to the fact that such private funds do not obtain unaudited financial statements and thus the questions are not applicable. For certain master funds included in Section 7.B.(1) that are part of master-feeder arrangements, we do not solicit clients to invest at the master fund level and therefore have answered ?No? for Question A.19 of Section 7.B.(1) for those master funds. However, as the marketing materials and private placement memorandums include information regarding the fund complex as a whole (i.e. the master fund in a master-feeder arrangement appears in such documents along with the relevant feeder funds, even though no investors can invest directly in the master fund and may only invest in the fund complex through a feeder fund), we have answered ?Yes? for Question B.28.(a) of Section 7.B.(1) for those master funds. For any other-than-annual amendment where we are adding private fund(s) to Section 7.B.(1) of Schedule D, the data reported is as of the last day of the prior fiscal quarter month end date. All other responses are as of the last day of the prior fiscal year. Please note that Oaktree Gardens OLP SPV, LP included in Section 7.B.(1) is a feeder fund to the Oaktree Gardens OLP, LLC which is a BDC managed by Oaktree Fund Advisors, LLC. This feeder fund has been excluded from Regulatory Assets Under Management as those assets are reported in the Regulatory Assets Under Management for Oaktree Fund Advisors, LLC. Oaktree CLO Management Company, LLC is a relying adviser structured as a limited liability company with multiple series. Identified in Section 4.A.2 of Schedule R are the direct owners of the management series of Oaktree CLO Management Company, LLC. The other series of Oaktree CLO Management Company, LLC hold passive interests that do not confer control over the investment advisory activities of Oaktree CLO Management Company, LLC. Accordingly, the owners of such other series have not been listed as direct owners in Section 4.A.2."
2010666,"The amendment in February 2023 inadvertently removed John Chatmas as the CEO and added Terrell Gates.  The amendment on June 09, 2023 was to correct the error and add John Chatmas as the CEO and remove Terrell Gates."
2010678,"In accordance with the SEC?s ?no action letter? of clarification of the Custody Rule dated February 15, 2017 concerning standing letters of authorization for third-party transfers, the firm has reported the applicable information in ADV Part 1, Item 9. Further, the firm is not subject to a surprise examination due to the adherence of the seven safeguarding circumstances outlined in the ?no action letter?."
2010000,"ITEM 5.L.(1)(b): In Sachem Hill LLC's (""Sachem Hill"") marketing materials, Sachem Hill uses specific investment advice that is intended for sophisticated investors and presented in a manner that is fair and balanced.  ITEM 8.A(2):  Sachem Hill is not obligated to acquire for any account any security that it or its officers, managers, members or employees may acquire for its or their own accounts or for the account of any other client, if in Sachem Hill's absolute discretion, it is not practical or desirable to acquire a position in such security for that account."
2010694,"Most, if not all, of AmeriFlex??s investment advisory representatives (""IARs"") are concurrently registered as ?registered representatives? of SagePoint Financial, Inc. (?SagePoint?), a registered broker-dealer and member of FINRA/SIPC and a registered investment advisory firm (CRD No. 133763) (each a ?Dually Registered Person?). SagePoint is not otherwise affiliated with our firm. Clients can enter into a separate commission-based arrangement with such individuals (but not with AmeriFlex? directly) and SagePoint for securities brokerage services (a ?Brokerage Arrangement?). Investments made through the Brokerage Relationship may be separate from the advisory services we provide to you, and therefore, AmeriFlex? does not have a fiduciary duty over such Brokerage Relationship recommendations.   Under the foregoing arrangement, these Dually Registered Persons, acting in their capacity as registered representatives of SagePoint, may receive commissions, ongoing distribution fees (i.e., trails), and other compensation based on sales of securities to clients. This creates a conflict of interest insofar as such Dually Registered Persons may have a financial incentive to sell securities to clients for which they may collect commissions. Alternatively, they may have an incentive to forego providing you with advisory services when appropriate, and instead recommend the purchase of commissionable investments, if they deem that the payout for recommending the purchase of these investments would be higher than providing management advice on these products for an advisory fee. Clients are advised that fees paid to AmeriFlex? for investment advisory services are separate and distinct from the commissions and/or other forms of compensation that may be earned by any Dually Registered Persons for selling securities products to clients through SagePoint.   The receipt of securities related commissions by an individual associated with the firm presents a conflict of interest. As fiduciaries we must act primarily for the benefit of our investment advisory clients. As such, we will only transact securities related business with clients when fully disclosed, suitable, and appropriate.  Further, we must determine in good faith that any commissions paid to our representatives and affiliates are appropriate. Clients are informed that they are under no obligation to use any individual associated with our firm for the purchase of securities products or services. Clients may use any broker-dealer they choose for purchase of these products and services. We encourage you to ask us about the conflicts of interest presented by the dual registration of our IARs.  Certain of our Advisory Affiliates are licensed insurance agencies and/or some of our IARs are independently licensed on an individual basis to sell insurance in one or more states acting as direct agent representatives of a specific insurance company or companies. Insurance related business is transacted with advisory clients and licensed individuals may receive commissions from insurance products sold to clients. Clients are advised that the fees paid to AmeriFlex? for investment advisory services are separate and distinct from the commissions earned by any individual (or insurance agency) for selling insurance products to clients. If requested by a client, we will disclose the amount of commissions expected to be paid.   The receipt of insurance related commissions by any individual or Advisory Affiliate associated with AmeriFlex? presents a conflict of interest. As fiduciaries we must act primarily for the benefit of our investment advisory clients. As such, we will only transact insurance related business with clients when fully disclosed, suitable, and appropriate.  Further, we must determine in good faith that any commissions paid to our representatives and affiliates are appropriate. Clients are informed that they are under no obligation to use any individual associated with our firm for the purchase of insurance products or services. Clients may use any insurance firm or agent they choose for purchase of these products and services. We encourage you to ask us about the conflicts of interest presented by the insurance licensure of our Advisory Affiliates and IARs."
2004810,"THE RELATED PERSONS LISTED IN SECTION 7.A. OF SCHEDULE D ARE SPECIAL PURPOSE VEHICLES FORMED TO ACT AS GENERAL PARTNERS OR MANAGING MEMBERS OF CERTAIN OF THE REGISTRANT'S PRIVATE FUNDS AND ARE RELATED PERSONS OF THE REGISTRANT, AS WELL AS CERTAIN ENTITIES THAT ARE PART OF THE T. ROWE PRICE GROUP THAT WERE NOT RELATED PERSONS OF THE REGISTRANT PRIOR TO THE ACQUISITION BY T. ROWE PRICE GROUP OF THE REGISTRANT. IN RELIANCE ON THE POSITION EXPRESSED IN THE SECURITIES AND EXCHANGE COMMISION (""SEC"") STAFF'S NO ACTION LETTER TO THE AMERICAN BAR ASSOCIATION DATED JANUARY 18, 2012 (THE ""2012 NAL""), SUCH RELATED PERSONS WILL BE COVERED BY THE REGISTRANT'S REGISTRATION AND DEEMED TO BE REGISTERED BY THE SEC. WITH RESPECT TO THE MINIMUM INVESTMENT COMMITMENT AMOUNTS DISCLOSED IN SECTION 7.B. OF SCHEDULE D, THE GENERAL PARTNER OR THE PRIVATE FUNDS' DIRECTORS, IN ITS OR THEIR DISCRETION, MAY ACCEPT INVESTMENT AMOUNTS THAT ARE LESS THAN THE STATED MINIMUM, AS LEGALLY PERMITTED. OAK HILL ADVISORS (EUROPE), LLP AND OHA (UK) LLP ARE SUB-ADVISORS TO OAK HILL ADVISORS, L.P. WITH RESPECT TO VARIOUS CLIENTS ADVISED BY THE REGISTRANT, AND VICE VERSA. OAK HILL ADVISORS (AUSTRALIA) PTY LTD IS A SUB-ADVISOR TO THE REGISTRANT, OAK HILL ADVISORS (EUROPE), LLP AND OHA (UK) LLP. REGISTRANT IS COLLATERAL MANAGER TO CERTAIN COLLATERALIZED LOAN OBLIGATIONS. BENEFICIAL INTERESTS IN SECURITIES ISSUED BY SUCH CLO FUNDS ARE TRADED THROUGH DEPOSITORY INSTITUTIONS. ITEMS 13,15,16 OF SECTION 7.B.(1) OF SCHEDULE D HAVE BEEN COMPLETED AS OF THE CLOSING OF SUCH FUNDS.  AS IT RELATES TO SCHEDULE R, SECTION 4 (DIRECT OWNERS AND EXECUTIVE OFFICERS), NEITHER ALEXIS ATTESLIS NOR MUSA SONMEZ HAVE MIDDLE NAMES."
2005610,"With respect to both funds, the Adviser has answered ""Report Not Yet Received"" in Section 7.B.(1)B.23.(h) of Schedule D because this is the Adviser's initial filing, and the Adviser will not file an annual updating amendment until 2026, so the Adviser will not have a report with respect to which it can answer this question appropriately until 2026."
2008561,"Certain investors in Coatue Growth Fund V LP and Coatue Growth V Offshore Feeder Fund LP (collectively, ?Growth V?) have opted to fund their respective capital calls to Growth V by providing authorization for such capital contributions to be withdrawn from their investment in the hedge funds managed by Coatue Management.  For purposes of reporting the gross assets of Growth V, the full amount of any such investor?s capital commitment has been included even though a portion of that capital commitment will remain in the applicable hedge fund until it is called by Growth V.  Additionally, for purposes of reporting the gross assets of the applicable hedge fund, any such amount that has not been called by Growth V has been included in the applicable hedge fund?s assets.  As of December 31, 2024, a total of $16,208,361 of capital in Coatue Offshore Fund Ltd. and Coatue Qualified Partners, L.P. is committed to Growth V via the hybrid option and subject to capital calls.  In connection with the information included in Schedule D, Item 7.B.1. subpart 23(a) for CK Liquidating Vehicle LP, this entity did not have any assets during the entirety of calendar year 2024 and accordingly was not audited with respect to that year. Coatue Management has responded ?no? for Item 8.A.1. due to the fact that it does not engage in principal transactions in the ordinary course of its business, however, from time to time (particularly in connection with the funding of certain investments in private companies due to the expedited timing of funding such transactions), Coatue Management has previously in limited circumstances and expects in the future that it may enter into a principal transaction with a Client.  Certain funds advised by Coatue Management have registered in various foreign jurisdictions solely for the purpose of marketing such funds in the relevant jurisdiction. Section 7B. of Schedule D, question 27: The administrator confirms the value of the stated percentage of the assets based on the valuation policy established by Coatue Management.  For each control person listed in Schedule A, we have included that person?s most representative title and the date the title was assumed. Certain control persons may have other titles and previously may have been control persons with other titles."
2008385,"TritonPoint Capital, LLC respectfully requests approval for July 1, 2025."
2006328,"For Schedule A, Reena Kuyper does not have a middle name or a middle initial."
2005350,"ITEM 5.L.(1)(d), ITEM 8.H., AND ITEM 8.I.: FROM TIME TO TIME, THE ADVISER MAY COMPENSATE ONE OR MORE PLACEMENT AGENTS FOR REFERRALS OF INVESTORS IN ITS PRIVATE FUND CLIENTS."
2008642,"ITEM 5A, 5B: THE ADVISER DISCLOSES 9 EMPLOYEES BECAUSE IT HAS 9 PRINCIPALS/PARTNERS. HOWEVER, THE ADVISER DOES NOT HAVE ANY FULL-TIME EMPLOYEES, THOUGH MANY EMPLOYEES OF AVM, L.P. (""AVM"") PROVIDE SERVICES TO THE ADVISER. AVM HAS APPROXIMATELY 100 EMPLOYEES. AVM RECEIVES COMPENSATION FROM THE ADVISER FOR THE SERVICES PROVIDED BY AVM. ITEM 5L.(1)(b) IS ANSWERED ""YES"" BECAUSE THE ADVISER PROVIDES SPECIFIC INVESTMENT ADVICE IN ITS ADVERTISEMENTS BUT DOES SO IN COMPLIANCE WITH THE REQUIREMENTS OF THE RULE, MEANING THAT IT IS FAIR AND BALANCED. THE ADVISER ANSWERED ""YES"" TO ITEM 5.L.(1)(d) SOLELY BECAUSE THE ADVISER SOMETIMES UTILIZES THIRD PARTY SELLING AGENTS, WHO ARE COMPENSATED FOR INTRODUCING INVESTORS. THE ADVERTISEMENTS THAT THE ADVISER DISTRIBUTES DO NOT CONTAIN ENDORSEMENTS. ITEM 8: POTENTIAL CONFLICTS WITH CUSTOMERS OF AVM, L.P. (""AVM""): AVM?S CUSTOMERS MAY ENGAGE IN TRADES INVOLVING INVESTMENTS THAT ARE THE SAME AS OR SIMILAR TO THOSE ENGAGED IN BY III CLIENTS. THE ADVISER ALWAYS ENDEAVORS TO GIVE CLIENTS PREFERENCE, AND ONLY CERTAIN TRADES THAT HAVE BEEN APPROVED BY III?S PRINCIPALS MAY BE SHARED WITH AVM?S CUSTOMERS. HOWEVER, IF THE TRADING ACTIVITIES OR POSITIONS OF AVM?S CUSTOMERS WERE TO COMPETE WITH OR OTHERWISE RESTRICT THEIR TRADING ACTIVITIES OR POSITIONS, EXCEPT AS DESCRIBED BELOW, A POTENTIAL CONFLICT OF INTEREST EXISTS REGARDING SUCH TRADES BY AVM?S CUSTOMERS. IN DEVELOPING STRATEGIES FOR ITS CLIENTS, THE ADVISER MAY RELY ON IDEAS GENERATED BY CUSTOMERS OF AVM, L.P. THAT ARE MADE AVAILABLE TO THE ADVISER'S CLIENTS. IN SITUATIONS WHERE IT IS IMPOSSIBLE TO FILL ALLORDERS FOR ALL CUSTOMERS, IT IS AVM'S POLICY TO FAVOR THE CUSTOMER THAT INITIATED A PARTICULAR TRANSACTION."
2008435,"The amount reflected in Item 9.A(2) is provided in connection with client standing letters of authorization directing funds to third parties from their custodial accounts. The Adviser does not have direct custody of these funds or securities."
2008400,"ITEM 9A IS COMPLETED TO INDICATE THIRD-PARTY STANDING LETTERS OF AUTHORIZATION ONLY."
1992872,"We have affirmatively responded to Item 5.L (d) indicating we utilized endorsements; however, this pertains solely to the use of independent third-party introducers to identify and recommend third-party investment advisers to our ETF platform. Since these introducers do not seek retail or separately managed clients, we indicated zero to Item 5.B (6)."
2007416,"In accordance with the SEC no-action letter with respect to Rule 206(4)-2 under the Investment Advisers Act of 1940, our firm has disclosed the number of clients with Standing Letters of Authorization (""SLOA"") directed to third parties and the value of assets in those client accounts in Item 9."
2006910,"5.D.(f) & 5.F.(2) - Difference in figures are due to change in internal calculation methodology.   7.A - Gordian Capital Hong Kong (""GCHK"") is regulated by the Hong Kong Securities and Futures Commission and does not have clients nor has it commenced regulated activity. If applicable, GCHK will seek the relevant SEC registration/exemption once it commences regulated activity.  9 - Amending this section accordingly as Gordian Capital Singapore has received legal advice that it is not subject to the custody rule as it does not have a place of business in the US.  Aug 2025 update - Effective as of 30 July 2025, Gordian Capital Singapore Pte Ltd was acquired by IQEQ. The registrant remains the same legal entity, and there have been no changes to its advisory operations, client relationships, or registration status as a result of the acquisition."
2007432,"PYRFORD IS A SUBADVISER TO SOUTH LASALLE INTERNATIONAL EQUITIES TRUST AND THE  INTERNATIONAL STOCK FUND LLC. BOTH FUNDS ARE MANAGED BY COLUMBIA MANAGEMENT INVESTMENT ADVISERS, LLC  THE FOLLOWING EXECUTIVES DO NOT HAVE MIDDLE NAMES; DAVID LOGAN WILLIAM DAVIES STEWART BENNETT SCOTT CAVANAGH"
2006962,"Schedule D, Section 5.K.(1).(b).  Information provided is as of 02.05.20 as 12.31.20 numbers are not available to the adviser."
2008822,"(1) Our firm is also licensed as a Managing General Agent in the area of life and disability insurance. A managing general agent (MGA) or a managing general underwriter (MGU) is a specialized type of insurance agent that has been granted underwriting authority by an insurer, according to the International Risk Management Institute (IRMI), and can administer programs and negotiate contracts for an insurer. An MGA?s functions can include binding coverage, underwriting and pricing, settling claims, and appointing retail agents in a certain region, all of which are typically carried out by insurers.  (2) Blackwood Partners is not a real estate broker or real estate dealer.  Blackwood Partners provides advisory services to institutional clients looking to purchase hard asset real estate in their own name and provides ongoing asset and property management services in connection with such purchased real estate.   (3) Schedule A: Vanessa Flockton does not have a legal middle name."
2006029,"(1) MACERATIO LLC IS OWNED BY MACERATIO HOLDINGS LLC, WHICH OWNERS ARE NICHOLAS SALAS AND MARCUS AYRES. BOTH NICHOLAS SALAS AND MARCUS AIRES ARE INVESTMENT ADVISORS AT MACERATIO LLC. (2) LS ADVISORS IS A DBA REGISTERED IN FLORIDA BY THE FIRM (FICTICIOUS NAME APPROVED IN SUNBIZ), CONDUCTING BUSINESS FOR MOSTLY HNW LATAM CLIENTELE."
