"FilingID","Miscellaneous"
2010026,"PLEASE NOTE THAT ANSWERS TO SECTIONS 5A,B (1-6), 5C (1) AND (2), 5D (1), (2) AND (3), 5F (2) AND (3), 5K (1) AND 5K (3), 9A (2) AND 9B (2) ARE BASED UPON VALUES AT 31ST DECEMBER 2024. ALL OF THE ANSWERS TO THESE SECTIONS WERE INITIALLY CALCULATED IN GBP, AND HAVE BEEN CONVERTED TO USD USING AN EXCHANGE RATE OF 1.2524. 1. BUSINESS SERVICES PROVIDED BY THE OTHER OPERATING (I.E. NON DORMANT ) SUBSIDIARIES OF RATHBONES GROUP PLC ASIDE FROM RATHBONES INVESTMENT MANAGEMENT LTD AND ITS WHOLLY OWNED SUBSIDIARIES THE PRINCIPAL SUBSIDIARY UNDERTAKINGS OF RATHBONES GROUP PLC, ALL OF WHICH WERE WHOLLY OWNED, AS AT 31ST DECEMBER 2024 WERE AS FOLLOWS: A. RATHBONES TRUST COMPANY LTD, GREAT BRITAIN, TRUST SERVICES AUTHORISED AND REGULATED BY THE SOLICITORS REGULATION AUTHORITY B. RATHBONES ASSET MANAGEMENT LTD, GREAT BRITAIN, UNIT TRUST MANAGEMENT, AUTHORISED AND REGULATED BY THE FCA. C. CASTLE INVESTMENT SOLUTIONS LTD AND VISION INDEPENDENT PLANNING LTD ARE WHOLLY OWNED SUBSIDIARIES OF RATHBONES GROUP PLC. 2. ONLY INVESTEC WEALTH & INVESTEC LIMITED CONDUCT AGENCY CROSS TRANSACTIONS FOR ADVISORY CLIENTS ON AN AD HOC BASIS, DISCLOSED UNDER ITEM 8B.(1).	 3. RATHBONES INVESTMENT MANAGEMENT LTD HOLDS ALL ITS CLIENTS? SECURITY HOLDINGS WITH EITHER AN INDEPENDENT QUALIFIED CUSTODIAN OR IN RATHBONE NOMINEES LTD, A NOMINEE COMPANY THAT IS A WHOLLY OWNED SUBSIDIARY OF RATHBONES INVESTMENT MANAGEMENT LTD. 4. THE COMMISSIONS REPORTED UNDER ITEM 5.E OF THIS REPORT ARE NOT CHARGED AGAINST OUR US CLIENTS. 5. RATHBONES INVESTMENT MANAGEMENT INTERNATIONAL (IRELAND) LTD (RIMI ? IRELAND) IS 100% OWNED BY RATHBONES INVESTMENT MANAGEMENT (RIM)  AND IS A RELATED PERSON OF RIM. HOWEVER, RIMI ? IRELAND HAS NOT RECEIVED REGULATORY APPROVAL BY THE CENTRAL BANK OF IRELAND, AND NO ACTIVITIES ARE BEING CONDUCTED IN THE FIRM AND THERE ARE NO CONFLICTS OF INTEREST. RIM WILL PROVIDE AN UPDATE TO SECTION 7.A ONCE RIMI-IRELAND RECEIVES REGULATORY APPROVAL."
2012542,"There are no indirect owners that own more than 25% of Peak Reps LLC.  Peak Reps LLC as a holding company is 100% owner of Blackridge Asset Management LLC."
2002662,"The firm currently has one client in the wrap program. All other clients were transitioned out of the wrap program in April 2025.  The Firm uses Pontera, Inc. to facilitate the management of certain client held-away retirement accounts. In connection with this arrangement, a portion of the advisory fee charged to clients is retained by Pontera as compensation for its services. Clients do not incur any additional cost as a result of this arrangement; however, because Pontera receives a share of advisory fees, this creates a potential conflict of interest. The Firm addresses this conflict by disclosing it to clients and ensuring that the same advisory fee is charged regardless of whether Pontera is used."
2012463,"Please note that in calculating Regulatory Assets Under Management (?RAUM?), Private Wealth Management (?PWM?) uses market value of the account, which in circumstances where there is negative fair value on derivatives/liabilities in the account, will result in a net market value. Asset Management Private relies on financial statements to determine the treatment of negative fair value on derivatives/liabilities for purposes of calculating RAUM.  In those cases where the relevant financial statements reflect liabilities, the liabilities are neither included nor deducted from the calculation of RAUM.  With respect to Items 5.F., 5.I.(2)(a) and 5.K., we have excluded certain third party separate accounts and separate accounts managed by Goldman Sachs Asset Management, L.P. (?GSAM LP?), an affiliated investment adviser, for which we act as sponsor in a wrap fee program.  Such assets are included in GSAM LP?s regulatory assets under management as reflected in its Form ADV Part 1A and we have included these assets in PWM?s Form ADV Part 2A Brochure in response to Item 4.E.  With respect to Section 5.K.(1)(a) of Schedule D, please note that percentages listed for each of the Mid-year and End of Year responses may not total 100% due to rounding. FOR PURPOSES OF ITEM 5F, ASSETS ARE PRESENTED AS OF 12/31/2022. ADDITIONAL COMMITMENTS ARE PENDING AT THE TIME OF FILING AND HAVE NOT BEEN INCLUDED IN THE TOTAL REGULATORY ASSETS UNDER MANAGEMENT REPORTED IN PART 1A, 5.F.  PLEASE NOTE THAT METHODOLOGY FOR AGGREGATING ASSETS FOR THE FORM ADV MAY BE DIFFERENT FROM THE METHODOLOGY USED IN OTHER EXTERNAL REPORTING, DUE TO DIFFERENCES IN THE APPLICABLE REQUIREMENTS FOR SUCH REPORTS.  There may be certain questions for which we have changed our calculation methodology as compared to the methodology used in prior years.  As a result, the responses to certain questions may deviate from responses in prior years, even if the underlying data with respect to the private fund has not materially changed.   INFORMATION ABOUT INVESTMENT-RELATED LIMITED PARTNERSHIPS (LPS) AND LIMITED LIABILITY COMPANIES (LLCS) FOR WHICH REGISTRANT'S RELATED PERSONS SERVE AS GENERAL PARTNER OR MANAGER IS AVAILABLE ON THE FORM ADV, SCHEDULE D, SECTION 7.B. OF EITHER (I) GOLDMAN SACHS HEDGE FUND STRATEGIES LLC (SEC REGISTRATION NUMBER 801-55755), (II) GOLDMAN SACHS ASSET MANAGEMENT, L.P. (SEC REGISTRATION NUMBER 801-37591), (III) GOLDMAN SACHS ASSET MANAGEMENT INTERNATIONAL (SEC REGISTRATION NUMBER 801-38157), (IV) GSAM STABLE VALUE, LLC (SEC REGISTRATION NUMBER 801-453-4), (V) GS INVESTMENT STRATEGIES LLC (SEC REGISTRATION NUMBER 801-67443), (VI) APTITUDE INVESTMENT MANAGEMENT LP (SEC REGISTRATION NUMBER  801-74419) OR (VII) ROCATON INVESTMENT ADVISORS, LLC (SEC REGISTRATION NUMBER  801-61144). REGISTRANT'S ADVISORY CLIENTS MAY BE SOLICITED TO INVEST IN SOME OF THESE LPS AND LLCS."
2012605,"ITEM 6.B.(3) ? T. ROWE PRICE (CANADA), INC. (?TRPC?) IS REGISTERED IN CANADA AS AN INVESTMENT FUND MANAGER, PORTFOLIO MANAGER AND EXEMPT MARKET DEALER AND ACTS AS DISTRIBUTOR OF THE T. ROWE PRICE CANADIAN PENSION POOLED FUNDS, SEGREGATED UNIT TRUSTS FORMED UNDER AN UMBRELLA TRUST IN ONTARIO.     ITEM 7.A. - IN ADDITION TO THE FINANCIAL AFFILIATIONS SELECTED, WE HAVE OTHER RELATED PERSONS THAT ARE NOT IDENTIFIED IN ITEMS 7.A.(1) THROUGH (16).     ITEM 8.I. - TRPC OR AN AFFILIATE MAY RECEIVE COMPENSATION FOR AFFILIATE CLIENT REFERRALS THAT RESULT IN A FORMAL CONTRACTUAL ARRANGEMENT BETWEEN THE AFFILIATE AND THE PROSPECT.     ITEM 11. - FROM TIME TO TIME IN THE NORMAL COURSE OF BUSINESS, TRPC, ITS PARENT, SUBSIDIARIES, AFFILIATES, OFFICERS, AND EMPLOYEES (COLLECTIVELY THE ""COMPANY"") ARE NAMED AS PARTIES TO LITIGATION INVOLVING THE PRODUCTS AND SERVICES OFFERED BY THE COMPANY INCLUDING THE T. ROWE PRICE MUTUAL FUNDS. ADDITIONALLY, THE COMPANY MAY BE NAMED AS A STAKEHOLDER OF ASSETS, WHICH ARE THE SUBJECT OF OWNERSHIP DISPUTES BETWEEN SHAREHOLDERS AND/OR THIRD PARTIES."
2009917,"In accordance with the SEC?s ?no action letter? of clarification of the Custody Rule dated February 15, 2017, concerning standing letters of authorization for third-party transfers, the firm has reported the applicable information in ADV Part 1, Item 9. Further, the firm is not subject to a surprise examination due to the adherence of the seven safeguarding circumstances outlined in the ?no action letter?."
2012631,"In accordance with the SEC?s ?no action letter? of clarification of the Custody Rule dated February 15, 2017, concerning standing letters of authorization for third-party transfers, the firm has reported the applicable information in ADV Part 1, Item 9. Further, the firm is not subject to a surprise examination due to the adherence of the seven safeguarding circumstances outlined in the ?no action letter?."
2012653,"The Firm?s surprise accounting examination requirement is triggered when the firm provides bill-pay services, which is currently utilized only by a small number of clients and covers a limited amount of assets. The majority of assets where the Firm notes it has custody in Item 9.A are a result of standing letters of authorization tied to client funds held at the Firm?s custodian; a surprise examination is not required related to these assets when a firm complies with the SEC no-action letter to the Investment Adviser Association (February 21, 2017)."
2005385,"Responses to Schedule D Section 7.B.(1) contain placeholder information, as information pertaining to Section 7.B.(2) 1.-3 is omitted and is the subject of a request for confidential treatment pending with the Securities and Exchange Commission."
2012699,"ITEM 6.B(1) AS A BROKER/DEALER, RFL IS ALSO INVOLVED IN INVESTMENT BANKING, Research AND MARKET MAKING.  ...ITEM 8.A(1) RFL ENGAGES IN MARKET MAKING AND RISKLESS PRINCIPAL TRADES.   ...ITEM 8.B(3) RFL, AS A BROKER/DEALER IS ENGAGED IN THE INVESTMENT BANKING BUSINESS.  ADVISORY AND BROKERAGE CLIENTS ARE LIMITED FROM PURCHASING THE STOCKS OF COMPANIES WHILE RFL HAS CURRENT INVESTMENT BANKING ACTIVITY WITH THE COMPANY, AS THESE STOCKS WILL BE PLACED ON THE RESTRICTED LIST AND NO RECOMMENDATIONS OF THESE SECURITIES MAY BE MADE.  CLIENTS MAY PURCHASE THESE SECURITIES ON AN UNSOLICITED BASIS DURING THE INVESTMENT BANKING PERIOD.  THE STOCKS OF THESE COMPANIES MAY BE RECOMMENDED TO ADVISORY AND BROKERAGE CLIENTS AFTER THE INVESTMENT BANKING ACTIVITY HAS CEASED. THE INVESTMENT ADVISORY CLIENTS MAY PURCHASE NEW ISSUE SECURITIES, BUT THE FIRM WILL NOT TAKE COMPENSATION (SELLING CONCESSION) ON THE TRANSACTION, NONE-THE-LESS, CLIENTS MAY INVEST MONEY INTO AN INVESTMENT BANKING COMPANY DURING THE COURSE OF A FINANCING DEAL IN A SEPARATE RFL BROKERAGE ACCOUNT.  THIS TRANSACTION WOULD NOT BE DEEMED AN ADVISORY SERVICE AND HENCE, WOULD NOT TAKE PLACE WITHIN THE ADVISORY ACCOUNT.  ...PART 1B ITEM 2.I THE CUSTODIAN CALCULATES AND DEDUCTS THE ADVISORY FEE, RFL DOES NOT, AND THUS DOES NOT HAVE CUSTODY.  THIS IS DISCLOSED IN ADV PART II."
2010081,"SECTION 1L Certain books and records are kept at the parent company's headquarters in San Mateo, California.  SECTION 5.K. (3) Custodians for Separately Managed Accounts  Martin Currie does not have custody of clients? funds. All Martin Currie client investments must be held by an independent custodian (which is appointed by the Client) and registered in either the custodian nominee name on behalf of the client or in the client?s own name unless there is a regulatory requirement that imposes another requirement.  SCHEDULE D - SECTION 7.B   MARTIN CURRIE INVESTMENT MANAGEMENT?S CLIENTS ARE SOLICITED TO INVEST IN THE LIMITED PARTNERSHIPS AND LIMITED LIABILITY COMPANIES.  THE SOLICITING IS NOT CARRIED OUT BY MARTIN CURRIE INVESTMENT MANAGEMENT, BUT BY AN AFFILIATE THAT IS A REGISTERED BROKER DEALER (FRANKLIN TEMPLETON DISTRIBUTORS, LLC)."
2010470,"In accordance with the SEC no-action letter with respect to Rule 206(4)-2 under the Investment Advisers Act of 1940, our firm has disclosed the number of clients with Standing Letters of Authorization (""SLOA"") directed to third parties and the value of assets in those client accounts in Item 9. Further, our firm is not subject to the surprise independent examination requirement as we have adopted safeguards disclosed in Item 15 of our Firm Brochure in accordance with the no-action letter."
2010441,"At the time of filing this FORM ADV, Mesarete Capital LLP does not have retail clients, nor will it have retail clients in the future. Form CRS is not applicable.  Mesarete Capital (US) LLC (""Mesarete US"") is based in the United States and is a wholly owned subsidiary of Mesarete Capital LLP. It has been set up to employ US persons who provide credit research services and limited marketing support to Mesarete Capital LLP. Personnel employed by Mesarete US do not exercise investment discretion, do not have any trading responsibilities, and are not permitted to conduct any dealmaking. Mesarete US does not manage regulatory assets or have any clients."
2007826,"In accordance with the SEC?s ?no action letter? of clarification of the Custody Rule dated February 15, 2017, concerning standing letters of authorization for third-party transfers, the firm has reported the applicable information in ADV Part 1, Item 9. Further, the firm is not subject to a surprise examination due to the adherence of the seven safeguarding circumstances outlined in the ?no action letter?.  With regard to Item 5.E.(6), our firm only charges performance based fees to Cypress Viuex Investors, LLC and Granite Harbor - West Allis Investors, LP. Performance based fees are not charged to our advisory clients.  Ownership change in August 2025 was two equal partners buying out remaining shares of other founding partner. No change in practical control."
2010596,"In accordance with the SEC?s ?no action letter? of clarification of the Custody Rule dated February 15, 2017 concerning standing letters of authorization for third-party transfers, the firm has reported the applicable information in ADV Part 1, Item 9.A. Further, the firm is not subject to a surprise examination due to the adherence of the seven safeguarding circumstances outlined in the ?no action letter?.  In addition, the firm has custody due to acting as a trustee for non-family member client(s). The applicable information is reported in ADV Part 1, Item 9.B."
2010228,"ITEM 1.I. - AHIM IS AWARE THAT THE ADDRESS TO ITS SOCIAL MEDIA SITE FOR LINKEDIN PROVIDED UNDER ITEM 1.I. REQUIRES CASE SENSITIVE INPUT TO REACH THE CORRECT WEBSITE. AHIM WILL PROVIDE THE CASE SENSITIVE ADDRESS TO THIS SOCIAL MEDIA SITE UPON REQUEST. IN RESPONSE TO SECTION 7.B.(1) PRIVATE FUND REPORTING - ""OWNERSHIP"" QUESTIONS 13 AND 16 FOR THE 3 CDO?S AS CLIENTS, AQUARIAN CREDIT PARTNERS LLC DOES NOT HAVE ACCESS TO CURRENT INVESTOR IDENTITIES AND INFORMATION. AQUARIAN CREDIT PARTNERS LLC HAS REPORTED IN QUESTION 13 THE NUMBER OF REGISTERED NOMINEE NAMES KNOWN IN EACH OF THE CDO'S AND THE PERCENTAGE OF REGULATION S HOLDERS IN EACH CDO IN REGARDS TO QUESTION 16.   AHIM AND ITS RELYING ADVISERS, AQUARIAN PRIVATE CREDIT LLC, AQUARIAN CREDIT PARTNERS LLC, AQUARIAN LIQUID CREDIT PARTNERS LLC, AND AQUARIAN REAL ESTATE PARTNERS LLC, AS LISTED IN SCHEDULE R, ARE TOGETHER FILING A SINGLE FORM ADV IN RELIANCE ON THE POSITION EXPRESSED IN THE AMERICAN BAR ASSOCIATION NO-ACTION LETTER (PUBLICLY AVAILABLE JANUARY 18, 2012)."
1980028,"Registrant has Related Persons that have been omitted from Section 7A of Schedule D because it (1) has no business dealings with the Related Person in connection with Advisory Services it provides to its Clients; (2) does not conduct shared operations with the Related Person; (3)does not refer clients or business to the Related Person, and the Related Person does not refer prospective clients or business to it; (4) does not share supervised persons or premises with the Related Person; and (5) has no reason to believe that its relationship with the Related Person otherwise creates a conflict of interest with its clients. 7(B) the Registrant has Related Persons that are Limited Liability Companies (LLC's) and Limited Partnerships (LP's). These LP's and LLC's are either managed by a Registered Investment Adviser or are themselves a Registered Investment Adviser. The Registrant transacts no business with these Related Persons. Schedule A: The names of the executive officers listed in this schedule reflect each individual's full legal name. Approximate number of beneficial owners reported in response to Question 13 of Item 7.B reflects the initial investors in a CLO."
2008078,"In reference to Item 5.L(1)(e), Empirical does not pay to participate in third-party rankings, but does pay a licensing fee for the use of certain rankings.  In reference to Item 7.A   Empirical Insurance and Empirical Properties provides various products and services to Empirical clients.   In reference to Item 9(A), please note that we have custody of certain clients' assets based on standing letters of authorization from clients to transfer funds to third-parties as instructed by clients. We are relying on the SEC's No-Action Letter of February 21, 2017 (Investment Adviser Association, ""Investment Advisers Act of 1940 ? Section 206(4) and Rule 206(4)-2""), whereby the Division of Investment Management would not recommend enforcement action to the Commission under Section 206(4) of, and Rule 206(4)-2 under, the Advisers Act against an investment adviser if that adviser does not obtain a surprise examination where it acts pursuant to such an arrangement under the circumstances enumerated in the No-Action Letter."
2008086,"Item 5.C(2) -  Seven clients meet definition of non-US person.  The firm maintains a list of related persons who are not listed in Section 7.A because (1) the firm has no business dealings with the related person in connection with the advisory services it provides to clients; (2) it does not conduct shared operations with the related person; (3) it does not refer clients or business to the related person, and the related person does not refer prospective clients or business to the firm; (4) the firm does not share supervised persons or premises with the related person; and (5) the firm has no reason to believe that its relationship with the related person otherwise creates a conflict of interest with its clients."
2007791,"Item 9: In response to the no-action letter issues by the SEC on February 21, 2017, the Advisor is reporting in Item 9 the clients and assets that are subject to standing letters of authorization for money movement to third parties. These accounts meet the seven conditions of the no-action letter and therefore are not subject to the ""independent verification"" requirement for custody.  On September 5, 2023, Charles Schwab & Co. (""Schwab"") formally transferred assets from TD Ameritrade Clearing, Inc. (""TD""), officially establishing Schwab as the custodian for these assets. Please note, the assets mentioned in Section 5.K.(3) are reported as of the Annual Amendment or the most recently reported AUM date, as disclosed in Item 4.E of the Form ADV 2A, which represents the period when these assets were still held at TD. Further, Section 5.K.(3) will be updated to formally recognize Schwab as the custodian for these assets in the upcoming 2024 Annual Amendment filing."
2001981,"The Florida Office of Financial Regulation considers advisors who deduct fees directly from client accounts to have custody of the assets of those clients and require Section 9, Custody, to be answered affirmatively for this reason. Tripletail Wealth Management, LLC does not otherwise have physical custody of any client assets, and follows the safeguards prescribed by Florida to protect client assets including notifying the state that fees are directly deducted from accounts, obtaining written authorization from the client to deduct the fees, ensuring that clients receive statements at least quarterly from the qualified custodian where the assets are held showing all transactions in the account, and providing clients with a calculation of the fee each time fees are deducted from the account."
2008100,"The Florida Office of Financial Regulation considers advisors who deduct fees directly from client accounts to have custody of the assets of those clients and require Section 9, Custody, to be answered affirmatively for this reason. Tripletail Wealth Management, LLC does not otherwise have physical custody of any client assets, and follows the safeguards prescribed by Florida to protect client assets including notifying the state that fees are directly deducted from accounts, obtaining written authorization from the client to deduct the fees, ensuring that clients receive statements at least quarterly from the qualified custodian where the assets are held showing all transactions in the account, and providing clients with a calculation of the fee each time fees are deducted from the account."
2008104,"Under Schedule A CHIEF FINANCIAL OFFICER Martin Small has no middle name."
2008106,"PricewaterhouseCoopers LLP (?PwC?) completed an independence assessment to evaluate the services and relationships with BlackRock Alternatives Management, LLC (the ?Adviser?) and the funds listed in Appendix A hereto (the ?BlackRock Relevant funds?) that may bear on PwC?s independence under the SEC independence rules.  PwC informed the Adviser that a member firm of PricewaterhouseCoopers International Limited performed a non-audit service for a portfolio company that the BlackRock Relevant funds acquired a controlling interest in Environmental 360 Solutions Inc. (?E360?). From February 16, 2023, the date the Blackrock Relevant Funds acquired E360, through March 17, 2023, such member firm was engaged to act as the sole arbitrator during a proceeding between E360 and an unrelated third-party defendant, which is inconsistent with the auditor independence rules pursuant to Rule 2-01(c)(4)(x) of Regulation S-X. The total fee associated with the service was approximately $40,000, all of which was incurred prior to the acquisition.  PwC communicated the facts and circumstances surrounding this service to the Adviser, including the scope and duration of this service and the associated fees incurred by PwC. PwC also noted the identified service did not have any direct accounting impact on the financial results of the BlackRock Relevant funds. The Adviser and PwC have separately considered the impact that the service may have had on PwC?s objectivity and impartiality with respect to PwC?s audit of the BlackRock Relevant funds. After careful consideration of the facts and circumstances and the applicable independence rules, PwC concluded that (i) PwC is capable of exercising objective and impartial judgment in connection with their audits of the BlackRock Relevant funds? financial statements as of and for the year ending December 31, 2023, and (ii) a reasonable investor, knowing all the relevant facts and circumstances, would reach the same conclusion. After considering these matters, and based on the totality of the information provided, the Adviser concurred with PwC?s conclusion.  Appendix A BlackRock Global Infrastructure Fund IV A, L.P. BlackRock Global Infrastructure Fund IV B, SCSp BlackRock Global Infrastructure Fund IV C, SCSp BlackRock Global Infrastructure Fund IV D, L.P. BlackRock Global Infrastructure Fund IV, SCSp"
1999859,"BentallGreenOak (U.S.) Limited Partnership is part of a large global financial services enterprise of companies controlled by Sun Life Financial, some of which invest, trade in or underwrite securities.   Sun Life Financials' registered investment adviser is SUN LIFE CAPITAL MANAGEMENT (U.S.) LLC (""Adviser"")  Regarding Item 8, Participation or Interest in Client Transactions -  Most of the SUN LIFE CAPITAL MANAGEMENT (U.S.) LLC's clients are affiliates that are a part of Sun Life Financial enterprise, including BentallGreenOak (U.S.) LP.  Certain such clients of the Adviser may engage in principal transactions from time to time with other affiliates.  The Adviser generally does not recommend or direct these transactions.  To the extent it does so, it would comply with applicable requirements for principal transactions. Likewise, certain affiliates of the Adviser invest for their own account and may, as a result, buy or sell securities that the Adviser purchases or sells, or recommends for purchase or sale, for clients."
