"FilingID","Miscellaneous"
2006832,"Xponance has taken over all of the assets and liabilities of the predecessor registrant, and there has been virtually no change in control or ownership of the investment adviser."
2011523,"THE REGISTRANT HAS RELATED SEC-REGISTERED ADVISERS WHO MANAGE LPS, LLCS OR OTHER PRIVATE FUNDS THAT ARE NOT LISTED IN SECTION 7B OF SCHEDULE D OF THIS ADV. THE LPS, LLCS OR OTHER PRIVATE FUNDS ARE LISTED IN THE ADVS OF THE RELATED SEC-REGISTERED INVESTMENT ADVISERS. IN THE CASE OF AN ENTITY FORMED TO ACT AS THE GENERAL PARTNER OF A PRIVATE FUND LISTED IN SCHEDULE D SECTION 7.A., THE ENTITY RELIES UPON THE REGISTERED INVESTMENT ADVISER?S REGISTRATION WITH THE SEC AND HAS NOT SUBMITTED A SEPARATE FORM ADV PURSUANT TO THE 2012 SEC NO ACTION LETTER REGARDING ADVISORY AFFILIATES. PLEASE NOTE THAT ALL RESPONSES ARE GENERALLY AS OF DECEMBER 31, 2024. ITEMS 5, 9, AND SCHEDULE D ITEM 7.B INCLUDES INFORMATION FOR CLIENTS THAT LAUNCHED PRIOR TO MARCH 1, 2025 AND DATA FOR THOSE CLIENTS THAT LAUNCHED AFTER DECEMBER 31, 2024 IS AS OF THE RELEVANT LAUNCH DATE IN Q1 2025. ITEMS 5, 9, AND SCHEDULE D ITEM 7.B EXCLUDES CLIENTS WHICH TERMINATED OR DISSOLVED PRIOR TO MARCH 1, 2025. WE HAVE INCLUDED THE GROSS ASSETS OF THE SPECIAL PURPOSE LPS OR LLCS AND AIVS IN THE GROSS ASSETS OF THE FUNDS TO WHICH THEY RELATE. WE HAVE NOT INCLUDED THE SHARE OF GROSS ASSETS OF THE AGGREGATING OR COINVESTMENT VEHICLES OWNED BY INVESTORS OTHER THAN THE FUND IN THE GROSS ASSETS OF THE RELATED FUND. THE SPVS, AIVS, AGGREGATING AND CO-INVESTMENT VEHICLES ARE ALSO NOT SEPARATELY COUNTED AS ?ACCOUNTS? OR ?CLIENTS? FOR PURPOSES OF ITEMS 5 AND 9. SECTION 7.A OF SCHEDULE D DOES NOT INCLUDE THE GENERAL PARTNERS OF SUCH SPVS, AIVS, AGGREGATING AND COINVESTMENT VEHICLES TO THE EXTENT SUCH GENERAL PARTNER IS DIFFERENT THAN THE GENERAL PARNER OF THE RELATED FUND. UPON REQUEST, COMPLETE INFORMATION ABOUT SUCH VEHICLES AND THEIR GENERAL PARTNERS WILL BE MADE AVAILABLE TO THE STAFF OF THE SEC. INFORMATION PROVIDED IN ITEM 5 INCLUDES REGULATORY ASSETS UNDER MANAGEMENT ATTRIBUTABLE TO ASSETS THAT CLIENTS HAVE INVESTED IN CLIENTS ADVISED BY OTHER AFFILIATED ADVISERS AND ASSETS WITH RESPECT TO WHICH THE ADVISER HAS DELEGATED INVESTMENT ADVISORY AUTHORITY TO OTHER AFFILIATED ADVISERS (E.G., IN THE CASE OF A SUB-ADVISORY RELATIONSHIP). AS A RESULT, PER THE INSTRUCTIONS OF FORM ADV, THOSE ASSETS WILL BE INCLUDED IN THE RAUM BOTH FOR THE ADVISER AND SUCH OTHER AFFILIATED ADVISERS. INFORMATION PROVIDED IN ITEM 5 EXCLUDES REGULATORY ASSETS UNDER MANAGEMENT ATTRIBUTABLE TO AN INVESTMENT BY ONE CLIENT IN ANOTHER CLIENT THAT WOULD REPRESENT A DUPLICATION OF ASSETS ALREADY INCLUDED IN CALCULATING REGULATORY ASSETS UNDER MANAGEMENT (SO THAT SUCH ASSETS ARE COUNTED ONLY ONCE). HOWEVER, TO THE EXTENT EITHER OR BOTH OF THE RELEVANT CLIENTS IS A PRIVATE FUND, THE GROSS ASSET VALUE REPORTED IN QUESTION 11 OF SECTION 7.B.(1) FOR EACH SUCH PRIVATE FUND INCLUDES ANY SUCH REGULATORY ASSETS UNDER MANAGEMENT ATTRIBUTABLE TO THE AMOUNT INVESTED IN OR BY THE OTHER CLIENT. WHERE ""NO"" IS INDICATED FOR QUESTION 21 ON ITEM 7.B, THE OFFEROR RELIED ON EITHER SECTION 4(A)(2) OF THE SECURITIES ACT OF 1933 OR REGULATION S THEREUNDER.  FURTHERMORE, IN SECTION 7.A OF SCHEDULE D, THE FOLLOWING ENTITIES ARE PORTFOLIO COMPANIES OF BLACKSTONE'S PRIVATE FUNDS AND ARE LICENSED AS BANKS, INSURANCE COMPANIES, REGISTERED BROKER DEALERS AND/OR INVESTMENT ADVISERS: ASK INVESTMENT MANAGERS LTD.; REDPIN HOLDINGS LTD.; ELIC REINSURANCE COMPANY; EVERLAKE ASSURANCE COMPANY; EVERLAKE DISTRIBUTORS L.L.C.; EVERLAKE LIFE INSURANCE COMPANY; EVERLAKE REINSURANCE LIMITED; FEF DISTRIBUTORS, LLC; FINANCE OF AMERICA CAPITAL MANAGEMENT LLC; FINANCE OF AMERICA SECURITIES LLC;FIRST EAGLE ALTERNATIVE CREDIT EU MOA LTD.; FIRST EAGLE ALTERNATIVE CREDIT EU, LLC; FIRST EAGLE ALTERNATIVE CREDIT FUNDING, LLC; FIRST EAGLE ALTERNATIVE CREDIT, LLC; FIRST EAGLE DIRECT LENDING MANAGER III LLC; FIRST EAGLE INVESTMENT MANAGEMENT, LLC; FIRST EAGLE SEPARATE ACCOUNT MANAGEMENT LLC; HERALD REINSURANCE LIMITED; KI FINANCIAL LIMITED; LUMINOR BANK AS; MIDWESTERN UNITED LIFE INSURANCE COMPANY; NAPIER PARK GLOBAL CAPITAL (US) LP; NIBC BANK N.V.; NIBC CREDIT MANAGEMENT, INC.; PRIMA ASSICURAZIONI S.P.A.; PROSPECT REINSURANCE LIMITED; REGATTA LOAN MANAGEMENT LLC; RESOLUTION LIFE AUSTRALASIA LIMITED; RESOLUTION LIFE COLORADO, INC.; RESOLUTION LIFE GROUP HOLDINGS LTD.; RESOLUTION LIFE NEW ZEALAND LTD.; RESOLUTION RE LTD.; RLNM LIMITED; ROARING RIVER II, INC.; SECURITY LIFE OF DENVER INSURANCE COMPANY; SECURITY LIFE OF DENVER INTERNATIONAL LIMITED; SLD AMERICA EQUITIES, INC.; AND WESTLAND INSURANCE GROUP LTD. LEXINGTON NATIONAL LAND SERVICES, WHICH IS LISTED AS A RELATED PERSON IN ITEM 7.A OF THIS FORM ADV, IS WHOLLY OWNED BY BLACKSTONE HOLDINGS I L.P. GRYPHON MUTUAL INSURANCE COMPANY, WHICH IS LISTED AS A RELATED PERSON IN ITEM 7.A OF THIS FORM ADV, IS A CAPTIVE PROPERTY INSURANCE COMPANY THAT IS OWNED BY ITS PARTICIPANTS (WHICH ARE BLACKSTONE REAL ESTATE FUND INVESTMENTS) AND IS MANAGED BY AN AFFILIATE OF BLACKSTONE. FURTHERMORE, REGARDING SCHEDULE B, FOR EACH ENTRY INCLUDING EITHER OF BLACKSTONE INC. AND BLACKSTONE HOLDINGS I/II GP LLC, THE ""DATE STATUS ACQUIRED"" INDICATES THE DATE THE APPLICABLE ENTITY ORIGINALLY ACQUIRED SUCH STATUS, NOTWITHSTANDING ANY CHANGE IN CORPORATE FORM OF BLACKSTONE INC. OR BLACKSTONE HOLDINGS I/II GP LLC. ITEM 8.G.(1) INDICATES ""YES"" BECAUSE A RELATED PARTY OF THE REGISTRANT MAY RECEIVE SOFT DOLLAR BENEFITS. THE REGISTRANT CURRENTLY HAS NO ""SOFT DOLLAR"" ARRANGEMENTS. HOWEVER, FROM TIME TO TIME, THE REGISTRANT WILL USE FULL SERVICE BROKER-DEALERS THAT PROVIDE RESEARCH OR OTHER PRODUCTS OR SERVICES TO SOME OR ALL OF THEIR CUSTOMERS (E.G., PERIODIC RESEARCH AND MARKET COMMENTARY PUBLICATIONS, NEWSLETTERS AND OTHER COMMUNICATIONS), AND THE REGISTRANT WILL ON OCCASION RECEIVE AND MAY USE SUCH RESEARCH PROVIDED BY THESE BROKER DEALERS. PLEASE NOTE THAT BLACKSTONE INC. IS THE ULTIMATE PARENT COMPANY OF THE REGISTRANT. THE EMPLOYEE INFORMATION PROVIDED IN ITEMS 5.A AND 5.B IS AS OF FEBRUARY 28, 2025 AND INCLUDES PERSONNEL OF THE REGISTRANT AND THE REGISTRANTS AFFILIATES WITHIN THE BLACKSTONE MULTI-ASSET INVESTING GROUP (?BXMA?), EXCEPT FOR PERSONNEL OF HARVEST FUND ADVISORS L.L.C. CERTAIN BLACKSTONE PERSONNEL WHO ARE DEDICATED TO COVERING THE REGISTRANT AND THE REGISTRANTS AFFILIATES IN BXMA ARE ALSO INCLUDED IN THE EMPLOYEE INFORMATION PROVIDED IN ITEMS 5.A AND 5.B. RELEVANT BLACKSTONE PERSONNEL WOULD INCLUDE, FOR EXAMPLE, CERTAIN EMPLOYEES IN BLACKSTONE?S LEGAL & COMPLIANCE, FUND FINANCE AND TECHNOLOGY DEPARTMENTS. REGISTRANT?S PRIVATE FUNDS LISTED IN SECTION 7.B.(1) ARE SUBJECT TO ANNUAL AUDITS BUT CERTAIN FUNDS LISTED COMMENCED OPERATIONS AFTER DECEMBER 31, 2024 AND, AS A RESULT, THE FIRST AUDIT WILL BE CONDUCTED FOR THE YEAR ENDING DECEMBER 31, 2025. AS SUCH, REGISTRANT HAS INDICATED IN SECTION 7.B.(1), QUESTION 23 FOR THESE FUNDS THAT THE PRIVATE FUNDS? FINANCIAL STATEMENTS ARE SUBJECT TO AN ANNUAL AUDIT, SUCH AUDITED FINANCIALS ARE PREPARED IN ACCORDANCE WITH U.S. GAAP, THE AUDITED FINANCIALS ARE DISTRIBUTED TO THE PRIVATE FUNDS? INVESTORS, BUT THAT THE REPORTS PREPARED BY THE AUDITING FIRM FOR THE PRIVATE FUND HAVE NOT YET BEEN RECEIVED.  RESPONSES TO THE QUESTIONS IN ITEM 5.L REFLECT THE PERIOD FROM THE DATE OF THE REGISTRANT?S LATEST ANNUAL AMENDMENT TO FORM ADV THROUGH MARCH 1, 2025."
2011552,"8/25/2025 - Schedule A has been updated to reflect Verecan Group Inc.'s Canadian Business Number."
2010230,"RESEARCH AFFILIATES GLOBAL ADVISORS (EUROPE) LIMITED IS A UK COMPANY THAT IS AN AFFILIATE OF RESEARCH AFFILIATES, LLC DUE TO COMMON OWNERSHIP. IT DOES NOT ENGAGE IN FINANCIAL SERVICE OR ADVISORY ACTIVITIES AND WAS THEREFORE NOT INCLUDED IN SECTION 7.A.; EMPLOYEES IN THAT OFFICE PROVIDE SUPPORT SERVICES TO CERTAIN NON-ADVISORY LICENSEES OF RESEARCH AFFFILIATES, LLC THAT ARE PRIMARILY BASED IN EUROPE. RESEARCH AFFILIATES GLOBAL ADVISORS (EUROPE) LIMITED IS A WHOLLY OWNED SUBSIDIARY OF RESEARCH AFFILIATES GLOBAL HOLDINGS, LLC.  RAFI INDICES, LLC IS A CALIFORNIA LIMITED LIABILITY COMPANY THAT IS AN AFFILIATE OF RESEARCH AFFILIATES, LLC DUE TO COMMON OWNERSHIP. RAFI INDICES, LLC WAS NOT INCLUDED IN SECTION 7.A. BECAUSE IT CONSTRUCTS, PUBLISHES, AND LICENSES VARIOUS INDICES AND DOES NOT OFFER OR PROVIDE INVESTMENT ADVICE OR OFFER OR SELL ANY SECURITIES, COMMODITIES OR DERIVATIVE INSTRUMENTS OR PRODUCTS IN ANY JURISDICTION. RAFI INDICES, LLC HAS LICENSED INTELLECTUAL PROPERTY TO AND RECEIVES CONTRACT-BASED SERVICES FROM RESEARCH AFFILIATES, LLC. RAFI INDICES, LLC IS A WHOLLY OWNED SUBSIDIARY OF RESEARCH AFFILIATES GLOBAL HOLDINGS, LLC."
2011890,"SCHEDULE B.  THE TIAA BOARD OF GOVERNORS IS A NEW YORK NOT-FOR-PROFIT CORPORATION, AND REFLECTS THE ULTIMATE INDIRECT OWNER OF THE REGISTRANT. SCHEDULE D, SECTION 7.A: WHILE SECTION 7.A OF SCHEDULE D OF THIS FORM ADV INCLUDES ADVISORY AFFILIATES AND OTHER RELATED PERSONS OF THE REGISTRANT, IT EXCLUDES THE GENERAL PARTNERS (OR SIMILAR) OF POOLED INVESTMENT VEHICLES ADVISED BY THE REGISTRANT?S ADVISORY AFFILIATES WHICH GENERAL PARTNERS (OR SIMILAR) ARE REPORTED IN THE ADV OF SUCH SEC-REGISTERED INVESTMENT ADVISERS. FURTHERMORE, SECTION 7.A OF SCHEDULE D, EXCLUDES RELATED PERSONS FOR WHICH THE REGISTRANT (1) HAS NO BUSINESS DEALINGS WITH IN CONNECTION WITH ADVISORY SERVICES THE REGISTRANT PROVIDE TO ITS CLIENTS; (2) DOES NOT CONDUCT SHARED OPERATIONS WITH THE RELATED PERSON; (3) DOES NOT REFER CLIENTS OR BUSINESS TO THE RELATED PERSON, AND THE RELATED PERSON DOES NOT REFER PROSPECTIVE CLIENTS OR BUSINESS TO THE REGISTRANT; (4) DOES NOT SHARE SUPERVISED PERSONS OR PREMISES WITH THE RELATED PERSON; AND (5) DOES NOT HAVE REASON TO BELIEVE THAT THE REGISTRANT'S RELATIONSHIP WITH THE RELATED PERSON OTHERWISE CREATES A CONFLICT OF INTEREST WITH THE REGISTRANT'S CLIENTS. UPON REQUEST, COMPLETE INFORMATION ABOUT SUCH RELATED PERSONS AND GENERAL PARTNERS, AS APPLICABLE, WILL BE MADE AVAILABLE TO THE STAFF OF THE SEC."
2011734,"The Advisor respectfully requests a September 3, 2025 approval date."
2011245,"REGISTRANT AND ITS AFFILIATES HAVE LITTLE TO NO VISIBILITY INTO THE UNDERLYING INVESTORS IN THE COLLATERALIZED DEBT OBLIGATION VEHICLES (""CDOS""), COLLATERALIZED LOAN OBLIGATION VEHICLES (""CLOS"") AND ASSET BACKED SECURITY VEHICLES (""ABS"") IT MANAGES THAT ARE LISTED IN SCHEDULE D SECTION 7.B.1. THUS, REGISTRANT IS UNABLE TO PROVIDE CERTAIN INFORMATION ON THE COMPOSITION OF THE INVESTORS (E.G., NUMBER OF BENEFICIAL OWNERS, NUMBER OF FUND OF FUNDS INVESTORS, NUMBER OF NON-U.S. INVESTORS) AND HAVE INCLUDED ""0"" (ZERO) IN ITS RESPONSE TO THOSE QUESTIONS WITH RESPECT TO THE CDOS, CLOS AND ABS."
2009955,"08/2025: This Other-than-Annual Amendment is being filed to update Section 7.A Financial Industry Affiliations and to upload the updated Form ADV Part 2A and 2B."
2008411,"Item 9 does not allow the Firm to indicate that the firm has custody of $196,784,038 as a result of third-party standing letters of authorization. The Firm has implemented procedures to comply with the requirements outlined by the SEC in its February 21, 2017 No-Action Letter to the Investment Adviser Association and thus are not required to receive an audit for these funds.  The firm uses cloud based storage solutions for certain books and records documents. The Firm uses Redtail for CRM system and Smarsh for email archiving."
2010731,"Item 5.L.(1)(b): We responded ""yes"" to this question because Saluda Grade has referenced specific investment advice in advertisements, and any such references are done in a fair and balanced manner.  Effective June 30, 2025, we revised our methodology for calculating our RAUM to include the assets of securitization vehicles that are actively managed by Saluda, even though the securitization vehicles are not ?private funds? because they rely on the exemption under Section 3(c)(5)(C) of the Investment Company Act, and are therefore not included as private funds in response to Item 7."
2011999,"The registrant has two related persons who provide research services to the registrant but have no discretionary, supervisory or management authority.  Their addresses are as follows: SVP Japan LLC, Tokyo Club Building, 8th Floor, 3-2-6 Kasumigaseki, Japan 100-0013, and SVP Global (Spain) S.L., Calle Principe de Vergara, 112, Madrid, Spain 28002.  To the extent these related persons provide assistance to the registrant, their books and records are available for inspection by the SEC.    Strategic Value Partners, LLC also maintains office space in the Dubai International Financial Centre.  As a general matter, no investment advisory business is conducted out of this office; therefore, we have not reported this as an ?Other Office? for purposes of Item 1.F.    For Item 1.L, the registrant and its affiliates have contracted with certain third-party cloud service providers to store investor-related information, company and clients records at one or more data centers. To the extent that such information is stored electronically but accessible at the registrant's principal office in Greenwich, Connecticut, such cloud service providers have not been included in this response as access to those books and records are available at the registrant's principal office in Greenwich, Connecticut.  For the purposes of Section 1.M, Strategic Value Partners, LLC has registered in Dubai with the Dubai Financial Services Authority as a representative office.    Certain funds have made investments though alternative investment vehicles (?AIVs?) or special purpose vehicles (?SPVs?) that we have formed to facilitate investments for tax, regulatory or other structuring reasons.  The AIVs and SPVs have not been separately reported in Items 5, 7.B and 9.  The assets of these AIVs and SPVs are included in the regulatory assets under management, the gross value of the funds to which they relate, and the amount of client funds and securities in custody.   For item 5.F.(3), we calculated our total regulatory assets under management attributable to clients who are non-United States Persons by reference to the regulatory assets under management of our Cayman Islands-domiciled master funds minus any regulatory assets under management held at the level of our Delaware-domiciled feeder funds.   For item 5.J.(1), with respect to one of our client funds, our authority to make investments on behalf of the fund is limited to the acquisition of certain financial instruments that meet the fund?s investment mandate, and that are sourced and contributed to the fund by its sole limited partner, or an affiliate thereof.  We do, however, have discretion to cause this fund to acquire additional investments from third parties in the same or related financial instruments to those that were contributed to the fund."
2012051,"M83 Investment Group, LLC was established as a wholly owned subsidiary of Morton Wealth (""Morton""), a registered investment adviser. Its sole client is 83 Investment Group Income Fund, a closed end fund registered under the Investment Company Act of 1940 (""83IG""). 83IG was originally formed as a private fund and was reorganized into a registered fund effective 12/31/2024."
2013047,"We have answered Question 9f as ""1"" since we direct deduct advisory fees from 1 Custodian."
2013056,"If you or your related persons have custody of client funds or securities, how many persons, including, but not limited to, you and your related persons, act as qualified custodians for your clients in connection with advisory services you provide to clients? Hantz Alternatives Management Company, LLC (an entity under common control), has custody of customer funds for the purpose of investing in the feeder fund(s).  Furthermore, Hantz Agency, LLC, an affiliate of Hantz Financial Services, Inc. has limited, temporary custody of customer funds in the payment of insurance premiums to the insurance company (or insurer)."
2013135,"1.B. Castleview Partners LLC provides services to other registered entities under the trade name aiAlpha TAMP Services."
2013178,"DUE TO COMMON CONTROL PERSONS OF IPG INVESTMENT ADVISORS ALSO CONTROL INVESTMENT PLACEMENT COMMODITIES A FUTURES AND COMMODITIES INTRODUCING BROKER REGISTERED WITH THE NATIONAL FUTURES ASSOCIATION.///  IPG INVESTMENT ADVISORS DUE TO THE COURSE OF ITS INVESTMENT ADVISORY BUSINESS MEETS APPLICABILITY FOR INVESTMENT ADIVORS TO SECTION 4(m)1 OF THE COMMODITY EXCHANGE ACT WHICH PROVIDES AN EXEMPTION FROM REGISTRATION FROM ACTING AS A COMMODITY TRADING ADVISER TO A LIMITED (LESS THAN 15) CLIENTS THAT AS PART OF THEIR INVESTMENT STRATEGIES MAY FROM TIME TO TIME INVEST IN COMMODITIES AND/OR FUTURES.///   DUE TO COMMON OWNERSHIP PERSONS OF INVESTMENT PLACEMENT GROUP, (A CALIFORNIA CORPORATION AND BROKER-DEALER FIRM) AND IPG INVESTMENT ADVISORS, LLC, ARE ""RELATED PERSONS"" AND RESPONDED ACCORDINGLY IN PART 1, ITEMS 7.A., 8.A(1), 9.B(1)(2), AND ITEM 11.E(2). IMPORTANTLY, IPG INVESTMENT ADVISORS, LLC, WILL CONDUCT AGENCY CROSS  TRANSACTIONS IN ACCORDANCE WITH SEC RULE 203-6 AND ONLY EXECUTE THEM WITH A WRITTEN CONSENT FROM CLIENTS.///  IPG INVESTMENT ADVISORS SHALL HAVE CUSTODY OF CLIENT ASSETS DUE TO ITS DEDUCTION OF ADVISORY FEES FROM THE CLIENTS' ACCOUNTS AT THE CUSTODIAN INSTITUTIONS.///  MEMBERS OF IPG INVESTMENT ADVISORS ARE CONTROLLING MEMBERS OF I-KAPITAL ADVISOR SOCIEDAD ANONIMA PROMOTORA DE INVERSION DE CAPITAL VARIABLE, A MEXICAN ENTITY THAT HAS A MINORITY OWNERWHISP IN SC ASESORES EN INVERSIONES INDEPENDIENTES SA DE CV, A REGISTERED INVESTMENT ADVISOR IN MEXICO.///  MEMBERS OF IPG INVESTENT ADVISORS ARE CONTROLLING MEMBERS OF BLUEPOINT LLC., A CALIFORNIA LIMITED LIABILITY COMPANY A GENERAL AND/OR LIMITED PARTNER OF CERTAIN REAL ESTATE PRIVATE PLACEMENTS.///  COMPENSATION ARRANGEMENTS (SECTION 5 E) A PERCENTAGE OF ASSETS UNDER MANAGEMENT, FIXED FEES (OTHER THAN SUBSCRIPTION FEES), COMMISSIONS, AND FAMILY OFFICE FEES, SERVICE FEES, FINDERS FEES AND 12B-1 FEES VIA AFFILIATE BROKER DEALER.   IPG Investment Advisors LLC may from time to time advise a limited number of clients (less than 5) on commodities and futures as part of their their portfolio strategy. to that effect and according to NFA regulations Section 4(m) 1 of the Commodity Exchange Act provides an exemption from registration for a person who in the preceding twelve months has not furnished commodity trading advance to more than 15 persons and who does not hold himself to the public as a Commodities Trading Advisor ""CTA"". Section 4m(3) provides an exception from registration for a person who is registered wiht the Securities and Exchange Commission as an investment advisors."
2007129,"Responses to Item 5.L., Marketing Activities, reflect current marketing activities and do not relate to prior marketing activities or materials for funds that are now closed to new investors and no longer being marketed. Although the response to Item 8.A.(2) is ""No"", employees may transact in shares of exchange-traded funds in which the funds have also invested, and employees may hold and subsequently sell personal securities bought prior to employment which may also be held by the funds. Employees are generally prohibited from engaging in personal securities trading of, or holding any reportable security of issuers in, the healthcare industry with the exception of healthcare related exchange-traded funds."
2012964,"Registrant's response to Item 9.A.(2) is comprised of assets in accounts from which registrant has the authority to transfer funds via standing letter of authorization (SLOA).  These transfer authorizations meet the requirements of the SEC's Feb 21 2017 No Action Letter on Custody.  Therefore, these assets are not subject to an annual surprise examination."
2013260,"Schedule A: Individuals showing no middle name have none. Item 5D(m), Type of Client:  Ten corporations are shown as clients with no assets under management.  These are holding companies for several of the insurance companies listed under Section 5D(k). Both the holding companies and their subsidiary insurance companies have signed Bricktown Capital LLC?s agreements, so both sets of entities are considered to be clients."
2007905,"ITEM 5.I(2) AND ITEM 6.B(3). DAVIDSON PROVIDES SEVERAL INVESTMENT STRATEGIES VIA A MODEL-BASED SOLUTION TO OTHER INVESTMENT ADVISERS AND BROKER/DEALERS.    ITEM 5.G.(3). DAVIDSON INVESTMENT ADVISORS ACTS AS INVESTMENT ADVISER TO THE DAVIDSON FUNDS, WHICH IS A SERIES OF THE ADVISER SERIES TRUST, REGISTERED UNDER THE INVESTMENT COMPANY ACT OF 1940 AS AN OPEN-END MANAGEMENT INVESTMENT COMPANY.  U.S. BANK GLOBAL FUND SERVICES ACTS AS THE FUND'S ADMINISTRATOR AND PROVIDES FUND ACCOUNTING AND TRANSFER AGENCY SERVICES.  EFFECTIVE MARCH 31, 2015, SEACAP INVESTMENT ADVISORS BEGAN TO OPERATE AS A DIVISION OF DAVIDSON INVESTMENT ADVISORS, INC. SEACAP INVESTMENT ADVISORS FORMERLY OPERATED AS A DIVISION OF DAVIDSON FIXED INCOME MANAGEMENT, INC. EFFECTIVE JANUARY 1, 2019, DAVIDSON INVESTMENT ADVISORS DISCONTINUED USAGE OF THE NAME SEACAP, A DIVISION OF DAVIDSON INVESTMENT ADVISORS.  ON MARCH 1, 2023, DAVIDSON INVESTMENT ADVISORS COMPLETED ITS ACQUISITION OF CAPRIN ASSET MANAGEMENT, LLC.  CAPRIN, A PROVIDER OF MUNICIPAL AND TAXABLE FIXED INCOME INVESTMENT ADVISORY SERVICES, OPERATES AS ""CAPRIN ASSET MANAGEMENT, A DIVISION OF DAVIDSON INVESTMENT ADVISORS."""
2013285,"Craig Phillips, as trustee, has custody of a brokerage account that is held at a custodian for one irrevocable trust, with an ongoing balance of approx. $250,000 at the request of the current client/grantor.  We contract with a qualified public accountant for an annual surprise audit under the custody rules."
2004448,"Section 7A - Financial Industry affiliations- listed DCP360 dba Saveday as broker dealer because it's affiliate, Kapitall Generation, is a broker dealer. DCP360 itself is NOT a broker dealer"
2012047,"Item 9.A.(1)(a). We have said that we have custody of client cash due solely to accounts with standing third-party letters of authorization (SLOAs) that meet the seven conditions of an SEC no-action letter on this topic."
2012378,"On August 29, 2025, Ryan Carney was appointed Interim Chief Compliance Officer, as successor to Louis Albenga, former Chief Compliance Officer."
2012878,"Schedule A. Question 7. - Direct Owners and Executive Officers: The following persons do not have a middle name: KLASSEN, FREDDI AND PEARSON, CAROLINE AND UZCAN, HEPSEN. The following person has their middle name?s initial reported : Catrambone, George, L.  ITEM 7A: REGISTRANT HAS ADDITIONAL RELATED ENTITIES THAT ENGAGE IN FINANCIAL INDUSTRY-RELATED ACTIVITIES. REGISTRANT DOES NOT: (1) HAVE BUSINESS DEALINGS WITH THESE RELATED ENTITIES IN CONNECTION WITH ADVISORY SERVICES PROVIDED TO REGISTRANT'S CLIENTS; (2) CONDUCT SHARED OPERATIONS WITH THESE RELATED ENTITIES; (3) REFER CLIENTS OR BUSINESS TO THE RELATED ENTITIES, AND THE RELATED ENTITIES DO NOT REFER PROSPECTIVE CLIENTS OR BUSINESS TO REGISTRANT; (4) SHARE SUPERVISED PERSONS OR PREMISES WITH RELATED PERSON; AND (5) HAVE REASON TO BELIEVE THAT ITS RELATIONSHIPS WITH THESE RELATED ENTITIES OTHERWISE CREATE A CONFLICT OF INTEREST WITH ITS CLIENTS. REGISTRANT MAINTAINS A SUPPLEMENTARY LIST OF SUCH RELATED ENTITIES THAT ARE NOT LISTED IN SCHEDULE D, SECTION 7.A. FOR THE REASONS PROVIDED ABOVE. THIS LIST IS AVAILABLE UPON REQUEST."
2012719,"DIAL COMPLIES WITH THE U.S. INVESTMENT ADVISERS ACT OF 1940 (THE ""ADVISERS ACT"")ONLY WITH RESPECT TO ITS U.S. CLIENTS. NON U.S. CLIENTS WILL NOT BE SUBJECT TO THE PROTECTIONS OF THE ADVISERS ACT."" DIAL RELIES ON MERCURY ASSET MANAGEMENT PROCEDURES AND SATISFIES THE PORTFOLIO MANAGER DISCLOSURE BY THE DISTRIBUTION OF THE FORM ADV PART 2B.    SECTION 5.A. OF SCHEDULE D -- ALL OF THE REGISTRANT'S BUSINESS IS PURSUANT TO A SUB-ADVISORY OR CO-ADVISORY AGREEMENT WITH AN AFFILIATED U.S. ADVISER. TO PROVIDE MORE DETAILED DISCLOSURE IN ITEM 5D, WE HAVE LOOKED THROUGH TO THE UNDERLYING CLIENTS FOR PURPOSES OF CLASSIFICATION. THEREFORE, WE DO NOT DISCLOSE THAT 100% OF THE REGISTRANT'S CLIENTS ARE ""OTHER INVESTMENT ADVISERS,"" BUT INSTEAD WE CLASSIFIED THEM ACCORDING TO THE UNDERLYING CLIENT (INVESTMENT COMPANIES, POOLED INVESTMENT VEHICLES, AND SO ON.   SECTION 5.K.3. - THE CUSTODIANS FOR SEPARATELY MANAGED ACCOUNTS HAVE BEEN AGGREGATED TO REFLECT EACH CUSTODIAN THAT HOLDS 10% OR MORE OF THE REGULATORY ASSETS UNDER MANAGEMENT.  ITEM 7A: REGISTRANT HAS ADDITIONAL RELATED ENTITIES THAT ENGAGE IN FINANCIAL INDUSTRY-RELATED ACTIVITIES. REGISTRANT DOES NOT: (1) HAVE BUSINESS DEALINGS WITH THESE RELATED ENTITIES IN CONNECTION WITH ADVISORY SERVICES PROVIDED TO REGISTRANT'S CLIENTS; (2) CONDUCT SHARED OPERATIONS WITH THESE RELATED ENTITIES; (3) REFER CLIENTS OR BUSINESS TO THE RELATED ENTITIES, AND THE RELATED ENTITIES DO NOT REFER PROSPECTIVE CLIENTS OR BUSINESS TO REGISTRANT; (4) SHARE SUPERVISED PERSONS OR PREMISES WITH RELATED PERSON; AND (5) HAVE REASON TO BELIEVE THAT ITS RELATIONSHIPS WITH THESE RELATED ENTITIES OTHERWISE CREATE A CONFLICT OF INTEREST WITH ITS CLIENTS. REGISTRANT MAINTAINS A SUPPLEMENTARY LIST OF SUCH RELATED ENTITIES THAT ARE NOT LISTED IN SCHEDULE D, SECTION 7.A. FOR THE REASONS PROVIDED ABOVE. THIS LIST IS AVAILABLE UPON REQUEST."
